title,url,view,channel_name,channel_subscriber,create_stamp,mean_view,mean_comparison
らっぽぎ？ラーメンとトッポギめっちゃ合うやん美味しかったよ☆,/watch?v=50_iNPE_8QQ,2591,あっちゃん☆ねる,1130000,6か月前,3044,85
らっぽぎ？ラーメンとトッポギの融合なんじゃこれ？☆,/watch?v=SkmwaN2mbU8,2241,あっちゃん☆ねる,1130000,6か月前,3044,74
久々にフルグラで朝ごはん☆,/watch?v=mR1x3eZH0m8,2303,あっちゃん☆ねる,1130000,6か月前,3044,76
さたでーないと楽しくライブ☆,/watch?v=1Wu78VdXwWI,5207,あっちゃん☆ねる,1130000,6か月前,3044,171
奈良公園の食べ歩きは続きますw☆,/watch?v=MBPsWKv8RAw,5237,あっちゃん☆ねる,1130000,6か月前,3044,172
観光客も居ない穴場】国宝キトラ古墳行ってきたよ☆,/watch?v=Ya6jQIL9VCc,2559,あっちゃん☆ねる,1130000,6か月前,3044,84
ニュータッチ凄麺長崎ちゃんぽん食べました☆,/watch?v=oKDKvnXPy1o,2456,あっちゃん☆ねる,1130000,6か月前,3044,81
あったかお弁当】鶏ももの中華風てりやき弁当☆３学期１７日目高校男子のお弁当つくり２４０日目,/watch?v=lVHYzDQavqs,950,あっちゃん☆ねる,1130000,6か月前,3044,31
久々にバタートースト☆,/watch?v=FNMUI2mFpYY,2257,あっちゃん☆ねる,1130000,6か月前,3044,74
眠くなったら終わる定期ライブ☆,/watch?v=v8z8L9fqYrE,4788,あっちゃん☆ねる,1130000,6か月前,3044,157
大阪オートメッセとあっちゃん☆デニムバッグ等の告知☆,/watch?v=iGMfHCf9dtQ,2713,あっちゃん☆ねる,1130000,6か月前,3044,89
晩ごはんは唐揚げ☆,/watch?v=m-9BSQf3rIU,4274,あっちゃん☆ねる,1130000,6か月前,3044,140
ここはどこ？,/watch?v=cmW8YjREQZM,3060,あっちゃん☆ねる,1130000,6か月前,3044,101
フライドチキン作ろ☆,/watch?v=WT4DhxnDahQ,1683,あっちゃん☆ねる,1130000,6か月前,3044,55
久々にミスド食べました☆,/watch?v=HO2a_W3747Q,2515,あっちゃん☆ねる,1130000,6か月前,3044,83
鶏むねのパン粉焼き３味食べましょ☆,/watch?v=Im76ja9alyk,2493,あっちゃん☆ねる,1130000,6か月前,3044,82
鶏むねのパン粉焼き３味作りましょ☆,/watch?v=QAuWGJvhkPo,1376,あっちゃん☆ねる,1130000,6か月前,3044,45
ノーパソバッグかわいいの見つけた☆,/watch?v=PWkTcemvcjk,2796,あっちゃん☆ねる,1130000,6か月前,3044,92
ベーコンピザトーストバジル増し☆,/watch?v=BVsC3gFEOrc,2062,あっちゃん☆ねる,1130000,6か月前,3044,68
あったかお弁当】イタリアン風焼き肉弁当☆３学期１６日目高校男子のお弁当つくり２３９日目,/watch?v=RyUEY_XtUL0,701,あっちゃん☆ねる,1130000,6か月前,3044,23
今夜もちょこっと生配信☆,/watch?v=8xeGAcFVTEU,3579,あっちゃん☆ねる,1130000,6か月前,3044,118
マクドナルド】限定新製品ぜんアツ！ダブチｖｓアツ！ニクダブチ食べ比べ☆,/watch?v=4dWYhtDosas,5075,あっちゃん☆ねる,1130000,6か月前,3044,167
ニュータッチ凄麺・富山ブラック食べてみたよ☆,/watch?v=hkcrQEKhRhM,2539,あっちゃん☆ねる,1130000,6か月前,3044,83
未知のコロナウイルス、過剰反応？過小評価？どっちが安全？,/watch?v=aIHUodVP10A,4751,あっちゃん☆ねる,1130000,6か月前,3044,156
オイスター焼き肉ピザトースト☆,/watch?v=ueIfj300hR0,2877,あっちゃん☆ねる,1130000,6か月前,3044,95
あったかお弁当】オイスター焼き肉弁当☆３学期１５日目高校男子のお弁当つくり２３８日目,/watch?v=cl9NliafX0s,927,あっちゃん☆ねる,1130000,6か月前,3044,30
コロナウイルスこんな対応で大丈夫か？☆,/watch?v=5bb4h5GU7E4,8111,あっちゃん☆ねる,1130000,6か月前,3044,266
コロナウイルスこんな対応で大丈夫か？☆,/watch?v=KMsTxqFjEVc,2857,あっちゃん☆ねる,1130000,6か月前,3044,94
近鉄急行榛原～伊勢市右側車窓☆,/watch?v=VGL__tO0ASQ,823,あっちゃん☆ねる,1130000,6か月前,3044,27
約束守れなくなってごめんね,/watch?v=SBsMx3gvOWk,5136,あっちゃん☆ねる,1130000,6か月前,3044,169
伊勢神宮からおかげ横丁に戻ってきて視聴者さんと合流ぅ～☆,/watch?v=r3RKvRqcGe4,3028,あっちゃん☆ねる,1130000,6か月前,3044,99
人生初伊勢神宮参拝は大歓迎のおしるし？☆,/watch?v=mPk4kusRKH0,2402,あっちゃん☆ねる,1130000,6か月前,3044,79
お昼はま寿司ごちになりました☆,/watch?v=wimHC2jJ36g,6935,あっちゃん☆ねる,1130000,6か月前,3044,228
お昼ごはん誘われたから行くよ～☆,/watch?v=07d8LySfJiw,2993,あっちゃん☆ねる,1130000,6か月前,3044,98
バジル入りハムピザトースト☆,/watch?v=ykHOUpwoHSg,1960,あっちゃん☆ねる,1130000,6か月前,3044,64
あったかお弁当】大人のチキンチャップ弁当☆３学期１４日目高校男子のお弁当つくり２３７日目,/watch?v=JYcAaNTJVvU,992,あっちゃん☆ねる,1130000,6か月前,3044,33
眠いからチコッとだけ生配信⭐️,/watch?v=kDtSo5-mbnY,3741,あっちゃん☆ねる,1130000,6か月前,3044,123
人生初の伊勢神宮参拝は、ハプニング続出．．．．,/watch?v=StdbKIEYD4c,4944,あっちゃん☆ねる,1130000,6か月前,3044,162
ロケ帰りにお弁当、オークワ半額お弁当☆,/watch?v=ZLZqDb_XD4M,3901,あっちゃん☆ねる,1130000,6か月前,3044,128
赤福本店でお善哉頂きました☆,/watch?v=HBWNTIGAOS8,4891,あっちゃん☆ねる,1130000,6か月前,3044,161
年末に注文してた「鬼滅の刃」福袋がやっと届いたよ,/watch?v=kz5Dgo826Rg,2476,あっちゃん☆ねる,1130000,6か月前,3044,81
伊勢に行くなら伊勢うどんとてこね寿司［山口屋さんで食べました］☆,/watch?v=KUey3y6JQ0Q,5023,あっちゃん☆ねる,1130000,6か月前,3044,165
伊勢神宮参拝最寄り駅まで旧伊勢街道をドライブ雑談☆,/watch?v=Kumj__rGrug,1594,あっちゃん☆ねる,1130000,6か月前,3044,52
伊勢神宮参拝メイクします☆,/watch?v=q7wlIfh24Dk,3139,あっちゃん☆ねる,1130000,6か月前,3044,103
昨日の残りの焼き肉ピザトースト☆,/watch?v=32vnEs_94dw,1975,あっちゃん☆ねる,1130000,6か月前,3044,65
あったかお弁当】焼き鳥風鶏のてりやき弁当☆３学期１３日目高校男子のお弁当つくり２３６日目,/watch?v=NzQExozQ2jk,797,あっちゃん☆ねる,1130000,6か月前,3044,26
お伊勢さん参拝して来たよv,/watch?v=HS5-Imj3oQo,3671,あっちゃん☆ねる,1130000,6か月前,3044,121
２０２０年奈良若草山焼き☆,/watch?v=yfH2cX0OuIk,1021,あっちゃん☆ねる,1130000,6か月前,3044,34
たっぷりん食べよ～☆,/watch?v=ktoqTR9WlTw,2867,あっちゃん☆ねる,1130000,6か月前,3044,94
焼き肉とあんこうのソテーと味噌汁出番ごはん☆,/watch?v=TZFPiSPb3YA,4040,あっちゃん☆ねる,1130000,6か月前,3044,133
日曜は手抜き賞味期限ギリギリ大量の焼き肉w,/watch?v=xaNI-eLhRQk,1054,あっちゃん☆ねる,1130000,6か月前,3044,35
平城京大立山まつり、まだ食べるよw☆,/watch?v=safKHS2hHmU,7731,あっちゃん☆ねる,1130000,6か月前,3044,254
ニュータッチ凄麺仙台辛味噌ラーメン食べてみたよ☆,/watch?v=56cAuMRNaqs,2266,あっちゃん☆ねる,1130000,6か月前,3044,74
若草山焼き奈良ロケ行き道ドライブ☆後編,/watch?v=abjs9aU_NLc,1313,あっちゃん☆ねる,1130000,6か月前,3044,43
集団の鹿に襲われた～w☆,/watch?v=Zu1mACW7Mqc,5379,あっちゃん☆ねる,1130000,6か月前,3044,177
久々にポーチドツナマヨサンド☆,/watch?v=LeYZto6AoYI,2522,あっちゃん☆ねる,1130000,6か月前,3044,83
２０２０年奈良若草山焼き花火大会☆,/watch?v=bp3HbQg-Y7o,1587,あっちゃん☆ねる,1130000,6か月前,3044,52
28万の新兵器来たぁ～☆,/watch?v=79W7zMCPCu8,4006,あっちゃん☆ねる,1130000,6か月前,3044,132
ロケ帰りお弁当買ってきたよ☆,/watch?v=aURjpXJV3a8,3839,あっちゃん☆ねる,1130000,6か月前,3044,126
明日1月27日伊勢神宮公開ロケ告知☆,/watch?v=lYFEGluJxv4,1829,あっちゃん☆ねる,1130000,6か月前,3044,60
奈良若草山焼きロケ甘味処で休憩です☆,/watch?v=kUl0ohecn3M,8179,あっちゃん☆ねる,1130000,6か月前,3044,269
音声改良版・奈良市平城京で宇陀市の美味しいもの他食べました☆,/watch?v=KHo6604OwRU,4840,あっちゃん☆ねる,1130000,6か月前,3044,159
奈良市平城京で宇陀市の美味しいもの他食べました☆,/watch?v=L2cBRF8ZfTE,5714,あっちゃん☆ねる,1130000,6か月前,3044,188
若草山焼き奈良ロケ行き道ドライブ☆前編,/watch?v=zYoeenG1_8c,2144,あっちゃん☆ねる,1130000,6か月前,3044,70
奈良ロケメイクしましょ＆コーデ紹介☆アクシデント発生w,/watch?v=WPJQkCljbG0,4106,あっちゃん☆ねる,1130000,6か月前,3044,135
奈良ロケの朝ロースハムのピザトースト食べていきましょ,/watch?v=xKznWRQ7K3c,2119,あっちゃん☆ねる,1130000,6か月前,3044,70
奈良ロケから帰還ちょこっと雑談生配信,/watch?v=HQQPFMpaeh4,3304,あっちゃん☆ねる,1130000,6か月前,3044,109
晩ごはんは餃子の王将TAKE OUT☆,/watch?v=t_Ezd5Gz6aw,5019,あっちゃん☆ねる,1130000,6か月前,3044,165
福袋開封】Qoo１０アプリメンズ家電☆,/watch?v=OlQq5XQRSFE,2507,あっちゃん☆ねる,1130000,6か月前,3044,82
サイゼリアでお昼ごはん☆,/watch?v=nES6GjQ62f4,8310,あっちゃん☆ねる,1130000,6か月前,3044,273
１月２４日少し大人っぽい？メイク＆コーデ紹介,/watch?v=BzZQiViyk9c,3552,あっちゃん☆ねる,1130000,6か月前,3044,117
お弁当残りのイタリアン風バジルレモン焼き肉のピザトースト,/watch?v=8-6EdAh9k0g,1785,あっちゃん☆ねる,1130000,6か月前,3044,59
あったかお弁当】イタリアン風バジルレモン焼き肉弁当☆３学期１２日目高校男子のお弁当つくり２３５日目,/watch?v=txa-gHi8mnE,893,あっちゃん☆ねる,1130000,6か月前,3044,29
今夜はゆるっと定期ライブ☆,/watch?v=O03qkLBoegs,5215,あっちゃん☆ねる,1130000,6か月前,3044,171
新ネイル発表2💅,/watch?v=gd7p2zBRLlY,4634,あっちゃん☆ねる,1130000,6か月前,3044,152
自分と子供へのご褒美に奈良の高級いちご☆,/watch?v=dDurYxMg068,3049,あっちゃん☆ねる,1130000,6か月前,3044,100
新ネイル発表💅,/watch?v=FREWZeztsYE,2677,あっちゃん☆ねる,1130000,6か月前,3044,88
あんこうのお味噌汁めっちゃ美味しいよ☆,/watch?v=UxOcHQqHC8w,2456,あっちゃん☆ねる,1130000,6か月前,3044,81
鶏もも焼きます☆,/watch?v=i6hSSOadxQk,919,あっちゃん☆ねる,1130000,6か月前,3044,30
あんこう2尾捌きます☆,/watch?v=9_u1gfV-QPU,1188,あっちゃん☆ねる,1130000,6か月前,3044,39
買い物紹介とこんにゃくは味噌田楽☆車中飯？かな？,/watch?v=2QmR0XrvL-g,2509,あっちゃん☆ねる,1130000,6か月前,3044,82
今日は大阪🚙,/watch?v=ZK-wi3qXKSU,2227,あっちゃん☆ねる,1130000,6か月前,3044,73
根拠のない自信を持てばいいんだよ☆,/watch?v=hu53Z1Qzh2s,3846,あっちゃん☆ねる,1130000,6か月前,3044,126
ビーフシチューのチーズトースト☆,/watch?v=nG47G1Mo2M4,1839,あっちゃん☆ねる,1130000,6か月前,3044,60
あったかお弁当】焼き肉弁当☆３学期１１日目高校男子のお弁当つくり２３４日目,/watch?v=-a3dxmc6bZk,785,あっちゃん☆ねる,1130000,6か月前,3044,26
まだ編集中携帯からライブするね,/watch?v=vh9fvy9ggHo,4608,あっちゃん☆ねる,1130000,6か月前,3044,151
怒られちゃった,/watch?v=_b3otNjrcNc,9053,あっちゃん☆ねる,1130000,6か月前,3044,297
ビーフシチュー美味しかったよ～☆,/watch?v=5pttnX9oZnM,2643,あっちゃん☆ねる,1130000,6か月前,3044,87
ビーフシチュー作ろ～☆,/watch?v=f1WYlsE8s8M,1554,あっちゃん☆ねる,1130000,6か月前,3044,51
１月２３日買い物雑談ドライブ☆ストレスなんて貯めないで笑えばいいんだよｖ,/watch?v=d1OifbFpdzA,2456,あっちゃん☆ねる,1130000,6か月前,3044,81
きのこ出汁の鳥の水炊き食べましょ☆,/watch?v=IFdCEX1NMoA,2642,あっちゃん☆ねる,1130000,6か月前,3044,87
鬱を改善したい人だけ見てね☆考え方次第でなんとかなるのよ☆,/watch?v=IuIUjdZcpRU,5360,あっちゃん☆ねる,1130000,6か月前,3044,176
お弁当の残りマヨオイスターソテーにきのこの水煮チーズトースト☆,/watch?v=OIJJ53VPLV0,1704,あっちゃん☆ねる,1130000,6か月前,3044,56
あったかお弁当】豚肉のマヨオイスターソースソテー弁当☆３学期１０日目高校男子のお弁当つくり２３３日目,/watch?v=smsdliJe5OA,846,あっちゃん☆ねる,1130000,6か月前,3044,28
今朝の動画のコメントについてん緊急ライブ☆参加者は必ず説明欄読んでね,/watch?v=dHoKPzGNdFk,12817,あっちゃん☆ねる,1130000,6か月前,3044,421
ドライブ動画で警察から電話   そして、鬱動画について,/watch?v=ojfFlD_54xo,6620,あっちゃん☆ねる,1130000,6か月前,3044,217
本日発売マクドナルドアツ！ベーダブチvsアツ！ベーてりやき最速レビュー☆,/watch?v=LDX3wX-dBao,3496,あっちゃん☆ねる,1130000,6か月前,3044,115
きのこの煮汁で水炊き作ろぉ～☆,/watch?v=LttYmjtX-EY,1310,あっちゃん☆ねる,1130000,6か月前,3044,43
株なめこでなめたけ作っとこ☆,/watch?v=sZ-i_wzYqGI,1146,あっちゃん☆ねる,1130000,6か月前,3044,38
ニュータッチ凄麺・青森煮干し中華そば食べてみた☆,/watch?v=BYmVDDqcGS8,1840,あっちゃん☆ねる,1130000,6か月前,3044,60
鬱を知ることで治せると思うよ☆,/watch?v=lYeh2JmSd-k,7106,あっちゃん☆ねる,1130000,6か月前,3044,233
大人のポークチャップチーズトースト☆,/watch?v=HtSuZrLEhEc,1729,あっちゃん☆ねる,1130000,6か月前,3044,57
あったかお弁当】大人のポークチャップ弁当☆３学期９日目高校男子のお弁当つくり２３２日目,/watch?v=1MLqCdFXCW8,871,あっちゃん☆ねる,1130000,6か月前,3044,29
チャンネル登録１１１１１人ありがとライブ☆,/watch?v=IHgoNXWH_LY,3795,あっちゃん☆ねる,1130000,6か月前,3044,125
視聴者さんからピュアちゃんにもプレゼント頂きました☆,/watch?v=WtZuh7otV6M,3403,あっちゃん☆ねる,1130000,6か月前,3044,112
ASMR】きのこの水煮咀嚼音とおまけ☆,/watch?v=kXpS_gwwjUA,3374,あっちゃん☆ねる,1130000,6か月前,3044,111
２月以降の予定発表しますね☆,/watch?v=fylSlWwY00M,2486,あっちゃん☆ねる,1130000,6か月前,3044,82
お昼は彩華ラーメン☆,/watch?v=nXCst9ina84,3181,あっちゃん☆ねる,1130000,6か月前,3044,105
常備菜】きのこの水煮作っときます☆,/watch?v=CfOwZnCA6_U,1293,あっちゃん☆ねる,1130000,6か月前,3044,42
なめこのベーコンチーズトースト☆,/watch?v=kBK2juMA3Qc,2102,あっちゃん☆ねる,1130000,6か月前,3044,69
あったかお弁当】豚ときのこのバター醤油ソテー弁当☆３学期８日目高校男子のお弁当つくり２３１日目,/watch?v=3yJpDPmScVY,854,あっちゃん☆ねる,1130000,6か月前,3044,28
今日神とひとつになってきたよ☆,/watch?v=hCGvLSUh024,3827,あっちゃん☆ねる,1130000,6か月前,3044,126
晩ごはんの後のデザートはメロンだよｖ☆,/watch?v=dV1jFVevQD0,1877,あっちゃん☆ねる,1130000,6か月前,3044,62
ハンバーグとぶり大根美味しかったよ☆,/watch?v=9gWZ6fjIpzA,3832,あっちゃん☆ねる,1130000,6か月前,3044,126
エバグリーンおばちゃん手作りハンバーグ焼こぉ～☆,/watch?v=R73rpF77yuE,1943,あっちゃん☆ねる,1130000,6か月前,3044,64
amazonで取り寄せたもので法律の勉強しましょね☆,/watch?v=d6fK3napimA,2521,あっちゃん☆ねる,1130000,6か月前,3044,83
朝遅かったから軽く豆餅焼いて食べます☆,/watch?v=LS7fx-SsUwM,2098,あっちゃん☆ねる,1130000,6か月前,3044,69
圧力鍋でぶり大根作ってみた（コチも入れてみよ～）☆,/watch?v=Ean0OyIxXTM,1097,あっちゃん☆ねる,1130000,6か月前,3044,36
1月27日伊勢神宮＆おかげ横丁食べ歩き公開ロケのお知らせ☆,/watch?v=_aofORImQvU,1552,あっちゃん☆ねる,1130000,6か月前,3044,51
ポーチド残り物からあげサンド☆,/watch?v=i2iEj1n4MQY,1879,あっちゃん☆ねる,1130000,6か月前,3044,62
神さまの山に入るからお清めw,/watch?v=M0rrHKis1sQ,2910,あっちゃん☆ねる,1130000,6か月前,3044,96
【ASMR？】唐揚げ＆天ぷらあげるだけの動画☆,/watch?v=JzvBmMUnF7o,1650,あっちゃん☆ねる,1130000,6か月前,3044,54
1月25日奈良公園食べ歩き＆若草山焼き公開ロケのお知らせ☆,/watch?v=2rq75fFxf3w,1756,あっちゃん☆ねる,1130000,6か月前,3044,58
イカとこちのからあげと天ぷら美味しかったよ☆,/watch?v=1nImP3-tcNY,3222,あっちゃん☆ねる,1130000,6か月前,3044,106
イカ捌いてほかに色々揚げます☆,/watch?v=tgd-SQga59o,1955,あっちゃん☆ねる,1130000,6か月前,3044,64
ニュータッチ凄麺北編買ったよ☆今日は札幌味噌ラーメン,/watch?v=IdbyygUaCe8,2386,あっちゃん☆ねる,1130000,6か月前,3044,78
スイーツ男子が買ったクーベルチュール紹介します☆,/watch?v=g5XNBIbLT6w,2301,あっちゃん☆ねる,1130000,6か月前,3044,76
生食パン美味しかったよ☆,/watch?v=rUdYnRMMUgE,2423,あっちゃん☆ねる,1130000,6か月前,3044,80
今夜はキンキンに冷えてやがる☆,/watch?v=WtJ19Z88pJ8,5179,あっちゃん☆ねる,1130000,6か月前,3044,170
奈良カラオケオフ会】遅刻やぁ～w☆,/watch?v=hH-Pt4KvPJg,2488,あっちゃん☆ねる,1130000,6か月前,3044,82
奈良カラオケオフ会】ロシアンたこ焼きタイム☆,/watch?v=MI5XwIsjGvE,5414,あっちゃん☆ねる,1130000,6か月前,3044,178
病院帰りに焼き肉食べ放題～☆,/watch?v=u19TdbFBKZI,6179,あっちゃん☆ねる,1130000,6か月前,3044,203
あったかお弁当】豚の中華風焼き肉弁当☆３学期７日目高校男子のお弁当つくり２３０日目,/watch?v=Xy7oPMbJxYw,1015,あっちゃん☆ねる,1130000,6か月前,3044,33
病院行かな時間ない朝食べられへん☆,/watch?v=0PAUKzUuR-0,3243,あっちゃん☆ねる,1130000,6か月前,3044,107
今夜もキンキンに冷えてやがるぜ☆,/watch?v=K5jmN-7jFVw,4811,あっちゃん☆ねる,1130000,6か月前,3044,158
なか卯の牡蠣とじ丼美味しかった☆,/watch?v=J9IohapHvM4,5278,あっちゃん☆ねる,1130000,6か月前,3044,173
２０２０年奈良新年会カラオケオフ会一部公開☆,/watch?v=0UxymE98hGs,7995,あっちゃん☆ねる,1130000,6か月前,3044,263
奈良新年会カラオケオフ会】メイクとコーデ紹介☆,/watch?v=6HwK2QbCfrQ,4781,あっちゃん☆ねる,1130000,6か月前,3044,157
ベーコンとハムのピザトースト☆,/watch?v=QWEoQjfrcZQ,1997,あっちゃん☆ねる,1130000,6か月前,3044,66
あったかお弁当】豚のしょうが焼き肉弁当☆３学期６日目高校男子のお弁当つくり２２９日目,/watch?v=2Vj4N2WLxUw,980,あっちゃん☆ねる,1130000,6か月前,3044,32
今夜も23時ちょいまで生配信☆,/watch?v=E8BvlEXLn6s,4664,あっちゃん☆ねる,1130000,6か月前,3044,153
唐揚げカリッカリで美味しかったよ☆,/watch?v=UO6WxqHRyo4,5414,あっちゃん☆ねる,1130000,6か月前,3044,178
寝起きに唐揚げあげますw☆,/watch?v=X3X-UzW-5DQ,2335,あっちゃん☆ねる,1130000,6か月前,3044,77
カレーパスタ美味しく出来ました☆,/watch?v=wiCjj5JPWbY,3236,あっちゃん☆ねる,1130000,6か月前,3044,106
昨日のカレーでパスタにしよ☆,/watch?v=2B8Th79E_tw,1913,あっちゃん☆ねる,1130000,6か月前,3044,63
やっぱり定番ポーチドカレーパン☆,/watch?v=cJz7cQbanRA,1972,あっちゃん☆ねる,1130000,6か月前,3044,65
あったかお弁当】豚肉のオイスターソース炒め弁当☆３学期５日目高校男子のお弁当つくり２２８日目,/watch?v=CshjnqNaDL8,1014,あっちゃん☆ねる,1130000,6か月前,3044,33
今夜は23時ちょいまで生配信☆,/watch?v=eNGE8c0fddg,3391,あっちゃん☆ねる,1130000,6か月前,3044,111
アンファンの限定金のほうじ茶シューめっちゃ美味しかったよ☆,/watch?v=5gfzJISA_l8,1686,あっちゃん☆ねる,1130000,6か月前,3044,55
トリュフとポルチーニ香る欧風バーモントカレー美味しかったよ☆,/watch?v=JkRSFMXbnv4,2636,あっちゃん☆ねる,1130000,6か月前,3044,87
ユーチューバーっぽくｗカレー作ってみた☆,/watch?v=w7qo6N16buM,2364,あっちゃん☆ねる,1130000,6か月前,3044,78
ご迷惑ご心配おかけしたことに謝罪と今後のお話,/watch?v=TWJe9oy839s,9101,あっちゃん☆ねる,1130000,6か月前,3044,299
かき揚げの卵とじ丼☆,/watch?v=A1wNtRWXO_s,2628,あっちゃん☆ねる,1130000,6か月前,3044,86
野菜のかき揚げのポーチドサンド☆,/watch?v=xpxqOM9uLqE,1979,あっちゃん☆ねる,1130000,6か月前,3044,65
あったかお弁当】トリュフ香る中華風豚焼き肉弁当☆３学期４日目高校男子のお弁当つくり２２７日目,/watch?v=Op1I6FRpsPQ,1058,あっちゃん☆ねる,1130000,6か月前,3044,35
今夜は23時半まで生配信☆,/watch?v=wswHXBd6xqA,3311,あっちゃん☆ねる,1130000,6か月前,3044,109
天ぷらで晩ごはん☆,/watch?v=ALSu33S_7mI,4380,あっちゃん☆ねる,1130000,6か月前,3044,144
Japanese TEMPURA 天ぷらあげよ～☆,/watch?v=u6IK4T3CKXw,1790,あっちゃん☆ねる,1130000,6か月前,3044,59
1月16日奈良新年会カラオケオフ会まで後2日☆,/watch?v=oymSRTkcxv8,1843,あっちゃん☆ねる,1130000,6か月前,3044,61
ホットプレートでもちピザとか色々焼いて食べましょ☆,/watch?v=0SHvjGfH7hs,3338,あっちゃん☆ねる,1130000,6か月前,3044,110
コリアタウンで食べた生パンケーキめっちゃ美味しかったよ☆,/watch?v=OHZBkPhkzvA,4534,あっちゃん☆ねる,1130000,6か月前,3044,149
ホットドッグ風サンド☆,/watch?v=uG6Vj_6EuSs,2259,あっちゃん☆ねる,1130000,6か月前,3044,74
予定終了ｖ0時まで生配信☆,/watch?v=GhMtG51-zyA,4064,あっちゃん☆ねる,1130000,6か月前,3044,134
シュウくんのランサーセディアドライブしました☆,/watch?v=SM5IhAvUTo8,7782,あっちゃん☆ねる,1130000,6か月前,3044,256
トリュフ香るTKGウマウマやで☆,/watch?v=XHXctd3XWdw,3193,あっちゃん☆ねる,1130000,6か月前,3044,105
豚汁と焼き肉作ります☆,/watch?v=4j7yDLz-_A4,1232,あっちゃん☆ねる,1130000,6か月前,3044,40
今宮のえべっさん帰りにクロワッサンたい焼き食べ歩いてお昼ごはんへ☆,/watch?v=TtglY2ODjHs,3212,あっちゃん☆ねる,1130000,6か月前,3044,106
カルディで買ったちょっと特殊な？きのこづくし？☆,/watch?v=GFc8SpPkwW8,1746,あっちゃん☆ねる,1130000,6か月前,3044,57
今日は栃木ニュータッチ凄麺・佐野ラーメン食べてみたよ☆,/watch?v=Td-_f8vPVQA,1757,あっちゃん☆ねる,1130000,6か月前,3044,58
ポーチドたまごサンドのポーチドってなに？ポーチドエッグじゃないの？☆,/watch?v=JBuPMeXnYzk,1694,あっちゃん☆ねる,1130000,6か月前,3044,56
トリュフ香るポーチドたまごサンドin腸活キャベツ☆めっちゃ美味しかったよ☆,/watch?v=ekK_Bl5AMW8,1593,あっちゃん☆ねる,1130000,6か月前,3044,52
今夜もちょっとだけね～あんたもすきねぇ～w☆,/watch?v=V5i0TyrfXBY,4011,あっちゃん☆ねる,1130000,6か月前,3044,132
What's in my Bag☆Big jeans bag,/watch?v=dszHaFb-jRo,5734,あっちゃん☆ねる,1130000,6か月前,3044,188
18時位までおやつ生配信☆,/watch?v=hInMhWcYi4U,2839,あっちゃん☆ねる,1130000,6か月前,3044,93
今宮のえべっさん今年のおみくじの結果は？☆,/watch?v=v7sITXAX0sc,1623,あっちゃん☆ねる,1130000,6か月前,3044,53
スシローデザートクォリティー高い☆おまけの後日談付きｗ☆,/watch?v=NDudR5VAYA4,2798,あっちゃん☆ねる,1130000,6か月前,3044,92
久々のスシロー☆,/watch?v=RMeIuGi653U,6010,あっちゃん☆ねる,1130000,6か月前,3044,197
今宮のえべっさんに行くために榛原駅までドライブです☆,/watch?v=2xFSsMFvsW4,1569,あっちゃん☆ねる,1130000,6か月前,3044,52
ゆでたまごとチーズのオープンサンド☆,/watch?v=r5VMIBwZpU0,2282,あっちゃん☆ねる,1130000,6か月前,3044,75
今夜もちょっとだけね～あんたもすきねぇ～w☆,/watch?v=tS1QrCSLLzk,3039,あっちゃん☆ねる,1130000,6か月前,3044,100
アンファンの限定銀の抹茶Wシュー美味しかったよ☆,/watch?v=k4oegrmK4hU,1677,あっちゃん☆ねる,1130000,6か月前,3044,55
近鉄大阪難波エキナカで買ってきた駅弁食べマシュ☆,/watch?v=GwBrVF7-eXw,2833,あっちゃん☆ねる,1130000,6か月前,3044,93
今宮のえべっさんなんば駅から神社まで歩きましょ☆,/watch?v=tIQt1xtrKuM,3811,あっちゃん☆ねる,1130000,6か月前,3044,125
