title,url,view,channel_name,channel_subscriber,create_stamp,mean_view,mean_comparison
創作イタリアン牛肉のチーズ巻きのトマト煮めっちゃ美味しいよ☆,/watch?v=sSqnxJI_PhU,3523,あっちゃん☆ねる,1130000,3か月前,3044,116
気合い入れて本格的なイタリアン牛肉のトマト煮作ろ,/watch?v=5xEqKEyGjEQ,1818,あっちゃん☆ねる,1130000,3か月前,3044,60
GWこどもの日自粛で暇w　平日昼間に雑談トークライブ☆,/watch?v=4Mwu3gHSyHQ,3583,あっちゃん☆ねる,1130000,3か月前,3044,118
選挙の帰りに安納芋やきいもアイス買ってきたから食べよ☆,/watch?v=IercrDdIoqQ,1531,あっちゃん☆ねる,1130000,3か月前,3044,50
プレミアム醤油だけで焼きうどんやっぱり美味しいよ☆,/watch?v=TxzKBMi1x4w,2437,あっちゃん☆ねる,1130000,3か月前,3044,80
プレミアム醤油だけで焼きうどん作るね☆,/watch?v=5OUXSeVmSTc,1483,あっちゃん☆ねる,1130000,3か月前,3044,49
とんかつ下ごしらえして冷凍しとこ☆,/watch?v=VHqTxyzsoGA,935,あっちゃん☆ねる,1130000,3か月前,3044,31
ポーチド鶏カツサンド美味しかったよ☆,/watch?v=sFdLXtRSe_E,1775,あっちゃん☆ねる,1130000,3か月前,3044,58
花咲くまにまに　10話☆,/watch?v=skgYwZz2tls,1767,あっちゃん☆ねる,1130000,3か月前,3044,58
自粛伸びたね・・・・,/watch?v=FhUH5p4w2Y0,4020,あっちゃん☆ねる,1130000,3か月前,3044,132
ラジコンNSXのボディー作ります☆Vol4ステッカー編その1,/watch?v=YkOFH-i8ejg,1328,あっちゃん☆ねる,1130000,3か月前,3044,44
鶏ムネカツは、安いけどパサつかず美味しいね☆,/watch?v=6WM0SAnYcuE,2888,あっちゃん☆ねる,1130000,3か月前,3044,95
鶏ムネカツひたすら揚げます☆,/watch?v=GoeaIP4hLKY,1402,あっちゃん☆ねる,1130000,3か月前,3044,46
GW自粛自堕落生活かっぱえびせんわさび味とビールw☆,/watch?v=5DjIB13Ja5o,1934,あっちゃん☆ねる,1130000,3か月前,3044,64
鶏ムネカツ作ろかな☆,/watch?v=nTNaH-viFCQ,1018,あっちゃん☆ねる,1130000,3か月前,3044,33
自粛中の家族を笑顔にするお昼ごはん】Pizzaのようなお好み焼きで笑顔にな～れぇ☆,/watch?v=QnmVSZ4tG24,2286,あっちゃん☆ねる,1130000,3か月前,3044,75
自粛中の家族を笑顔にするお昼ごはん】お好み焼き焼いてみよ☆,/watch?v=NHEFnYtRoiI,1543,あっちゃん☆ねる,1130000,3か月前,3044,51
バジル入り鶏ハム作ろ☆,/watch?v=v-7CLBpOIuI,1111,あっちゃん☆ねる,1130000,3か月前,3044,36
アメリカンドッグ美味しいね☆,/watch?v=Xc4BN5UZ8hc,3074,あっちゃん☆ねる,1130000,3か月前,3044,101
花咲くまにまに　9話☆,/watch?v=DFlMd1Fp4K8,1999,あっちゃん☆ねる,1130000,3か月前,3044,66
GW自粛しろって行政に言われたのに行政から呼び出されたｗなんでやねん,/watch?v=x_pJZ9bz1y4,4073,あっちゃん☆ねる,1130000,3か月前,3044,134
GW自粛しろって行政に言われたのに行政から呼び出されたｗなんでやねん,/watch?v=IyNwx2diLik,3147,あっちゃん☆ねる,1130000,3か月前,3044,103
GW外出自粛中8割の接触を避けないといけない日に現状の3倍の人に会いに投票に行ってきましたｗ☆,/watch?v=SiuDkUWBI70,2672,あっちゃん☆ねる,1130000,3か月前,3044,88
あっちゃん☆SP焼きそば美味しいよ☆,/watch?v=_aHD7ftsfW4,2572,あっちゃん☆ねる,1130000,3か月前,3044,84
豚の野菜炒め作るね☆,/watch?v=0sE5lT2biH0,985,あっちゃん☆ねる,1130000,3か月前,3044,32
ほうれん草レンジで下茹でしとこ☆,/watch?v=6hXyZIZEBPs,892,あっちゃん☆ねる,1130000,3か月前,3044,29
焼きそば作ろ☆,/watch?v=zKD-9dmRGHk,2423,あっちゃん☆ねる,1130000,3か月前,3044,80
コロナに潜む違った恐怖・・・,/watch?v=fusZrZnCEco,3605,あっちゃん☆ねる,1130000,3か月前,3044,118
寝起きに酷いLINEで気分悪いお目覚め・・・,/watch?v=idi0nAncu1g,5427,あっちゃん☆ねる,1130000,3か月前,3044,178
花咲くまにまに　8話☆,/watch?v=AmIAIoaOZKE,2197,あっちゃん☆ねる,1130000,3か月前,3044,72
なんか朝から気分が沈み気味・・・,/watch?v=W5g_cuDHohw,4842,あっちゃん☆ねる,1130000,3か月前,3044,159
去年から冷蔵庫で眠ってた長崎カステラプリン食べてみたら・・・☆,/watch?v=yGzf5XicbQE,1964,あっちゃん☆ねる,1130000,3か月前,3044,65
やっぱり手作りハンバーグ美味しいね☆,/watch?v=KkD0yA4Rp8s,3411,あっちゃん☆ねる,1130000,3か月前,3044,112
ハンバーグ作ろ☆新しいカインズマーブルストーンフライパン初使用,/watch?v=sEK9ISy-8dw,1733,あっちゃん☆ねる,1130000,3か月前,3044,57
雪の宿美味しいね☆,/watch?v=TyXppDHZkbk,1688,あっちゃん☆ねる,1130000,3か月前,3044,55
視聴者さんからのプレゼントが１ヶ月遅れで開封されて届いたよ,/watch?v=oT01MEwIDD8,2232,あっちゃん☆ねる,1130000,3か月前,3044,73
カインズ焦げにくいフライパン初レビュー】チヂミ焼いてみたよ☆,/watch?v=BV8Gm4-w54M,1716,あっちゃん☆ねる,1130000,3か月前,3044,56
レジ袋が環境破壊？ゴミ出しのマナーについて☆,/watch?v=tyQkuprEesM,1910,あっちゃん☆ねる,1130000,3か月前,3044,63
明太バジルトースト美味しかったよ☆,/watch?v=lEuf4RNNeM8,1629,あっちゃん☆ねる,1130000,3か月前,3044,54
なんか良い流れ？良い兆しが見えてきた気がする☆あくまでもまだ気がするだけw,/watch?v=YSR5JodWNsA,6822,あっちゃん☆ねる,1130000,3か月前,3044,224
めっちゃ豪華に見えるけど安いwツバスづくし定食☆,/watch?v=Bf_TLfdFsgo,2732,あっちゃん☆ねる,1130000,3か月前,3044,90
３９８円ツバスでちょっと豪華な晩ごはん作ろ☆,/watch?v=x-YIWGUDRmE,1473,あっちゃん☆ねる,1130000,3か月前,3044,48
メディアも政府もわかってないのかな？,/watch?v=tc-MpyZXCWk,2716,あっちゃん☆ねる,1130000,3か月前,3044,89
外出自粛中でお買い物頻度減らす計画１週間半分の食材紹介します☆４月３０日,/watch?v=PKLzUcuGXuY,2153,あっちゃん☆ねる,1130000,3か月前,3044,71
STAY HOME おうちではま寿司】期間限定ワンコイン海鮮丼☆,/watch?v=LCdJRBzMpdM,2615,あっちゃん☆ねる,1130000,3か月前,3044,86
外出自粛中でお買い物頻度減らす計画１週間半分の食材買い出し旅☆４月３０日,/watch?v=585e_c4g3SQ,1766,あっちゃん☆ねる,1130000,3か月前,3044,58
外出自粛中でお買い物頻度減らす計画１週間半分のごはん考えよ☆,/watch?v=3RIgIW2V4h8,2364,あっちゃん☆ねる,1130000,3か月前,3044,78
カレーの翌日はポーチドカレーパンだよね☆,/watch?v=PKI4kPLUIn4,1857,あっちゃん☆ねる,1130000,3か月前,3044,61
ちょこっとだけゆるっと雑談でありんす☆,/watch?v=qIXZ3lB_vHY,4489,あっちゃん☆ねる,1130000,3か月前,3044,147
ハウスバーモントカレーだよ～☆,/watch?v=zgwlqnAoRfE,3309,あっちゃん☆ねる,1130000,3か月前,3044,109
冷凍下味具材でカレー作ってみたけど・・・☆,/watch?v=IJ4mUh6ZNGI,2034,あっちゃん☆ねる,1130000,3か月前,3044,67
養命酒ののど飴でインフル予防ってことは・・・☆,/watch?v=2IlqR33wP2Q,1375,あっちゃん☆ねる,1130000,3か月前,3044,45
ローソンで買ったカップ麺】札幌味噌豚骨雪風美味しかったよ☆,/watch?v=Sq9yh4TzBtc,2381,あっちゃん☆ねる,1130000,3か月前,3044,78
コロナウイルスと腸内細菌って関係ありそう・・・,/watch?v=qaSS_5F7e4k,2272,あっちゃん☆ねる,1130000,3か月前,3044,75
ベーコン納豆ピザトースト☆,/watch?v=inUig0BQ1D4,1701,あっちゃん☆ねる,1130000,3か月前,3044,56
花咲くまにまに　7話☆涙の1弾目最終回白玖さんバッドエンド,/watch?v=8hfa8EELGBs,1865,あっちゃん☆ねる,1130000,3か月前,3044,61
22時半まで、ガンダムとアマビエさん抽選準備とゆるっと雑談でありんす☆,/watch?v=CZxl7XCl-PQ,2624,あっちゃん☆ねる,1130000,3か月前,3044,86
仕事道具？不要不急じゃない県外へのお買い物紹介☆,/watch?v=rZ80Bh-dWws,2852,あっちゃん☆ねる,1130000,3か月前,3044,94
晩ごはんケンタだよ☆,/watch?v=Z_n5j3O9-OI,4027,あっちゃん☆ねる,1130000,3か月前,3044,132
LEGO　Ferrari F8 Tributo Build☆Vol 2,/watch?v=jvNdI9VVfnc,579,あっちゃん☆ねる,1130000,3か月前,3044,19
大至急‼拡散希望】10万円給付金が受け取れなくなるよ！！！,/watch?v=5B0ahzuE9GM,5471,あっちゃん☆ねる,1130000,3か月前,3044,180
びっくりドンキーのチーズフォンデュハンバーグ美味しいね☆,/watch?v=SvJYqEzcW7c,5377,あっちゃん☆ねる,1130000,3か月前,3044,177
御礼☆あっちゃん☆げーむず収益化なりました☆,/watch?v=Cx_-BKdlKHo,1372,あっちゃん☆ねる,1130000,3か月前,3044,45
2020年久々の質問コーナーのお答え☆第３弾,/watch?v=Z3hzO_RmNmU,1424,あっちゃん☆ねる,1130000,3か月前,3044,47
鶏天ピザトースト☆,/watch?v=uqX_xv1EQg4,1456,あっちゃん☆ねる,1130000,3か月前,3044,48
花咲くまにまに　6話☆,/watch?v=yzhktTHl9XA,1753,あっちゃん☆ねる,1130000,3か月前,3044,58
22時半まで、みんなに感謝とゆるっと雑談でありんす☆,/watch?v=4JOhQPiqGxQ,2507,あっちゃん☆ねる,1130000,3か月前,3044,82
ラジコンNSXのボディー作ります☆Vol3塗装編,/watch?v=PH64D6QxETM,1259,あっちゃん☆ねる,1130000,3か月前,3044,41
とりとたけのこれんこんの天ぷら美味しかったよ☆,/watch?v=xDdv7hy99hs,3408,あっちゃん☆ねる,1130000,3か月前,3044,112
とり天つくろ☆,/watch?v=f5Wl-CVwbuA,1359,あっちゃん☆ねる,1130000,3か月前,3044,45
LEGO　Ferrari F8 Tributo Build☆Vol 1,/watch?v=9aVTteAyJRg,637,あっちゃん☆ねる,1130000,3か月前,3044,21
へしことTKGでお昼ごはん☆,/watch?v=_Nn1X03v2tI,2601,あっちゃん☆ねる,1130000,3か月前,3044,85
昨日の牛丼の残りでオムライス作ろ☆,/watch?v=q4hHrubGACA,1657,あっちゃん☆ねる,1130000,3か月前,3044,54
2020年久々の質問コーナーのお答え☆第２弾,/watch?v=P6RjocgAbFE,1686,あっちゃん☆ねる,1130000,3か月前,3044,55
牛丼のピザトーストと動画編集のお話☆,/watch?v=KKNbDbSgQlU,1916,あっちゃん☆ねる,1130000,3か月前,3044,63
月曜だから夜更かししないゆるっと雑談でありんす☆,/watch?v=P-m429rO0JA,3255,あっちゃん☆ねる,1130000,3か月前,3044,107
下味冷凍の牛丼成功美味しかったよ☆,/watch?v=Zegd8PB-bOk,3760,あっちゃん☆ねる,1130000,3か月前,3044,124
冷凍した味してあったやつで牛丼作ります☆,/watch?v=I-szP7867Bg,1694,あっちゃん☆ねる,1130000,3か月前,3044,56
2020年久々の質問コーナーのお答え☆第１弾,/watch?v=Dl2EtTq1bcE,2513,あっちゃん☆ねる,1130000,3か月前,3044,83
チャーハン美味しかったよ☆,/watch?v=WyXFZ_1nj2o,2451,あっちゃん☆ねる,1130000,3か月前,3044,81
子供のリクエストでチャーハン作ります☆,/watch?v=Iub9Im0XsHM,1984,あっちゃん☆ねる,1130000,3か月前,3044,65
ラジコンNSXのボディー作ります☆Vol2マスキング編,/watch?v=Gs6wQhKjriI,1045,あっちゃん☆ねる,1130000,3か月前,3044,34
なめたけマヨチーズトースト美味しかったよ☆,/watch?v=Xn3rS06t6Rs,1385,あっちゃん☆ねる,1130000,3か月前,3044,45
花咲くまにまに　5話☆,/watch?v=afXofZBbIwY,1759,あっちゃん☆ねる,1130000,3か月前,3044,58
日曜の夜もゆるっと雑談でありんす☆,/watch?v=yVe-VDscKcQ,3061,あっちゃん☆ねる,1130000,3か月前,3044,101
ラジコンNSXのボディー作ります☆Vol1,/watch?v=c4kzgqAYoho,1769,あっちゃん☆ねる,1130000,3か月前,3044,58
鶏ももの塩焼き・卵焼き・たけのこのピザ風・わさび菜の酢の物他で晩ごはん☆,/watch?v=6NQhGcawVkk,3884,あっちゃん☆ねる,1130000,3か月前,3044,128
わさび菜とたけのこで色々作ります☆,/watch?v=ndWqNt7zOZs,1219,あっちゃん☆ねる,1130000,3か月前,3044,40
堅揚げポテト枝豆塩バター美味しかったよ☆,/watch?v=jLL82HhQC68,1723,あっちゃん☆ねる,1130000,3か月前,3044,57
喜多方ラーメンあっちゃん☆SP美味しいよ☆,/watch?v=wBecqYrBAcs,2607,あっちゃん☆ねる,1130000,3か月前,3044,86
喜多方ラーメン作ります☆,/watch?v=khigqoBqV4w,1436,あっちゃん☆ねる,1130000,3か月前,3044,47
手洗いしたら危険？☆,/watch?v=bAS9DHYLHNs,3244,あっちゃん☆ねる,1130000,3か月前,3044,107
生姜の佃煮香薫ピザトースト☆,/watch?v=SxN89sizGc4,2523,あっちゃん☆ねる,1130000,3か月前,3044,83
花咲くまにまに　4話☆,/watch?v=bOAEsp8LrXU,1686,あっちゃん☆ねる,1130000,3か月前,3044,55
土曜の夜もゆるっと雑談でありんす☆,/watch?v=JGv5h2v8_0U,3451,あっちゃん☆ねる,1130000,3か月前,3044,113
今お仕事頑張ってくれてる人にエールを☆,/watch?v=s3tAbHbty-g,2499,あっちゃん☆ねる,1130000,3か月前,3044,82
夜もはま寿司☆,/watch?v=ulltu3T_WOQ,4133,あっちゃん☆ねる,1130000,3か月前,3044,136
やっとマックシェイクプッチンプリン手に入れたよ,/watch?v=JLwi9HkFArc,2716,あっちゃん☆ねる,1130000,3か月前,3044,89
地元企業応援？スタッフと打ち合わせ？食べたかっただけwはま寿司でお昼ごはん☆☆,/watch?v=_1ue938vjts,7138,あっちゃん☆ねる,1130000,3か月前,3044,234
コロナ終息祈願アマビエちゃんプレゼント☆,/watch?v=1RPl8VJ7Sh0,2065,あっちゃん☆ねる,1130000,3か月前,3044,68
たらなめたけトースト☆,/watch?v=VVu1rEpp2fI,1868,あっちゃん☆ねる,1130000,3か月前,3044,61
今夜もゆるっと雑談でありんす☆,/watch?v=T4LkSolynWQ,3116,あっちゃん☆ねる,1130000,3か月前,3044,102
花咲くまにまに　3話☆,/watch?v=Mzh_vtlNAcY,1750,あっちゃん☆ねる,1130000,3か月前,3044,57
自粛してますか？家で出来るなにか？しよ☆,/watch?v=O-12H-VQTAw,4350,あっちゃん☆ねる,1130000,3か月前,3044,143
ローソンのお弁当☆,/watch?v=JshiZhlIDSk,2840,あっちゃん☆ねる,1130000,3か月前,3044,93
カップスターのしおチーズラーメン美味しかったよ☆,/watch?v=bBS6Cjh51QA,2580,あっちゃん☆ねる,1130000,3か月前,3044,85
ゆるっとざつだんでち～☆,/watch?v=bdEfBBR9cX4,4450,あっちゃん☆ねる,1130000,3か月前,3044,146
緊急事態宣言自粛中観光に行った気分になってね】　奈良明日香村観光☆チンチンと㊙の神社飛鳥坐神社編,/watch?v=BV7siCtZP98,2706,あっちゃん☆ねる,1130000,3か月前,3044,89
鶏むねの唐揚げ味の天ぷらの下味と冷凍処理☆,/watch?v=V9IWPqxj42I,1650,あっちゃん☆ねる,1130000,3か月前,3044,54
ハヤシライスとケンタご飯の残りのオムライス美味しかったよ☆,/watch?v=kqsfWekpkEs,4107,あっちゃん☆ねる,1130000,3か月前,3044,135
残り物でオムライス作ろ☆,/watch?v=NWHt_I09ZMI,2118,あっちゃん☆ねる,1130000,3か月前,3044,70
ポーチドハヤシライス（ライス入ってないけどねw）,/watch?v=At9gUKm_9h8,2251,あっちゃん☆ねる,1130000,3か月前,3044,74
回線状態戻ったかな？少しトークしよ☆,/watch?v=MQusP4fdQX0,4482,あっちゃん☆ねる,1130000,3か月前,3044,147
回線状態戻ったかな？少しトークしよ☆,/watch?v=ep8KI-wKVwE,1176,あっちゃん☆ねる,1130000,3か月前,3044,39
乙女ゲー】花咲くまにまに　2話☆,/watch?v=URqYV6kzlXE,1755,あっちゃん☆ねる,1130000,3か月前,3044,58
また嫌がらせされてる、マジ辛いよ・・・☆コロナストレスぶつけるなよw,/watch?v=g1V8wN_DNEA,8958,あっちゃん☆ねる,1130000,3か月前,3044,294
SDユニコーンプレゼント（音声無いからプレミアチャットで募集要項発表しますｗ☆,/watch?v=wisroS9g_vY,1483,あっちゃん☆ねる,1130000,3か月前,3044,49
ラクレットチーズの辛口ハヤシライスと切り干し大根とごぼうのたらマヨサラダめっちゃ美味しいよ☆,/watch?v=4RE_k8_Ir7k,3409,あっちゃん☆ねる,1130000,3か月前,3044,112
ラクレットチーズの辛口ハヤシライスと切り干し大根とごぼうのたらマヨサラダ作ります☆,/watch?v=utrOcx_fWXI,1559,あっちゃん☆ねる,1130000,3か月前,3044,51
久々にぴゅあ姫参上☆,/watch?v=OIe3_bRGMvY,5147,あっちゃん☆ねる,1130000,3か月前,3044,169
味噌風味の焼きうどんも美味しいね☆,/watch?v=rSaUVOLcyQk,2162,あっちゃん☆ねる,1130000,3か月前,3044,71
昨日の鶏炒めた味噌ダレで焼きうどん作ります☆,/watch?v=WVE0hYyzTN4,1050,あっちゃん☆ねる,1130000,3か月前,3044,34
５種のきのこのなめたけ作っときます☆,/watch?v=UQsYw1qrU20,999,あっちゃん☆ねる,1130000,3か月前,3044,33
香薫なめたけピザトースト☆,/watch?v=YdJzF2ITs_E,1563,あっちゃん☆ねる,1130000,3か月前,3044,51
乙女ゲー】花咲くまにまに　1話☆,/watch?v=VAn96B0tEH4,2192,あっちゃん☆ねる,1130000,3か月前,3044,72
相談にのるライブあっちゃん☆げーむずでするね☆,/watch?v=ka-YUHoMZ6Q,3163,あっちゃん☆ねる,1130000,3か月前,3044,104
適当に作ったw鶏ももの味噌ダレ焼きめっちゃ美味しかったよ☆,/watch?v=MWMcdkS4gJc,3360,あっちゃん☆ねる,1130000,3か月前,3044,110
鶏ももの味噌ダレ焼き作るね☆,/watch?v=RQE9gNm8uQc,1239,あっちゃん☆ねる,1130000,3か月前,3044,41
舞妓はんもヒーヒーするカレーせんべいヒーヒー☆,/watch?v=IFWd7W34a48,1586,あっちゃん☆ねる,1130000,3か月前,3044,52
ハリイカ捌きます☆,/watch?v=3Ji-itGL3zk,849,あっちゃん☆ねる,1130000,3か月前,3044,28
本格的イカスミパスタめっちゃ美味しいよ☆,/watch?v=CpMtorccyj0,3815,あっちゃん☆ねる,1130000,3か月前,3044,125
本格的イカスミパスタ作ります☆,/watch?v=befMXncX1QE,1663,あっちゃん☆ねる,1130000,3か月前,3044,55
久々のあっちゃん☆に質問コーナー2020春☆,/watch?v=vLY0VYufurE,2840,あっちゃん☆ねる,1130000,3か月前,3044,93
なめたけエッグハムピザトースト☆,/watch?v=7_Zrwjxa0T0,1463,あっちゃん☆ねる,1130000,3か月前,3044,48
前向いて楽しく生きていこね☆,/watch?v=J1AgftSObgI,4987,あっちゃん☆ねる,1130000,3か月前,3044,164
緊急事態宣言自粛中観光に行った気分になってね】　奈良明日香村観光☆入鹿の首塚・チンチン石（マラ石）編,/watch?v=EEo-WZPTw3o,1907,あっちゃん☆ねる,1130000,3か月前,3044,63
ケンタッキーフライドチキンの炊き込みごはん,/watch?v=tXg8Kt-0UN0,4553,あっちゃん☆ねる,1130000,3か月前,3044,150
鶏きもの甘露煮つくります☆,/watch?v=1tAHDz6t1Jw,1104,あっちゃん☆ねる,1130000,3か月前,3044,36
今夜もケンタｗ☆,/watch?v=lZ5mUlV8Vfw,3636,あっちゃん☆ねる,1130000,3か月前,3044,119
お母ちゃんの味切り干し大根の煮物、酢の物作ってみたよ☆,/watch?v=HDfTzJqeKo0,1157,あっちゃん☆ねる,1130000,3か月前,3044,38
ジャンクな何かでお昼ごはん☆,/watch?v=8wXz9uxCoT4,2633,あっちゃん☆ねる,1130000,3か月前,3044,86
大根・ほうれん草・小松菜下処理冷凍冷蔵しときます☆,/watch?v=OdsnPBsZOEI,1031,あっちゃん☆ねる,1130000,3か月前,3044,34
生姜の佃煮とたまごのオープンサンド☆,/watch?v=CoBn9G9MHHA,1541,あっちゃん☆ねる,1130000,3か月前,3044,51
自粛疲れ？ケンタッキーテイクアウトしてきたよw☆,/watch?v=3M4b66yuewg,6110,あっちゃん☆ねる,1130000,3か月前,3044,201
ちょっとお出かけドライブ☆,/watch?v=OIz6uhaXrpU,2531,あっちゃん☆ねる,1130000,3か月前,3044,83
自粛で家に居たらおなか空かないねw☆,/watch?v=3eKMj33_Yx8,3081,あっちゃん☆ねる,1130000,3か月前,3044,101
わけぎ・菜の花・ブロッコリー下処理冷凍しときます☆,/watch?v=HI_9hC4wr2Q,1337,あっちゃん☆ねる,1130000,3か月前,3044,44
カツオのたたきチーズトースト旨いんだよぉ～☆,/watch?v=rLqVrle7Hhg,2278,あっちゃん☆ねる,1130000,3か月前,3044,75
昨日全く伝わらんだで、冷めちゃったけど今日思い出して話すねｗ,/watch?v=_XQTnJkR0_o,7320,あっちゃん☆ねる,1130000,3か月前,3044,240
TKGと刺身、豚の塩焼きで豪華に見えるけど一人２００円くらいの晩ごはんw☆,/watch?v=SKNvCnI4-OI,3956,あっちゃん☆ねる,1130000,3か月前,3044,130
お刺身と熟成ブタさんの塩焼き☆,/watch?v=cE3U5a7w7YI,1133,あっちゃん☆ねる,1130000,3か月前,3044,37
ほうじ茶チーズティ美味しかったよ☆リピ確定ｖ,/watch?v=2aDFKoKLpJg,1434,あっちゃん☆ねる,1130000,3か月前,3044,47
時短出来るか？実験】カレーの具材にした味した処理して冷凍してみます☆,/watch?v=y0Z9AZCZYdM,1410,あっちゃん☆ねる,1130000,3か月前,3044,46
おバカアレンジ】手こね寿司でチャーハン？マジ？美味しいの？ヤバないの？☆,/watch?v=KclBJi-mAf0,2411,あっちゃん☆ねる,1130000,3か月前,3044,79
１週間半分買った食材で２週間過ごせるか考えてみた☆,/watch?v=fHHPdF0ZZJA,2610,あっちゃん☆ねる,1130000,3か月前,3044,86
ポーチドたまごサンド食べて愚痴ったろw☆,/watch?v=XHs-zCReecI,2928,あっちゃん☆ねる,1130000,3か月前,3044,96
怒りたくないんだけど・・・・・,/watch?v=A9JuyOvJEFc,9865,あっちゃん☆ねる,1130000,3か月前,3044,324
今日心に刺さったコメントが有りました・・・,/watch?v=qPrB-z89c9U,6420,あっちゃん☆ねる,1130000,3か月前,3044,211
ハマチと真鯛で手こね寿司美味しかったよぉ～☆,/watch?v=niZsb6oGKZo,2415,あっちゃん☆ねる,1130000,3か月前,3044,79
ハマチと真鯛で手こね寿司作ろぉ～☆,/watch?v=rqZwM2WNXwM,1189,あっちゃん☆ねる,1130000,3か月前,3044,39
498円のハマチ捌きます☆,/watch?v=oikt0jhCg80,792,あっちゃん☆ねる,1130000,3か月前,3044,26
生姜の佃煮作ります☆下茹中になめたけと酢玉ねぎも作っちゃおぉ～☆,/watch?v=rqeSGPUcoGk,1416,あっちゃん☆ねる,1130000,3か月前,3044,47
ついに全国緊急事態宣言外出リスク避けるための１週間半分の食材紹介するね☆,/watch?v=Xxp4IGlg8Bk,2624,あっちゃん☆ねる,1130000,3か月前,3044,86
エバグリーンのお弁当食べよ☆,/watch?v=92D3raSOlL0,2773,あっちゃん☆ねる,1130000,3か月前,3044,91
コロナ感染リスク減らすため1週間半分くらい食材買い出しドライブ☆,/watch?v=szninrWtqMg,2021,あっちゃん☆ねる,1130000,3か月前,3044,66
緊急事態宣言でお買い物頻度減らそう☆今週のお買い物計画１週間半分☆,/watch?v=qOY8_R6r2Ts,1819,あっちゃん☆ねる,1130000,3か月前,3044,60
ビネガージンジャーハムピザトースト美味しいよ☆,/watch?v=7emRrYBhXcs,2592,あっちゃん☆ねる,1130000,3か月前,3044,85
緊急事態宣言、全国に発令だとぉ～？,/watch?v=xda4S8g1HDY,5736,あっちゃん☆ねる,1130000,3か月前,3044,188
あっちゃん☆ねる頑張ってるからって豪華中に会席ご招待いただきました☆,/watch?v=y52-cmIEnkc,7520,あっちゃん☆ねる,1130000,3か月前,3044,247
緊急事態宣言自粛中観光に行った気分になってね】　奈良明日香村観光☆鬼の雪隠・俎・亀石編,/watch?v=IjYb8p23kOM,2673,あっちゃん☆ねる,1130000,3か月前,3044,88
お昼ごはんゆるっとジャンクでwそして雑談☆,/watch?v=X3ZYuViBvAk,3887,あっちゃん☆ねる,1130000,3か月前,3044,128
ちょっと可愛い新アズキルーペw届きましたｖ☆,/watch?v=WfweaNVhsao,1809,あっちゃん☆ねる,1130000,3か月前,3044,59
免疫力向上焼きバナナチーズトースト☆,/watch?v=oyrNJ109KLg,1960,あっちゃん☆ねる,1130000,3か月前,3044,64
しあわせあっちゃん☆よっぱらいぶ,/watch?v=YhM2NuhKVgs,3892,あっちゃん☆ねる,1130000,3か月前,3044,128
筍ごはんと熟成鶏ももの塩焼き美味しかったよぉ～☆,/watch?v=B3K_nabwiWk,3818,あっちゃん☆ねる,1130000,3か月前,3044,125
熟成鶏もも焼いてみよぉ～☆,/watch?v=CdlhhS8-TLQ,1638,あっちゃん☆ねる,1130000,3か月前,3044,54
緊急事態宣言自粛で桜が見れない人行った気分になってね】４月１４日吉野山の桜は・・・・・☆,/watch?v=e9wio4ehoS8,2126,あっちゃん☆ねる,1130000,3か月前,3044,70
明日香農村レストラン夢市茶屋さんで古代米御膳☆,/watch?v=Kzhhy6sDUFs,4299,あっちゃん☆ねる,1130000,3か月前,3044,141
ランボルギーニ？シザースドアの2人乗りで明日香村ドライブ☆,/watch?v=hHRwsDzDThU,4420,あっちゃん☆ねる,1130000,3か月前,3044,145
なめたけハムピザトースト美味しかったよ☆,/watch?v=iZcDkkj9A4Q,1578,あっちゃん☆ねる,1130000,3か月前,3044,52
今夜は23時位まで,/watch?v=etO1l8JgN3M,3552,あっちゃん☆ねる,1130000,3か月前,3044,117
