title,url,view,channel_name,channel_subscriber,create_stamp,mean_view,mean_comparison
あったかお弁当】トリュフ香る焼き鳥弁当☆２学期３１日目高校男子のお弁当つくり２０５日目☆,/watch?v=rz3-M0bUrOs,870,あっちゃん☆ねる,1130000,9か月前,3044,29
ミラクルバストの衝撃、バストアップエステComodoさんであっちゃん☆のおっぱいがおっきくなるのかな？,/watch?v=87cAOtRDQcY,7155,あっちゃん☆ねる,1130000,9か月前,3044,235
動画の不備についてのお詫びと再アップロードのお知らせ,/watch?v=FBeH94HpayE,1869,あっちゃん☆ねる,1130000,9か月前,3044,61
鶏ももの塩焼きとサメのすくめで晩ごはん☆,/watch?v=vED5PDt65ag,2673,あっちゃん☆ねる,1130000,9か月前,3044,88
鶏もも焼きます☆,/watch?v=fvhfyD1UiMI,608,あっちゃん☆ねる,1130000,9か月前,3044,20
津軽の郷土料理サメのすくめ作ってみたよ☆,/watch?v=a1fcMh1N6ck,976,あっちゃん☆ねる,1130000,9か月前,3044,32
カップヌードルチーズカレーにチーズ増し増し☆,/watch?v=6_UA1EDOr9U,2291,あっちゃん☆ねる,1130000,9か月前,3044,75
視聴謝さんプレゼント企画】SDユニコーンガンダム作りますVol 1☆,/watch?v=e9FlD8y23U0,968,あっちゃん☆ねる,1130000,9か月前,3044,32
サメのからあげサンドが絶品☆,/watch?v=OL2O8GuY1Zc,1473,あっちゃん☆ねる,1130000,9か月前,3044,48
アンチめメンタル崩壊、泣かされた．．．．．,/watch?v=CoHXMXr2gjI,8332,あっちゃん☆ねる,1130000,9か月前,3044,274
唐揚げ塩と醤油どっちがお好み？あっちゃん☆は鮫が好き☆,/watch?v=8iZERCIxa_I,4209,あっちゃん☆ねる,1130000,9か月前,3044,138
唐揚げ２種味つくりましょ？,/watch?v=yrfAFMTy2Dw,1207,あっちゃん☆ねる,1130000,9か月前,3044,40
梨の野菜ジュースとわさびおにぎりせんべい昼下がりのひととき☆,/watch?v=hXvTqg9gMaY,1309,あっちゃん☆ねる,1130000,9か月前,3044,43
シビレMAX汁なし坦々麺改汁あり担々麺ｗ☆,/watch?v=vfU0hVdB8j4,1947,あっちゃん☆ねる,1130000,9か月前,3044,64
しーちゃんからお誕生プレゼント頂きました☆,/watch?v=-D4XTydaAyw,2483,あっちゃん☆ねる,1130000,9か月前,3044,82
やっぱりバタートーストは美味しいね,/watch?v=C_rITEo6jVA,1605,あっちゃん☆ねる,1130000,9か月前,3044,53
USJお土産抽選準備中片手間ライブ、こらっw,/watch?v=XBaA3Xqa-zY,4405,あっちゃん☆ねる,1130000,9か月前,3044,145
あっちゃん☆ねる秋の遠足2019決定!!,/watch?v=_v_8Mdwmiw4,2712,あっちゃん☆ねる,1130000,9か月前,3044,89
USJ】ハロウィン フェスタ デ パレード☆レンタルあっちゃん☆,/watch?v=TGx5PblvR3g,1563,あっちゃん☆ねる,1130000,9か月前,3044,51
エバグリーンのお弁当お寿司お惣菜で晩ごはん☆,/watch?v=fZ-vYLrUceY,2641,あっちゃん☆ねる,1130000,9か月前,3044,87
うだ・アニマルパーク】ふれあい動物エリア散策☆レンタルあっちゃん☆,/watch?v=AEQksQKfr3c,1769,あっちゃん☆ねる,1130000,9か月前,3044,58
３種のお肉と鮫肉の焼きうどん☆,/watch?v=R5Eo7CFKFPs,2020,あっちゃん☆ねる,1130000,9か月前,3044,66
ホットプレートで焼きうどん作ろ☆,/watch?v=t0LPDwGitgc,1625,あっちゃん☆ねる,1130000,9か月前,3044,53
家族でポーチドカレーパン☆,/watch?v=Y0S4tZBIOSI,1489,あっちゃん☆ねる,1130000,9か月前,3044,49
シャークチキンカレーおいしかったよ☆,/watch?v=OC9KqwboTLQ,2962,あっちゃん☆ねる,1130000,9か月前,3044,97
鮫と鶏のカレー作ってみたよ☆,/watch?v=Kp-HHTuNseQ,1069,あっちゃん☆ねる,1130000,9か月前,3044,35
レンタルあっちゃん☆】しーちゃんとまったりデザートタイム☆,/watch?v=ggzdlFGlw1I,4430,あっちゃん☆ねる,1130000,9か月前,3044,146
レンタルあっちゃん☆】しーちゃんとアニマルパークでピクニックランチ☆,/watch?v=D6E_6W6szvY,8772,あっちゃん☆ねる,1130000,9か月前,3044,288
市内ロケ用かる～くメイクしよ☆,/watch?v=y2AfJ_0q6KU,2647,あっちゃん☆ねる,1130000,9か月前,3044,87
あっちゃん☆のロケ弁ｗ☆,/watch?v=exe3jPHf_Qg,1670,あっちゃん☆ねる,1130000,9か月前,3044,55
シャークサンドおいしかったよ☆,/watch?v=ySeiH2Anjis,1211,あっちゃん☆ねる,1130000,9か月前,3044,40
あったかお弁当】SPソースの焼肉弁当☆２学期３０日目高校男子のお弁当つくり２０４日目☆,/watch?v=CdScKhFJvhI,623,あっちゃん☆ねる,1130000,9か月前,3044,20
落ちちゃったwゆるライブに続きね,/watch?v=6eIVeV3JfCc,2252,あっちゃん☆ねる,1130000,9か月前,3044,74
ゆる〜くライブしよw,/watch?v=MCl-FCHvFSY,3030,あっちゃん☆ねる,1130000,9か月前,3044,100
ハロウィーンメイク・病みアリス☆,/watch?v=j36WpYTFrkM,3181,あっちゃん☆ねる,1130000,9か月前,3044,105
鶏もも焼きとサメチヌのお刺身ほかで晩ごはん☆,/watch?v=GM8bFR4GVD8,2246,あっちゃん☆ねる,1130000,9か月前,3044,74
突然鮮魚市のお知らせ、行かねばw☆,/watch?v=rCpBAEf8nSs,832,あっちゃん☆ねる,1130000,9か月前,3044,27
あっちゃん☆’ｓきっちん最大級のサメ捌いてみます☆,/watch?v=mdQiZe66VXw,1168,あっちゃん☆ねる,1130000,9か月前,3044,38
車中飯？】お昼ごはんは１７時６８円の・・・☆,/watch?v=inTwNVhBxeE,2807,あっちゃん☆ねる,1130000,9か月前,3044,92
近鉄特急ビスタカー２階車窓（榛原駅～鶴橋手前）☆,/watch?v=oT_0O_lJH1M,901,あっちゃん☆ねる,1130000,9か月前,3044,30
玉ねぎたっぷりベーコンピザトースト☆,/watch?v=lLT2NlbF1Ms,1818,あっちゃん☆ねる,1130000,9か月前,3044,60
あったかお弁当】豚の柚子胡椒炒め弁当☆２学期２９日目高校男子のお弁当つくり２０３日目☆,/watch?v=Frn33l4Qg88,805,あっちゃん☆ねる,1130000,9か月前,3044,26
あっちゃん☆ねるPresentsハロウィーンホラーナイト👻これシラフですからw,/watch?v=sPvzsLRT870,5890,あっちゃん☆ねる,1130000,9か月前,3044,193
USJ】ハロゥイーンホラーナイト2019☆レンタルあっちゃん☆,/watch?v=sIl1gEn-Ujw,2347,あっちゃん☆ねる,1130000,9か月前,3044,77
大量に登録解除覚悟】媚びないブレない流されない☆,/watch?v=gJyR3RRhFew,6343,あっちゃん☆ねる,1130000,9か月前,3044,208
あすかちゃんからプレゼントも頂きました☆,/watch?v=69jOIB8RNAA,3293,あっちゃん☆ねる,1130000,9か月前,3044,108
カップヌードル・イタリアンチキン味がめっちゃ美味しかったよ☆,/watch?v=zYO2NyvJV38,1819,あっちゃん☆ねる,1130000,9か月前,3044,60
何度も言うけどギャラリーのぼかし加工しません☆理由を解析しましょう,/watch?v=6p9CIuyvhyA,5171,あっちゃん☆ねる,1130000,9か月前,3044,170
野菜とベーコンのピザトースト☆,/watch?v=JCT0zhxT_3w,1262,あっちゃん☆ねる,1130000,9か月前,3044,41
あったかお弁当】鶏のイタリア風炒め当☆２学期２８日目高校男子のお弁当つくり２０２日目☆,/watch?v=dFmSxdMBeo8,771,あっちゃん☆ねる,1130000,9か月前,3044,25
真夜中のヒトリゴトちょっとだけ話しときたいこと,/watch?v=eFIJXcKRTTg,2917,あっちゃん☆ねる,1130000,9か月前,3044,96
悲報 ハロウィンないと,/watch?v=x5v_wI7EgHM,3666,あっちゃん☆ねる,1130000,9か月前,3044,120
ヨシキからの無茶振り？マックの照り焼き３種食べ比べてみたよ☆,/watch?v=YEpe1L65rZY,3090,あっちゃん☆ねる,1130000,9か月前,3044,102
秋の海遊館遠足・日程候補が決まりました,/watch?v=KEg5WxXENi0,2493,あっちゃん☆ねる,1130000,9か月前,3044,82
USJ 】道路？メインストリートで優雅にお茶会☆レンタルあっちゃん☆,/watch?v=wslbgCsHalo,5385,あっちゃん☆ねる,1130000,9か月前,3044,177
USJおみやげプレゼント☆第１弾,/watch?v=8ynQJ6rQM-c,2991,あっちゃん☆ねる,1130000,9か月前,3044,98
レンタルあっちゃん☆USJ編】駅までのドライブ故意の嫌がらせ？まじか？間に合わんかも・・・☆,/watch?v=chZv33Td6Kc,2526,あっちゃん☆ねる,1130000,9か月前,3044,83
レンタルあっちゃん☆USJ】アメリカンなゲームにチャレンジ☆,/watch?v=tR9bFr-IRT0,5600,あっちゃん☆ねる,1130000,9か月前,3044,184
朝ごはんピザトースト☆,/watch?v=Qn4P-UFqJho,1785,あっちゃん☆ねる,1130000,9か月前,3044,59
あったかお弁当】鶏中華風てりやき弁当☆２学期２７日目高校男子のお弁当つくり２０１日目☆,/watch?v=fCA7abcozoQ,552,あっちゃん☆ねる,1130000,9か月前,3044,18
USJ】ゾンビが出たからお土産買って帰ります☆,/watch?v=MgeCcFZATpY,3525,あっちゃん☆ねる,1130000,9か月前,3044,116
晩ごはん、あごだし九条ネギラーメンとサイン会？☆,/watch?v=HX3m9QryAHM,10810,あっちゃん☆ねる,1130000,9か月前,3044,355
USJ】セサミストリートボリウッドでLet's Dancin’☆,/watch?v=QuCLd99Tq5c,5468,あっちゃん☆ねる,1130000,9か月前,3044,180
レンタルあっちゃん☆あすかさん&ご家族さんとUSJジョーズの所でお昼ごはん頂きます☆,/watch?v=Hf9Sewx4ggc,14960,あっちゃん☆ねる,1130000,9か月前,3044,491
USJ到着、平日でも人多いね～☆,/watch?v=vOT1ywZfVUI,6327,あっちゃん☆ねる,1130000,9か月前,3044,208
近鉄特急ビスタカー２階席で朝ごはん☆,/watch?v=dN1Xgpr6s_4,4201,あっちゃん☆ねる,1130000,9か月前,3044,138
レンタルあっちゃん☆USJ仕様？やりすぎ？メイクします☆,/watch?v=huDAbh45LLI,5358,あっちゃん☆ねる,1130000,9か月前,3044,176
あったかお弁当】鶏ポンてりやき弁当☆２学期２６日目高校男子のお弁当つくり２００日目☆,/watch?v=Z20OvAJJT6I,1105,あっちゃん☆ねる,1130000,9か月前,3044,36
レンタルあっちゃん☆シュウくん企画】薔薇庭園、陸さんいてるかなレイさんかな？☆,/watch?v=JaYRe3WxwQk,1757,あっちゃん☆ねる,1130000,9か月前,3044,58
スーパーの見切り品お弁当&お惣菜ってこんなに安いの？☆,/watch?v=f15YGKIT2f8,3440,あっちゃん☆ねる,1130000,9か月前,3044,113
限定】チロルチョコ梨味？食べてみたよ☆,/watch?v=HbmzyHb7g2Q,984,あっちゃん☆ねる,1130000,9か月前,3044,32
残ったカレーでカレーパスタめっちゃ美味しかったよ☆,/watch?v=oP59XS6RMEY,2073,あっちゃん☆ねる,1130000,9か月前,3044,68
残ったカレーでカレーパスタ作ろ☆,/watch?v=TGFpgue9vO4,1201,あっちゃん☆ねる,1130000,9か月前,3044,39
限定】BOSSご褒美ラテベース・クリーミーベイクドチーズケーキ味飲んでみたけど・・・☆,/watch?v=ViGcs2fpXxw,1027,あっちゃん☆ねる,1130000,9か月前,3044,34
ポーチドカレーパン美味しいね☆,/watch?v=aWpRXpyaPrE,1461,あっちゃん☆ねる,1130000,9か月前,3044,48
色々入れたカレーめっちゃ美味しかったよ☆,/watch?v=ykXUuJsG-Ow,3024,あっちゃん☆ねる,1130000,9か月前,3044,99
カレーに色々入れてみよぉ～☆,/watch?v=cYdfkgUmD2M,1343,あっちゃん☆ねる,1130000,9か月前,3044,44
今日すぐ食べたいお漬物】白菜の柚子風味１時間漬作ってみたよ☆,/watch?v=OG25ZsjHaQc,1228,あっちゃん☆ねる,1130000,9か月前,3044,40
どん兵衛きつねうどん改酸辣湯味作ってみたら超絶品だったよｖ☆,/watch?v=h-_FIJAyeW4,2038,あっちゃん☆ねる,1130000,9か月前,3044,67
お醤油また少しヴァージョンアップしてみました☆,/watch?v=9d10Om2QBV8,1031,あっちゃん☆ねる,1130000,9か月前,3044,34
ホットドックのようなピザトースト☆,/watch?v=oiS68SDOJPY,1564,あっちゃん☆ねる,1130000,9か月前,3044,51
絶対階級学園】レイさんと薔薇階級ハッピーエンド☆,/watch?v=38NA1FFnb6U,2096,あっちゃん☆ねる,1130000,9か月前,3044,69
豚肩ロースブロック７２４ｇ焼きます☆,/watch?v=b9O7qqIoTw0,1146,あっちゃん☆ねる,1130000,9か月前,3044,38
昨日の晩ごはん、鶏むねのカレー香草パン粉焼きとお魚料理作ります☆,/watch?v=JABIsIGVdlY,1227,あっちゃん☆ねる,1130000,9か月前,3044,40
まったり車中飯】心の森でお弁当食べよ～☆,/watch?v=tsMPdBz9wjQ,6483,あっちゃん☆ねる,1130000,9か月前,3044,213
１０月２３日エバグリーン～エバグリーン雑談ドライブ☆,/watch?v=XamiQwTY--M,1115,あっちゃん☆ねる,1130000,9か月前,3044,37
ポーチドハム野菜たまごサンドカレー風味☆,/watch?v=9mTxZxXfZmA,1454,あっちゃん☆ねる,1130000,9か月前,3044,48
トリプルお弁当】豚の竜田焼き弁当☆２学期２５日目高校男子のお弁当つくり１９９日目☆今日は３人分☆,/watch?v=k2GkD1zqAow,1491,あっちゃん☆ねる,1130000,9か月前,3044,49
金曜のいつものライブｗ,/watch?v=0Rt1cEPycRE,3783,あっちゃん☆ねる,1130000,9か月前,3044,124
レンタルあっちゃん☆】しゅうくんのまちがいさがしの答え合わせ編☆,/watch?v=iHzKyhX6YuA,2340,あっちゃん☆ねる,1130000,9か月前,3044,77
親戚のおばちゃんにもらった栗ごはん美味しかったよ☆,/watch?v=bMzaFwZaBhE,2697,あっちゃん☆ねる,1130000,9か月前,3044,89
お魚４種（イシモチ・ホウボウ・真鯛・サゴシ）捌きます☆,/watch?v=IgwZlCw_0t0,580,あっちゃん☆ねる,1130000,9か月前,3044,19
コメント欄はきれいに使いましょ☆,/watch?v=TaxL3TBXCMw,3945,あっちゃん☆ねる,1130000,9か月前,3044,130
料亭あつみ】サゴシとイシモチでなんか作ります☆,/watch?v=YPICNr8cvZE,397,あっちゃん☆ねる,1130000,9か月前,3044,13
料亭あつみのお昼の定食】サゴシとイシモチのムニエルとお刺身定食９０円,/watch?v=rk5y40UAcDw,1656,あっちゃん☆ねる,1130000,9か月前,3044,54
１０月２４日とろ箱市で買ってきたもの紹介します☆,/watch?v=ceWLaTUpjII,1380,あっちゃん☆ねる,1130000,9か月前,3044,45
１０月２４日とろ箱市向かって雑談ドライブ☆あっちゃん☆の怖い夢のお話,/watch?v=RiL7QuYn5eA,981,あっちゃん☆ねる,1130000,9か月前,3044,32
黒酢入りポーチド野菜たまごサンド美味しかったよ☆,/watch?v=XiSLp_tMDAs,1640,あっちゃん☆ねる,1130000,9か月前,3044,54
Wお弁当】牛肉のオイスタートリュフてりやき弁当☆２学期２４日目高校男子のお弁当つくり１９８日目☆中学男子の分もね☆,/watch?v=SfAU1eFHD2s,793,あっちゃん☆ねる,1130000,9か月前,3044,26
絶対階級学園】レイさん・・・・・,/watch?v=IHNAbuSHJZ0,712,あっちゃん☆ねる,1130000,9か月前,3044,23
あったかお弁当】ボークジンジャーチャップ弁当☆２学期２３日目高校男子のお弁当つくり１９７日目☆,/watch?v=1aieQEM--1w,1188,あっちゃん☆ねる,1130000,9か月前,3044,39
しゅうくんに買っていただいただんご庄のお団子いただきました☆,/watch?v=PYVbk2dcc2U,2528,あっちゃん☆ねる,1130000,9か月前,3044,83
駿河湾しらす炊き込みご飯とヴルストとジャーマンポテト☆,/watch?v=1GfEyN0ytXo,2702,あっちゃん☆ねる,1130000,9か月前,3044,89
ヴルストとジャーマンポテト作ろ☆,/watch?v=DUPz2SKBAe8,1508,あっちゃん☆ねる,1130000,9か月前,3044,50
2019Autumn What's in my BAG☆,/watch?v=yvsYcij1iUI,2423,あっちゃん☆ねる,1130000,9か月前,3044,80
レンタルあっちゃん☆】しゅうくんとお昼ごはん焼肉特急編☆,/watch?v=eDNzubMpNhs,11753,あっちゃん☆ねる,1130000,9か月前,3044,386
amazonからまた荷物が届きましたｗ☆,/watch?v=jDPd9CI7ItY,1152,あっちゃん☆ねる,1130000,9か月前,3044,38
レンタルあっちゃん☆出動!!メイクしますね☆,/watch?v=vtM0mkU65jU,4260,あっちゃん☆ねる,1130000,9か月前,3044,140
ポーチドハムタマゴサンド食べながらレンタルあっちゃん☆のお話☆,/watch?v=RtsM356kTno,1835,あっちゃん☆ねる,1130000,9か月前,3044,60
豚のタレ焼き美味しかったよ☆,/watch?v=HmTDvet4i2o,3006,あっちゃん☆ねる,1130000,9か月前,3044,99
オークワの豚のタレ焼きに野菜ぶち込んで焼いてみたよ☆,/watch?v=QBftNxM33wY,1211,あっちゃん☆ねる,1130000,9か月前,3044,40
１０月１７日鮮魚市からの帰り道雑談ドライブ☆,/watch?v=HefRkbaxD5g,1178,あっちゃん☆ねる,1130000,9か月前,3044,39
amazonからいっぱい荷物が届きましたｗ☆,/watch?v=I9BzIYqxHW0,2653,あっちゃん☆ねる,1130000,9か月前,3044,87
瞬間湯沸かし器が壊れた？修理します☆,/watch?v=19WP-wYOwpE,3782,あっちゃん☆ねる,1130000,9か月前,3044,124
ポーチドハムタマゴサンドで朝ごはん☆,/watch?v=IOPUnFCDTaA,1877,あっちゃん☆ねる,1130000,9か月前,3044,62
祝1万人登録御礼＆絶対階級学園】レイさん・・・・・,/watch?v=tKxBxup64SE,1490,あっちゃん☆ねる,1130000,9か月前,3044,49
22時位までライブしよか,/watch?v=rALctWN2c9o,3553,あっちゃん☆ねる,1130000,9か月前,3044,117
晩ごはん代替え動画】ぴゅあちゃんなにか食べます☆,/watch?v=KY7MqY7Ko_M,3694,あっちゃん☆ねる,1130000,9か月前,3044,121
ゲームライブにご参加いただける方に守ってもらいたいこと,/watch?v=-gcR__Nzfv0,1689,あっちゃん☆ねる,1130000,9か月前,3044,55
修学旅行のお土産買いすぎw☆,/watch?v=oXrg1WXY8CE,2833,あっちゃん☆ねる,1130000,9か月前,3044,93
リストランテあつみ】適当に作った和風パスタ美味しかったよ☆,/watch?v=tryrCdkYZHw,2484,あっちゃん☆ねる,1130000,9か月前,3044,82
超簡単激安玉ねぎとベーコンの和風パスタ作ってみよぉ～☆,/watch?v=rX-QBVInazs,1299,あっちゃん☆ねる,1130000,9か月前,3044,43
１０月１７日鮮魚市までの雑談ドライブ☆,/watch?v=FmX9SJiwV0k,859,あっちゃん☆ねる,1130000,9か月前,3044,28
ベーコンたまごのオープンサンドで朝ごはん☆,/watch?v=jhVEhVQ7sGY,1725,あっちゃん☆ねる,1130000,9か月前,3044,57
久々のあったかお弁当】豚の竜田揚げ風弁当☆２学期２２日目高校男子のお弁当つくり１９６日目☆,/watch?v=pTgtv705Nsc,1003,あっちゃん☆ねる,1130000,9か月前,3044,33
絶対階級学園】学園の謎暴いてやるんだぁ～,/watch?v=wR5QamL9wOk,1919,あっちゃん☆ねる,1130000,9か月前,3044,63
太宰府天満宮名物梅が枝餅チンして食べたら美味しかったよ☆,/watch?v=ILhXcy52t24,1293,あっちゃん☆ねる,1130000,9か月前,3044,42
家族でつっつく富士山鍋美味しかったよぉ～☆,/watch?v=MRWOqyVsMjM,3547,あっちゃん☆ねる,1130000,9か月前,3044,117
富士山鍋つくってみよ～☆,/watch?v=aCeFoVuxHiI,2366,あっちゃん☆ねる,1130000,9か月前,3044,78
休日手抜き・ローソンお弁当☆札幌ラーメン雪風レビュー付き,/watch?v=jN7Tedw27dU,2625,あっちゃん☆ねる,1130000,9か月前,3044,86
１０月１７日トロ箱市の帰り道の雑談ドライブ☆,/watch?v=37g8kl43MS0,1295,あっちゃん☆ねる,1130000,9か月前,3044,43
ひかるんとポーチドたまごサンドで朝ごはん☆,/watch?v=KVPYT9bamzw,2368,あっちゃん☆ねる,1130000,9か月前,3044,78
秋&春の遠足企画みんなに相談ライブ☆,/watch?v=gIj2TtQEsrA,2912,あっちゃん☆ねる,1130000,9か月前,3044,96
ホットプレートで手羽元焼きます☆,/watch?v=_c4Q0uXiaoA,4262,あっちゃん☆ねる,1130000,9か月前,3044,140
料亭あつみ】お昼のマトウダイ定食仕込み編☆,/watch?v=xVzKbkC6a8w,1390,あっちゃん☆ねる,1130000,9か月前,3044,46
子供のお土産長崎南山手プリン食べ比べたら・・・☆,/watch?v=843-zF2tyYo,1975,あっちゃん☆ねる,1130000,9か月前,3044,65
黒鯛鍋の雑炊がめっちゃ美味しかったよ☆,/watch?v=_zjYWSUBshU,3340,あっちゃん☆ねる,1130000,9か月前,3044,110
黒鯛鍋作ります☆,/watch?v=Li9F_j1vtEE,1101,あっちゃん☆ねる,1130000,9か月前,3044,36
視聴者さんからぴゅあちゃんにもプレゼント頂きました☆,/watch?v=slQxdfnqV6w,1678,あっちゃん☆ねる,1130000,9か月前,3044,55
料亭あつみ】お昼のマトウダイ定食７０円☆,/watch?v=A1nyylD47lw,1908,あっちゃん☆ねる,1130000,9か月前,3044,63
自宅でスポーツジム？ダイエットにバストアップ肩こり解消☆,/watch?v=uZdKg07cuXs,1211,あっちゃん☆ねる,1130000,9か月前,3044,40
超ボリューミーポーチドハム野菜たまごサンド☆,/watch?v=_5hF-Afnrpg,1869,あっちゃん☆ねる,1130000,9か月前,3044,61
遅くなってごめんね、ゆる〜い？ライブしよ☆,/watch?v=3bRdWj-D1jU,3896,あっちゃん☆ねる,1130000,9か月前,3044,128
子供に大好評鶏むね香草カレーパン粉焼きと超新鮮なお刺身☆,/watch?v=OeOkBiCq89I,3285,あっちゃん☆ねる,1130000,9か月前,3044,108
激安で子供満足】鶏むねのカレー香草パン粉焼き☆,/watch?v=ZbRclqarrng,1251,あっちゃん☆ねる,1130000,9か月前,3044,41
スポーツ始めます、ジムから生中継？☆リングフィットアドベンチャー発売日レビュー☆,/watch?v=rDtZQ05gQcY,3793,あっちゃん☆ねる,1130000,9か月前,3044,125
１０月１７日海鮮市で買って来た超新鮮生きたチヌ（黒鯛）さばきます☆,/watch?v=DFPcxgTA7ks,451,あっちゃん☆ねる,1130000,9か月前,3044,15
１０月１７日トロ箱市で買ってきたもの紹介します☆,/watch?v=g3vtsej70Ls,1210,あっちゃん☆ねる,1130000,9か月前,3044,40
料亭あつみ】４種お魚の海鮮丼お昼の定食２８０円？実質１００円くらいかも☆,/watch?v=fDRiQtUrtgE,1748,あっちゃん☆ねる,1130000,9か月前,3044,57
料亭あつみ】お昼の4種の海鮮丼作ります☆,/watch?v=wSBZc1OfPW0,905,あっちゃん☆ねる,1130000,9か月前,3044,30
トロ箱市行道雑談ドライブ☆人間わがままになっていく生き物なお話☆,/watch?v=GngCfoxYZhA,1353,あっちゃん☆ねる,1130000,9か月前,3044,44
たまごとチーズのオープンサンド☆,/watch?v=THGBDs4SkYA,1989,あっちゃん☆ねる,1130000,9か月前,3044,65
奈良天理ラーメン】彩華ラーメンで晩ごはん☆,/watch?v=fxDE_U4p0bk,5615,あっちゃん☆ねる,1130000,9か月前,3044,184
スチーマーでシワ伸ばしてみたよ☆,/watch?v=TNkVpKqGO7I,2561,あっちゃん☆ねる,1130000,9か月前,3044,84
料亭あつみ】お昼のチダイ定食2人前398円☆,/watch?v=I9Uv3U49n1s,2385,あっちゃん☆ねる,1130000,9か月前,3044,78
料亭あつみ】お昼のチダイ定食仕込みます☆,/watch?v=CeZPTqXiH2w,781,あっちゃん☆ねる,1130000,9か月前,3044,26
視聴者さんからまたまたいっぱい大好きなアニメグッズいただきました☆,/watch?v=NR84vh1bTYU,1539,あっちゃん☆ねる,1130000,9か月前,3044,51
バストアップ？ポーチドたまごサンドで朝ごはん☆,/watch?v=4eq1s7tkzYU,1932,あっちゃん☆ねる,1130000,9か月前,3044,63
牧場物語再会のミネラルタウン発売日最速クリア！？☆,/watch?v=URcrivWo7Tw,1378,あっちゃん☆ねる,1130000,9か月前,3044,45
絶対階級学園】陸さんに告られちゃった♥,/watch?v=H1679Qw4u4c,1460,あっちゃん☆ねる,1130000,9か月前,3044,48
はま寿司で晩ごはん☆ちょこっと裏技アリｗ,/watch?v=fFgJCxWLhxs,5027,あっちゃん☆ねる,1130000,9か月前,3044,165
交通事故相談】ドアを開けて傷つけられたけど黙ってる加害者に修理代を請求できるのか？☆,/watch?v=u32rTtjy3eA,2047,あっちゃん☆ねる,1130000,9か月前,3044,67
どん兵衛酸辣湯味が最強に美味しかったよ☆,/watch?v=dTDGEnDe6e0,1807,あっちゃん☆ねる,1130000,9か月前,3044,59
学校の役員に任命さてた方の悩み相談,/watch?v=xP6lggXgE5M,2387,あっちゃん☆ねる,1130000,9か月前,3044,78
ビーフシチュードリアミートのチーズトースト☆,/watch?v=B4CeVJcNc2I,1654,あっちゃん☆ねる,1130000,9か月前,3044,54
添い寝ライブ☆一緒に寝よzzz,/watch?v=yVtSybyOyTY,3630,あっちゃん☆ねる,1130000,9か月前,3044,119
ビーフシチュードリアミートとグレのお刺身で晩ごはん☆,/watch?v=zTh9mwerA_A,3290,あっちゃん☆ねる,1130000,9か月前,3044,108
ビーフシチューでドリアミート作りながら、グレ（メジナ）捌きます☆,/watch?v=zIL-qukMDZM,1351,あっちゃん☆ねる,1130000,9か月前,3044,44
北海道物産店で買ってきたROYCE限定新じゃがポテトチップチョコ美味しかったよ☆,/watch?v=YYl69YQHJ04,1252,あっちゃん☆ねる,1130000,9か月前,3044,41
休日お昼ホットプレートで焼きうどん☆,/watch?v=zqWeltMB0Yw,2563,あっちゃん☆ねる,1130000,9か月前,3044,84
オーストラリアの最終兵器食品ベジマイト食べてみたら．．．．☆,/watch?v=08sHS_4xbL4,1606,あっちゃん☆ねる,1130000,9か月前,3044,53
