title,url,view,channel_name,channel_subscriber,create_stamp,mean_view,mean_comparison
子猫の噛み癖を直すために兄猫が噛んでしつける貴重映像！,/watch?v=QiMskk2e04w,43774,まーくんと猫,1340000,1年前,72929,60
猫や犬の涙ヤケに効く薬を簡単に手作りできるので教えます！,/watch?v=Q02aFAVsW0o,22511,まーくんと猫,1340000,1年前,72929,31
かわいいアイドル猫2匹の寝起き生放送！,/watch?v=737YcsEWC2o,3553,まーくんと猫,1340000,1年前,72929,5
ミックス犬で1番人気！チワックスとポメラニアンの子犬が可愛い！,/watch?v=Ot4hwmdZJRU,13173,まーくんと猫,1340000,1年前,72929,18
猫は3日で記憶を無くすって本当なのか検証してみた！,/watch?v=8iURjlTgPF8,6483,まーくんと猫,1340000,1年前,72929,9
猫がまぐろの刺身を初体験で大興奮！w,/watch?v=-11CEkm-a8M,31024,まーくんと猫,1340000,1年前,72929,43
【柴犬】散歩が大好き過ぎる黒柴の老犬が可愛い！！,/watch?v=K7wqlx1rZgg,11138,まーくんと猫,1340000,1年前,72929,15
初めての雷に怖がりビビる猫がかわいい！w,/watch?v=10shOMhR3ag,23086,まーくんと猫,1340000,1年前,72929,32
【喧嘩】猫が子猫を追いかけ回す走り合う！そして仲良くじゃれ合う癒し動画！,/watch?v=77jHQcKBPlw,12703,まーくんと猫,1340000,1年前,72929,17
幽霊が見える猫と心霊スポット行ったら察知して暴れ出した...,/watch?v=fnNeBfCgqBU,10090,まーくんと猫,1340000,1年前,72929,14
尻尾の動きで分かる猫の気持ち５選！【豆知識】,/watch?v=5HkTMSiUPS8,5764,まーくんと猫,1340000,1年前,72929,8
豆柴と言われて飼った柴犬が成犬になったら超巨大に成長したww,/watch?v=8Dygdo26wls,325749,まーくんと猫,1340000,1年前,72929,447
猫が楽しく遊びながらエサを食べれる画期的なアイテム発明した！【オススメ】,/watch?v=b42-3gxmfvI,3225,まーくんと猫,1340000,1年前,72929,4
【検証】飼い主がイメチェンしたら飼い猫は気付いてくれるのか？！,/watch?v=2M5pA-iBamA,3575,まーくんと猫,1340000,1年前,72929,5
【事故物件】新居に引っ越してから悪い出来事が立て続けに起こるので全て話します。,/watch?v=pkDsVGFLEsU,13886,まーくんと猫,1340000,1年前,72929,19
デブ猫のお腹がどんな高級枕よりも極上だった！【最上級】,/watch?v=W6unNxE2NbU,5789,まーくんと猫,1340000,1年前,72929,8
子猫が家の階段初体験でビビりながら登る姿が可愛い！w,/watch?v=GlAtSRd997M,7043,まーくんと猫,1340000,1年前,72929,10
重大発表,/watch?v=qwAhfI9PCk4,10573,まーくんと猫,1340000,1年前,72929,14
飼い猫に他猫の鳴き声を聞かせたら会話し始めた！【奇跡】【スマホアプリ】,/watch?v=x50opWhtwAw,10695,まーくんと猫,1340000,1年前,72929,15
お触り禁止ねこ！身体は喜ぶのに頭を触れるとブチギレる猫w,/watch?v=_NiA0ab6HU8,10227,まーくんと猫,1340000,2年前,72929,14
【検証】猫は自分の名前を本当に理解しているのか？飼い主の声で反応してるだけなのか？,/watch?v=wVYz-ELhhGA,7772,まーくんと猫,1340000,2年前,72929,11
【ドッキリ】猫の前にゴキブリ置いたら野生本能が目覚めた！【ねこ cat】,/watch?v=FK3Q771mIF4,4191,まーくんと猫,1340000,2年前,72929,6
猫が初めてスライムを見た時の反応が面白いww【ねこ cat】,/watch?v=H4Etkh6iLJM,4408,まーくんと猫,1340000,2年前,72929,6
撫でると猫が喜ぶ身体の場所を教えます！これで野良猫も懐く！,/watch?v=dvAU0YvFvso,21725,まーくんと猫,1340000,2年前,72929,30
飼い主の臭い靴に甘える飼い猫が可愛い！【中毒】【匂いフェチ】【ねこ cat】,/watch?v=zwfTmS5rCD0,5077,まーくんと猫,1340000,2年前,72929,7
【世界初】二重まぶたの猫が存在した！【ねこ  cat】,/watch?v=hRupX5KPFEI,7376,まーくんと猫,1340000,2年前,72929,10
猫の爪とぎはタダで簡単に手作り出来る！【無料】【DIY】【ねこ cat】,/watch?v=uJs9hausPkk,5379,まーくんと猫,1340000,2年前,72929,7
長毛猫を初めて風呂に入れたら別人になったww【ねこ cat】,/watch?v=6sygHH1w3f4,17770,まーくんと猫,1340000,2年前,72929,24
【でぶ猫】メスの子猫が太り始めて来た！,/watch?v=U8wxfwEt5cg,5339,まーくんと猫,1340000,2年前,72929,7
トイレットペーパーの芯で猫のおもちゃが簡単に作れる！,/watch?v=BG-Ye98Pel4,8742,まーくんと猫,1340000,2年前,72929,12
猫が初めて自分の顔を鏡で見て失神してしまうw,/watch?v=MYDDRCYBqnI,16179,まーくんと猫,1340000,2年前,72929,22
飼い猫が大号泣で涙やけが良くならないので再度、動物病院に行きました【涙流病】,/watch?v=vIKRTcR_VCw,7842,まーくんと猫,1340000,2年前,72929,11
猫を飼うとこれだけたくさんの楽しい思い出が作れます！,/watch?v=oONDoDbUX5c,2984,まーくんと猫,1340000,2年前,72929,4
飼い猫が2歳の定期検診で動物病院で検査！果たして結果は？【健康診断】,/watch?v=eHEUqXclJU4,3193,まーくんと猫,1340000,2年前,72929,4
猫の家をダンボールで作ったら可愛かった！,/watch?v=RTZrHVVyu6M,10725,まーくんと猫,1340000,2年前,72929,15
猫が初めてシャボン玉を見た時の反応が凄い！【ビックリ】,/watch?v=pXS9U3f4kuE,6672,まーくんと猫,1340000,2年前,72929,9
親友猫2匹の睡眠を隠し撮り生放送！【爆睡】,/watch?v=IwgqjZZ6p78,3912,まーくんと猫,1340000,2年前,72929,5
室内飼いの子猫を初体験のお散歩に行ったら挙動不審だったww,/watch?v=jnx0u3th7KI,12249,まーくんと猫,1340000,2年前,72929,17
飼い猫2歳お誕生日を祝う！優しい気弱な性格のオス猫と飼い主の思い出！,/watch?v=HWARYXI6xwI,20878,まーくんと猫,1340000,2年前,72929,29
お触り禁止ねこ！顔は喜ぶのに体を触るとなぜかブチギレる猫w,/watch?v=RMd0riCci3c,14573,まーくんと猫,1340000,2年前,72929,20
世界一高級なエサ VS 安い餌！猫はどっちに飛びつくか検証【ほこたて】,/watch?v=PpeDznta3I4,7003,まーくんと猫,1340000,2年前,72929,10
飼い猫と飼い主がオソロの服を着る！【ドラえもん】【手作り】,/watch?v=pYZnOTAFEvU,5977,まーくんと猫,1340000,2年前,72929,8
猫はどうしてそんな所に...狭いところが大好きな不思議ねこ,/watch?v=cW0TGdNaxuA,7776,まーくんと猫,1340000,2年前,72929,11
【神グッズ】自動で回る猫じゃらしのおもちゃが便利でオススメ！,/watch?v=t2GgygLA7OQ,2935,まーくんと猫,1340000,2年前,72929,4
泥棒猫に唐草のコスプレさせたら盗む姿も可愛い！w,/watch?v=E-gdvAJ37OY,4885,まーくんと猫,1340000,2年前,72929,7
仲良し兄弟猫の生放送【癒し】,/watch?v=t0G7NIZHRRE,5661,まーくんと猫,1340000,2年前,72929,8
飼い猫の2歳の誕生日プレゼント！飼い主とのこれまでの思い出を大公開！,/watch?v=d9-KuHXhB7s,3406,まーくんと猫,1340000,2年前,72929,5
絶対キスさせてくれない猫 vs 絶対キスしたい飼い主【ほこたて】,/watch?v=o5CTSq_zlZI,8500,まーくんと猫,1340000,2年前,72929,12
猫とサッカーのPK対決したら爆笑だったw「ゴールネットDIY」,/watch?v=r1DxdeJeoD4,2727,まーくんと猫,1340000,2年前,72929,4
猫を飼う前に絶対この動画を見て下さい。「家が汚れる、家具が壊れる」心構え動画,/watch?v=T8nR31hLuNE,16604,まーくんと猫,1340000,2年前,72929,23
猫が夢中になって遊ぶスマホアプリのゲームをやらせてみた結果www,/watch?v=rXp3CEnJBgo,3039,まーくんと猫,1340000,2年前,72929,4
【必見】全猫が世界一喜ぶおやつを商品紹介します！,/watch?v=EATDiiz3PVc,13543,まーくんと猫,1340000,2年前,72929,19
猫に段ボールでもぐら叩き作ったら必死に猫パンチしてくれたwww【工作】,/watch?v=wOAhzU80an4,6097,まーくんと猫,1340000,2年前,72929,8
【祝】飼い猫が2歳の誕生日を迎えたので飼い主との感動の思い出を一挙公開！,/watch?v=baQT7THKhls,4049,まーくんと猫,1340000,2年前,72929,6
【ドッキリ】子猫の背後にきゅうり置くと驚く？  I put cucumbers behind cats,/watch?v=2oB3Aj2SmOE,2778,まーくんと猫,1340000,2年前,72929,4
子猫にディズニーキャラクターのマリーちゃんコスプレさせたら激似だったww,/watch?v=U4lNLs29nN8,10038,まーくんと猫,1340000,2年前,72929,14
猫に超巨大ジャンボすべり台をダンボールで作ったよ！手作りDIY,/watch?v=zb8eNiZw6DE,5990,まーくんと猫,1340000,2年前,72929,8
【珍しい猫】猫種がたくさんいる猫カフェに人生初めて行きました！,/watch?v=zjKspOBnfVM,12544,まーくんと猫,1340000,2年前,72929,17
猫が選ぶ、1番美味しいチュール頂上決定戦で意外な結果に！,/watch?v=yTkof9yIP7A,3379,まーくんと猫,1340000,2年前,72929,5
【大喧嘩】2匹の猫に1つのエサを与えると譲り合い食べてくれるのか？,/watch?v=UDPDe5RsV8c,11807,まーくんと猫,1340000,2年前,72929,16
超高速猫パンチ！興奮して遊ぶ子猫がたまらなく可愛い！猫じゃらし目線 - Fighting Cat -,/watch?v=zq429KLVTUc,2658,まーくんと猫,1340000,2年前,72929,4
【唖然】子猫、初めてのチュールを抱え込む噛みちぎるw,/watch?v=JL4v4679x0E,12201,まーくんと猫,1340000,2年前,72929,17
ダンボールだけで出来るネコの巨大迷路を作る！DIY,/watch?v=t-Mb6kQTKfU,4379,まーくんと猫,1340000,2年前,72929,6
【予言ネコ】ロシアW杯！日本vsセネガルの勝敗を予想したら意外な結果に...！,/watch?v=Vck4gE0J-Mw,2254,まーくんと猫,1340000,2年前,72929,3
巨大猫の2年前の貴重な子猫時代の映像が残ってました！！,/watch?v=XiPQV2_CVoM,5175,まーくんと猫,1340000,2年前,72929,7
メスの子猫と人間のポッキーゲームがラブラブすぎた！【禁断の恋】,/watch?v=R-ZGJZob_cc,5275,まーくんと猫,1340000,2年前,72929,7
子猫が飼い主に初めて突然甘える瞬間の貴重映像！！,/watch?v=j26UJv_w2PA,10753,まーくんと猫,1340000,2年前,72929,15
猫達とたくさんのおもちゃで遊んだよ！,/watch?v=HFLhb0qxBxs,3115,まーくんと猫,1340000,2年前,72929,4
猫の上に乗って堂々と寝る子猫が生意気すぎるww,/watch?v=Arw340MPH-Q,37824,まーくんと猫,1340000,2年前,72929,52
子猫がエルモ&クッキーモンスターを着たら最高にかわいい【3COINS×セサミストリートのコラボ】,/watch?v=uJb239MwQg8,3404,まーくんと猫,1340000,2年前,72929,5
【DIY】巨大な猫トイレ作ってみた！人間も入れる大きさ【猫砂１０袋分】,/watch?v=sCazY-9cgqA,7617,まーくんと猫,1340000,2年前,72929,10
子猫がミルクを卒業する瞬間！水をたくさん飲むようになりました！,/watch?v=SH-CHsAZocc,7841,まーくんと猫,1340000,2年前,72929,11
【赤ちゃん猫】一生懸命テレビを見る子猫がまるで人間のようで面白い！,/watch?v=tRZXBJXNY74,3767,まーくんと猫,1340000,2年前,72929,5
子猫の大ジャンプが想像以上の飛距離だった！【驚愕】【衝撃】,/watch?v=K9oWWVjhM0E,4551,まーくんと猫,1340000,2年前,72929,6
子猫に爪とぎを教える兄猫がすごく優しい！【仲良い猫】,/watch?v=tmusneO8178,16045,まーくんと猫,1340000,2年前,72929,22
乳歯で歯がかゆい子猫は何でも噛む！【あま噛み赤ちゃん】,/watch?v=Tr76xj8L2X4,6206,まーくんと猫,1340000,2年前,72929,9
どっちの猫が一番早いか一緒に競争させてみた！【エキゾチックショートヘア子猫vsサイベリアン成猫】,/watch?v=zGqEKld_juE,4207,まーくんと猫,1340000,2年前,72929,6
【ねこ実写版】人間が１週間お風呂に入らないで毛繕いだけで生活したら臭くなる？【検証】,/watch?v=7p_v6uK1a7U,2873,まーくんと猫,1340000,2年前,72929,4
【赤ちゃん猫】二足歩行で立ち上がる子猫が存在した？！,/watch?v=FzkysBAkJ3E,4025,まーくんと猫,1340000,2年前,72929,6
オス猫とメス猫の生配信！,/watch?v=liscX8ugdL0,4823,まーくんと猫,1340000,2年前,72929,7
【深刻な病気？】子猫がいつも大号泣して見える流涙症について病院で検査してきました,/watch?v=HeZBXVJuBjg,10050,まーくんと猫,1340000,2年前,72929,14
子猫にゼリーあげたら喜ぶ？【夏バテ】【熱中症】【対策】,/watch?v=-L6X1w8pHak,11641,まーくんと猫,1340000,2年前,72929,16
【子猫】餌をどうしても食べたくて壁を這い上がるストーカー猫【スパイダーマン】,/watch?v=2uBOKvdRzI4,9378,まーくんと猫,1340000,2年前,72929,13
飼い主から突然電話がかかって来たときの猫たちの反応をモニタリング！,/watch?v=3aH60zgjNow,7159,まーくんと猫,1340000,2年前,72929,10
【マイメロディ実写化】子猫にマイメロのコスプレ着させたら同一人物になった！w,/watch?v=GdoH32NA8F0,11493,まーくんと猫,1340000,2年前,72929,16
子猫が初めての病院でワクチン接種で大暴れ？【恐怖の注射】,/watch?v=wHG8vZCQF-c,34137,まーくんと猫,1340000,2年前,72929,47
【ビックリ猫】人間のような体勢で毛繕いする猫がいた！,/watch?v=6doDp5Ceo70,5429,まーくんと猫,1340000,2年前,72929,7
ふみふみする子猫が可愛い【A kitten kneading】,/watch?v=tNVSD1v8zoc,7631,まーくんと猫,1340000,2年前,72929,10
飼い主の顔面に餌を置いたら飼い猫に顔の肉まで食べられました...【流血】,/watch?v=ZzrpSo6iKfw,3275,まーくんと猫,1340000,2年前,72929,4
【子猫】エキゾチックショートヘアとサイベリアンの生放送！,/watch?v=QpWP357NRdo,6013,まーくんと猫,1340000,2年前,72929,8
【朗報】猫アレルギーを出さない種類が存在した！【猫好き必見】,/watch?v=YDCA5AMfP2k,21453,まーくんと猫,1340000,2年前,72929,29
【子猫】1日20時間寝る赤ちゃん猫に密着してみた！,/watch?v=Fg2Ywb7U4QQ,13808,まーくんと猫,1340000,2年前,72929,19
大型猫の長毛種にファーミネーター使った結果とんでもない量の毛玉が取れた！,/watch?v=3yJYGv52X4A,33226,まーくんと猫,1340000,2年前,72929,46
【泥棒猫】自分より大きい食べ物を持っていこうとする子猫に癒される！,/watch?v=TOQyttJk_Go,18694,まーくんと猫,1340000,2年前,72929,26
エキゾチックショートヘアの子猫に変顔させたら放送事故になったww【ブサカワ】,/watch?v=Al-MJ6kcNbI,9025,まーくんと猫,1340000,2年前,72929,12
子猫が掃除機で大パニックになり大号泣してしまった...,/watch?v=QtOXwYf-Bys,134720,まーくんと猫,1340000,2年前,72929,185
【子猫】ビニール袋にすっぽり収まるやんちゃな赤ちゃん猫が可愛い！,/watch?v=2E1UzhOWr1g,9818,まーくんと猫,1340000,2年前,72929,13
【猫にイチゴ】猫用いちごは食べてくれるのか？,/watch?v=QiStbpWn54o,9685,まーくんと猫,1340000,2年前,72929,13
【貴重映像】突然家の前に野良猫が現れた！！！,/watch?v=0FPBxEhVtx8,11678,まーくんと猫,1340000,2年前,72929,16
子猫にサングラスかけたら最高にワイルド！【ねこ用グラサン】,/watch?v=tBzScquBtiw,7717,まーくんと猫,1340000,2年前,72929,11
【子猫】飼い主の抱っこで寝る赤ちゃん猫が癒される！,/watch?v=yrIVVvZDbEM,20809,まーくんと猫,1340000,2年前,72929,29
子猫が爪切り初体験したらてんやわんやだった【赤ん坊ねこ】,/watch?v=hFV_JwsMWF4,9331,まーくんと猫,1340000,2年前,72929,13
赤ちゃん猫の毛繕いが下手くそで可愛いw【子猫の成長】,/watch?v=miqFF7WodhI,9986,まーくんと猫,1340000,2年前,72929,14
猫2匹の避妊と去勢手術についてお話しします【発情期のオス猫と子猫のメス猫は危険なのか】,/watch?v=EnQWSi_UVLI,12308,まーくんと猫,1340000,2年前,72929,17
【飼い主がヘリウムガス】猫は声質ではなく見た目で判断してる説【検証】,/watch?v=4TjO6ER7mUQ,4349,まーくんと猫,1340000,2年前,72929,6
【絆】抱き合う寄り添う子猫達に癒される【姉妹猫】【兄弟猫】,/watch?v=V7SSwZQM2-Q,39531,まーくんと猫,1340000,2年前,72929,54
【神回】猫にウインナーをあげたら喜ぶ？【チキンソーセージ】,/watch?v=l2sMaDw0bpY,11304,まーくんと猫,1340000,2年前,72929,16
【のせ猫】ねこの手の上にいろんなものを置いてみた！,/watch?v=d7JIeYZsODI,5106,まーくんと猫,1340000,2年前,72929,7
だっこ大嫌いな猫vs絶対だっこしたい飼い主【ホコタテ】,/watch?v=4Tj74dnvnFI,13087,まーくんと猫,1340000,2年前,72929,18
子猫のミルク&エサやりの仕方！赤ちゃん猫の食べっぷりがすごい！,/watch?v=38ex9hW1pzM,30163,まーくんと猫,1340000,2年前,72929,41
【仔猫】初体験で一生懸命トイレを頑張る赤ちゃん猫が可愛い！,/watch?v=R8vojKc66WE,20699,まーくんと猫,1340000,2年前,72929,28
【長毛猫あるある】足の裏に毛が生えるのでバリカンで速攻カット【裏ワザ】,/watch?v=n1-a8WTBRGc,11695,まーくんと猫,1340000,2年前,72929,16
【ブサカワ】子猫のエキゾチックショートヘアーの名前が決まりました！【YouTubeライブストリーム】,/watch?v=pimpIphfHOU,10454,まーくんと猫,1340000,2年前,72929,14
【悶絶注意】子猫をこちょこちょしたら可愛すぎた【Surprised Kitten】,/watch?v=U7G-fr6aVBU,32199,まーくんと猫,1340000,2年前,72929,44
赤ちゃん猫に毛繕いする兄猫の愛情が最高に可愛い！【子猫】,/watch?v=BV358FFMN2w,72369,まーくんと猫,1340000,2年前,72929,99
【ブサカワ】この子猫の名前を募集します！視聴者さんみんなで決めてください！,/watch?v=O7N5VZ5PNI8,8157,まーくんと猫,1340000,2年前,72929,11
先住猫と新入りの子猫を初対面させてみた【赤ちゃんねこ日記】,/watch?v=EKdq1OppIt0,226504,まーくんと猫,1340000,2年前,72929,311
【仔猫】とても人懐こい赤ちゃん猫【baby cat so cute!】,/watch?v=puOXLi2Q5LI,48998,まーくんと猫,1340000,2年前,72929,67
【甘えん坊ねこ】濡れた飼い主を一生懸命拭いてあげる猫がすごく優しい！,/watch?v=EU5prkH3PpE,6209,まーくんと猫,1340000,2年前,72929,9
【番猫】突然飼い主が拉致され必死に助けようとする猫がたまらなく可愛い！,/watch?v=wjwJy8h676s,7114,まーくんと猫,1340000,2年前,72929,10
猫とプニプニなボールで遊んだ！【生放送】,/watch?v=0dIgETEy5qA,2554,まーくんと猫,1340000,2年前,72929,4
ねこにジュース飲ませてみた！【ポカリスエット】,/watch?v=YXRiDYgiowg,6624,まーくんと猫,1340000,2年前,72929,9
飼い主にマッサージしてくれる気遣いねこが最高にめんこい！！,/watch?v=zwdIAmPRqUg,4987,まーくんと猫,1340000,2年前,72929,7
なぜ猫の去勢手術をしなかったのかを話します。【腰振りの真実】,/watch?v=R__KFhAarxA,14068,まーくんと猫,1340000,2年前,72929,19
【モニタリング】ねこは飼い主が寝ている時に何してるのか？,/watch?v=Q0ojN_yuRPo,13560,まーくんと猫,1340000,2年前,72929,19
ねこにサランラップドッキリしかけたら強引に突破してきたwwww,/watch?v=hl3-MQncAns,27287,まーくんと猫,1340000,2年前,72929,37
【大暴れ】猫の爪切りは想像以上に死闘なんです...,/watch?v=uVgcH_Qh65c,41213,まーくんと猫,1340000,2年前,72929,57
猫の尻尾に目玉をつけたら可愛い生き物が誕生したww,/watch?v=nTAfUnNvwXQ,5582,まーくんと猫,1340000,2年前,72929,8
【猫が歌う】さよならエレジー/菅田将暉(Covered by わたげ),/watch?v=i5ga-6QFJd0,4723,まーくんと猫,1340000,2年前,72929,6
猫の頑固な巨大毛玉を取る方法を教えます！【長毛ねこ飼ってる方必須】,/watch?v=s-ji31cEp6M,39097,まーくんと猫,1340000,2年前,72929,54
チャンネル登録者20000人突破!!今までの苦悩や感謝の気持ち、そしてこれからの抱負,/watch?v=TcMBlc2ZzyU,2411,まーくんと猫,1340000,2年前,72929,3
猫に変顔させたら面白すぎて衝撃的だった！笑【奇跡の一枚】,/watch?v=SQ4CTF_g7dE,4561,まーくんと猫,1340000,2年前,72929,6
ネコのうんこの臭いを軽減させるキャットフードは本当に効果があるのか検証してみた【便ランキング１位カナガン】,/watch?v=L7USKsIsTPs,9958,まーくんと猫,1340000,2年前,72929,14
ツンデレ猫を無視してぬいぐるみを可愛がると...ww【ねこの嫉妬】,/watch?v=1GEM3mc0BFA,17168,まーくんと猫,1340000,2年前,72929,24
世界初！喋れる猫が存在した【驚愕】,/watch?v=-AhLjo8fHi4,8916,まーくんと猫,1340000,2年前,72929,12
猫にケーキ食べさせてみた！【ねこのおやつ】,/watch?v=fwnFJA678Q0,8759,まーくんと猫,1340000,2年前,72929,12
愛猫わたげちゃんの生配信！,/watch?v=7wRGyLD3hHc,5268,まーくんと猫,1340000,2年前,72929,7
世界一高級なエサvs安いエサ！猫はどっちに飛びつくか検証【ほこたて】,/watch?v=PHY9fIC2yQM,43921,まーくんと猫,1340000,2年前,72929,60
長毛猫は簡単にイメチェンができてしまうんです【紳士系&ワイルド系】,/watch?v=N_NlXkl59UM,9742,まーくんと猫,1340000,2年前,72929,13
猫とミニ四駆で遊んでみた！【ハプニング発生】,/watch?v=7WXPdSjCfPI,2552,まーくんと猫,1340000,2年前,72929,3
猫にアイス食べさせてみた！【甘いもの初体験】,/watch?v=9R3zzL-wYJU,10625,まーくんと猫,1340000,2年前,72929,15
犯人が急に部屋に入ってきたら猫も番犬になれるのか？【泥棒】,/watch?v=DpniR5uaIVM,10491,まーくんと猫,1340000,2年前,72929,14
長毛猫が風呂に入ると別人になってしまう...【初体験】,/watch?v=vA-Iq6v2_Xs,17043,まーくんと猫,1340000,2年前,72929,23
発情期のオス猫が生まれて初めてのメス猫との対面！恋は実るのか？【整形アイドル轟ちゃん】,/watch?v=wnkE-G0HIpY,183018,まーくんと猫,1340000,2年前,72929,251
猫の毛の色次第ではSNOWが全く反応しない説【検証】,/watch?v=2ruoWMIrVII,3692,まーくんと猫,1340000,2年前,72929,5
猫とポッキーゲームしたら最高に可愛い！【BL】,/watch?v=GzyhMDt39F0,19922,まーくんと猫,1340000,2年前,72929,27
お手をする猫が実在した！【話題のねこ】,/watch?v=OEEmiQUw29w,8955,まーくんと猫,1340000,2年前,72929,12
猫は飼い主が変装しても気付いてくれるのか？【検証】,/watch?v=m5MKqD6hM3Y,5425,まーくんと猫,1340000,2年前,72929,7
猫にマタタビの木を丸ごと与えたら予想外の反応が...,/watch?v=iW_B9EVn8IY,8081,まーくんと猫,1340000,2年前,72929,11
ネコとベイブレードバーストで遊んだら強烈な猫パンチが炸裂したw【超高速回転】,/watch?v=9Q3neOXvYss,3907,まーくんと猫,1340000,2年前,72929,5
【勘違いネコ】自分と同じ色の毛は全部毛づくろいしちゃうの！！,/watch?v=mCyssGAuSQU,11479,まーくんと猫,1340000,2年前,72929,16
室内飼いのネコと公園の遊具でたくさん遊びました【外の世界にビックリする猫】,/watch?v=U5VjYtAKm00,15403,まーくんと猫,1340000,2年前,72929,21
【危険】猫は掃除でよく使う猛毒の塩素の匂いが大好きだった【要注意】,/watch?v=ZcK-kkbiw6o,7327,まーくんと猫,1340000,2年前,72929,10
猫におでんをあげてみた！【にゃんこ用おでんチキンスープ味】,/watch?v=lE56NlyxP7k,8014,まーくんと猫,1340000,2年前,72929,11
【ネコにドッキリ】主人が倒れた猫がまさかの行動【感動超大作】,/watch?v=Ycw1s_Dt8hY,21770,まーくんと猫,1340000,2年前,72929,30
ネコへの面白いチュールのあげ方５選【チャオちゅ〜る】,/watch?v=VbQtGzPKXjw,5400,まーくんと猫,1340000,2年前,72929,7
室内飼いのネコを初めての散歩に連れて行きました【外の世界にビックリする猫】,/watch?v=di2-ZYT2L_4,8116,まーくんと猫,1340000,2年前,72929,11
【バレンタイン】猫にもスペシャルディナーのフルコースを堪能させてあげたよ！,/watch?v=h-j34NQn73Y,5365,まーくんと猫,1340000,2年前,72929,7
ネコとレーザーポインターで遊んだら可愛すぎた！【パワフル猫】,/watch?v=p9U7bFzFLV8,4840,まーくんと猫,1340000,2年前,72929,7
【重大告知】これからのことを話します。,/watch?v=NZrqmDNqKv0,6399,まーくんと猫,1340000,2年前,72929,9
ロシアのネコが生まれて初めての雪に触れてサイベリアンの血が騒いだ！,/watch?v=-L1fdNgGJGc,10429,まーくんと猫,1340000,2年前,72929,14
ネコが家でお留守番してる様子をモニタリングしてみたら飼い主と感動の絆が生まれた...,/watch?v=6wI5vWmYzhw,11816,まーくんと猫,1340000,2年前,72929,16
【衝撃映像】ネコにマタタビを与えたら酔って想定外の行動をし始めた！www,/watch?v=VM7qalrURoU,9638,まーくんと猫,1340000,2年前,72929,13
