title,url,view,channel_name,channel_subscriber,create_stamp,mean_view,mean_comparison
捨て猫を保護したら風邪を引いてたので薬を飲ませる！,/watch?v=W32HXHZBnPc,98404,まーくんと猫,1340000,11か月前,72929,135
妹を玄関までお見送りしてあげる子猫たちが可愛い,/watch?v=nM-AcQfELXk,170443,まーくんと猫,1340000,11か月前,72929,234
捨て猫を保護して病院に連れてったらウイルス性の病気でした,/watch?v=fbZEOgqLFfY,213488,まーくんと猫,1340000,11か月前,72929,293
去勢手術で自分のタマタマが無くなってるのに気付いた猫の反応が面白い笑,/watch?v=tcI-dGbwZ3A,2518621,まーくんと猫,1340000,11か月前,72929,3454
捨て猫を保護して伸びきった爪を切ってたら寝ちゃった笑,/watch?v=eWw3J6N06Kg,136331,まーくんと猫,1340000,11か月前,72929,187
FIPと診断された母猫の子猫が去勢手術へ...結果は？,/watch?v=OxtPs9AmDzs,81150,まーくんと猫,1340000,11か月前,72929,111
保護した捨て猫の性別を調べてみました！,/watch?v=UKZ9xefKZm0,105201,まーくんと猫,1340000,11か月前,72929,144
【猫の性格】メス部屋とオス部屋の散らかり方の違いがすごい...！！,/watch?v=1OosDr65S8w,311824,まーくんと猫,1340000,11か月前,72929,428
捨て猫を保護してご飯をあげたら泣きながら食べてくれた,/watch?v=dhNq89JHgNE,948942,まーくんと猫,1340000,11か月前,72929,1301
子猫が道に捨てられていたので保護しました,/watch?v=0n_Vzi93a6c,817867,まーくんと猫,1340000,11か月前,72929,1121
子猫に家の家具を破壊されました...,/watch?v=obIspUhQ6Rs,44000,まーくんと猫,1340000,11か月前,72929,60
飼い主と一緒の布団で朝を迎える子猫が可愛すぎた,/watch?v=rINQ7k1BJBo,65716,まーくんと猫,1340000,11か月前,72929,90
家に知らない美女が急に帰宅した時の猫4匹の反応が面白い笑,/watch?v=MjbEFDcun7E,406878,まーくんと猫,1340000,11か月前,72929,558
【報告】事務所に所属することになりました,/watch?v=LCVQNMFQthg,29641,まーくんと猫,1340000,11か月前,72929,41
子猫が初めて焼きいもを食べるとこうなります笑,/watch?v=ilxS68e2sWk,41552,まーくんと猫,1340000,11か月前,72929,57
炭酸水を見ると反応しちゃう子猫がかわいい！シュワシュワ音フェチASMR,/watch?v=PQUScsFXxW8,66222,まーくんと猫,1340000,11か月前,72929,91
子猫が妹のメイクを邪魔しまくる姿がかわいい,/watch?v=oJxlEllwjQc,29269,まーくんと猫,1340000,11か月前,72929,40
去勢手術をしてから短期間で急激に太ってしまった猫...,/watch?v=j2M088iqC2E,31367,まーくんと猫,1340000,1年前,72929,43
子猫出産から６ヶ月。子猫たちの成長の変化がすごい！！,/watch?v=kLJPu9-BaK8,309439,まーくんと猫,1340000,1年前,72929,424
子猫の目の前でまぐろを捌くとこうなります笑,/watch?v=HYlHdSLRj-Y,78354,まーくんと猫,1340000,1年前,72929,107
子猫が生後半年での去勢手術が決まりました,/watch?v=_I_qPxojBAY,39426,まーくんと猫,1340000,1年前,72929,54
水風船を噛む子猫にこの後悲劇が…笑,/watch?v=HWhAOyAOv94,31184,まーくんと猫,1340000,1年前,72929,43
子猫の寝起きに密着！モーニングルーティンおもちくん,/watch?v=d102N_9DxzA,31732,まーくんと猫,1340000,1年前,72929,44
暑がりな子猫が初めてスイカを食べるとこうなります笑,/watch?v=YI7effBcEhQ,51016,まーくんと猫,1340000,1年前,72929,70
爪切りが嫌で妹に泣きながら訴える子猫がかわいい,/watch?v=R3Z5vMXoCGo,242996,まーくんと猫,1340000,1年前,72929,333
子猫と親猫のオス同士が交尾しました...その驚くべき理由とは？！,/watch?v=JPLlLAgMvjQ,182500,まーくんと猫,1340000,1年前,72929,250
子猫が親離れする時がいよいよ来ました...！,/watch?v=Kx4gqBrMyzw,126291,まーくんと猫,1340000,1年前,72929,173
家族が離ればなれになり数日、寂しくて泣いちゃう子猫たち,/watch?v=ws-RnhwWopw,50301,まーくんと猫,1340000,1年前,72929,69
子猫がローストビーフ初体験！驚きの美味しさに反応は...？,/watch?v=oKwPGrxiyCk,69140,まーくんと猫,1340000,1年前,72929,95
高い所から降りられず落下しちゃう子猫が心配で仕方ない…,/watch?v=-sm27ACZ4og,27201,まーくんと猫,1340000,1年前,72929,37
暑がりの子猫に冷たい猫鍋をあげたら反応が凄かった...！,/watch?v=Towy0NomdD0,47359,まーくんと猫,1340000,1年前,72929,65
妹にブラッシングされるとイヤイヤやらせてくれる子猫がかわいい,/watch?v=MMtwB86CWwI,30504,まーくんと猫,1340000,1年前,72929,42
愛猫が伝染性腹膜炎というかなり重いウイルスと診断されました,/watch?v=61MBnJTL7yI,79352,まーくんと猫,1340000,1年前,72929,109
子猫の朝に密着！モーニングルーティンあずきちゃん,/watch?v=QzNFITXPsAA,77881,まーくんと猫,1340000,1年前,72929,107
猫家族が別々に暮らすことになりました。,/watch?v=T5XlHTJNtK4,230899,まーくんと猫,1340000,1年前,72929,317
【事故防止】床で滑っちゃう長毛な子猫の肉球のはみ毛をカットします！,/watch?v=tbOwdMsvP2M,38196,まーくんと猫,1340000,1年前,72929,52
世界一高級な猫用ごはんを泣きながら食べる子猫が可愛いすぎた！,/watch?v=6gbwi0BxGBY,52234,まーくんと猫,1340000,1年前,72929,72
子猫の口呼吸から数日…部屋の中が大変な事に…,/watch?v=LCyk3c5DCT4,48267,まーくんと猫,1340000,1年前,72929,66
暑がりの子猫にひんやりシートをあげたら反応が可愛すぎた！,/watch?v=wylZ55tdTa0,50633,まーくんと猫,1340000,1年前,72929,69
子猫の口呼吸から2日目…猫の便秘に効くお腹の「のの字マッサージ」で回復を祈ります,/watch?v=xftlsmYPk8M,33103,まーくんと猫,1340000,1年前,72929,45
子猫の口呼吸から１日目、初めての投薬,/watch?v=48zVvv7lWT0,58287,まーくんと猫,1340000,1年前,72929,80
子猫が口呼吸をしていたので急遽病院へ…検査結果をご報告します,/watch?v=J5a_wyw-hJc,495228,まーくんと猫,1340000,1年前,72929,679
甘えたいのに無視されてブチギレする子猫が可愛すぎた…！,/watch?v=jyVmvw3wf9w,171509,まーくんと猫,1340000,1年前,72929,235
飼い主が突然部屋に引きこもったら猫はどんな反応をする！？,/watch?v=EcD_GIujDgQ,91984,まーくんと猫,1340000,1年前,72929,126
母猫がついに避妊手術へ…【皆様にご報告があります】,/watch?v=J-NjoWBu1oA,40347,まーくんと猫,1340000,1年前,72929,55
掴める水を掴めなくてイラついちゃう子猫がかわいい！,/watch?v=bkwUQFhnr5U,32496,まーくんと猫,1340000,1年前,72929,45
久しぶりに帰宅する飼い主を玄関で待つ子猫が可愛すぎた！,/watch?v=PA-whpVP-Us,271353,まーくんと猫,1340000,1年前,72929,372
妹の携帯いじりを邪魔する甘えたな子猫,/watch?v=jgx8R_Oi_Ng,34873,まーくんと猫,1340000,1年前,72929,48
子猫が過呼吸状態になり急遽病院に…詳しい方教えてください,/watch?v=9ki4_eTtyDk,60725,まーくんと猫,1340000,1年前,72929,83
暑がりの子猫に初めてチュールアイスをあげたら反応が凄すぎた…！,/watch?v=lN9F8itDbw8,157493,まーくんと猫,1340000,1年前,72929,216
暑がりの子猫が初めてクーラーを体験した時の反応が可愛すぎた！,/watch?v=ilEaPh_dyY4,85449,まーくんと猫,1340000,1年前,72929,117
子猫に初めてまたたびドーナッツをあげたら凄い事に・・・,/watch?v=rtDZTZigf4Q,52310,まーくんと猫,1340000,1年前,72929,72
寝ている子猫たちに「ご飯だよ！」と言ってみたら…！,/watch?v=RZv_e_wHZNs,102206,まーくんと猫,1340000,1年前,72929,140
父猫わたげのお誕生日会！母猫と子猫が祝う！,/watch?v=ujDGnjgyIzw,34196,まーくんと猫,1340000,1年前,72929,47
妹に甘えたすぎて洋服を毛づくろいしちゃう子猫がかわいい,/watch?v=VcFcjBhduzo,199359,まーくんと猫,1340000,1年前,72929,273
子猫が脱走してしまいました・・・【本当にごめんなさい】,/watch?v=350062pNZDM,73557,まーくんと猫,1340000,1年前,72929,101
飼い主のキスを猫パンチで全力回避する子猫がかわいい,/watch?v=mu6IrRyW0wY,63388,まーくんと猫,1340000,1年前,72929,87
初めて見るカリカリマシーンに興味津々な子猫がかわいい！,/watch?v=4bDG9N3gnYk,63025,まーくんと猫,1340000,1年前,72929,86
【留守番中の猫は何してる？】隠し撮りしたら意外な行動が可愛すぎた！,/watch?v=-Y1wLpWcBjk,88859,まーくんと猫,1340000,1年前,72929,122
猫の本気の大ジャンプが凄まじかった…！！,/watch?v=1PFIjQVqai0,14927,まーくんと猫,1340000,1年前,72929,20
ちゃんと座ってうんち出来ない子猫がかわいい,/watch?v=5mPCuQ-r3xw,42384,まーくんと猫,1340000,1年前,72929,58
【閲覧注意】腹ペコ猫の前で漁れたての生きた魚を捌いてみた,/watch?v=9s5nFFFkwPs,29331,まーくんと猫,1340000,1年前,72929,40
草むらでとてつもなく可愛い子猫を捕獲しました,/watch?v=C_YbYQRFBXs,65919,まーくんと猫,1340000,1年前,72929,90
兄と妹どっちが好き!?飼い猫を呼んで確かめたら意外な結果に・・・,/watch?v=ehF6n_yDlzM,52486,まーくんと猫,1340000,1年前,72929,72
加湿器を美顔器みたいに使う子猫がかわいい,/watch?v=iAlMdy9ZfBc,49571,まーくんと猫,1340000,1年前,72929,68
可愛すぎる子猫の鳴き声動画！誕生から生後４カ月までの鳴き声の変化がおもしろい！,/watch?v=vUvKvGVUWtM,264470,まーくんと猫,1340000,1年前,72929,363
猫家族に初めてマタタビをあげたら大喧嘩に・・・,/watch?v=yaz1bovTv08,33975,まーくんと猫,1340000,1年前,72929,47
子猫に超巨大プレゼントあげてみたらリアクションがおもしろい！,/watch?v=ImKB15BK6M0,54688,まーくんと猫,1340000,1年前,72929,75
子猫が流涙症という病気でした,/watch?v=L3nqOX4cTxI,71933,まーくんと猫,1340000,1年前,72929,99
久しぶりに帰宅した妹に愛猫のデレデレが止まりません,/watch?v=At-mSPZN-xY,64603,まーくんと猫,1340000,1年前,72929,89
子猫の体調が良く無いです・・・皆さん教えて下さい。,/watch?v=uUMROQRrf2s,53867,まーくんと猫,1340000,1年前,72929,74
とてつもなく可愛い子猫が外を歩いていました,/watch?v=t3Tweuf-LmQ,141250,まーくんと猫,1340000,1年前,72929,194
親猫にブチギレする子猫の怒りの理由に同情する,/watch?v=kYBon3__q2c,114198,まーくんと猫,1340000,1年前,72929,157
猫用トイレ掃除をずっと監視する子猫がかわいい,/watch?v=GY62J0Nvei4,42773,まーくんと猫,1340000,1年前,72929,59
リュックの中が大好きな子猫がかわいい,/watch?v=qZ4JJZ1u5yY,32838,まーくんと猫,1340000,1年前,72929,45
子猫が喋るぬいぐるみと初対面したらどんな反応する？,/watch?v=U5tSiftHsOI,25405,まーくんと猫,1340000,1年前,72929,35
子猫VS車海老,/watch?v=CClyNrxVHQ4,50615,まーくんと猫,1340000,1年前,72929,69
妹に初対面した子猫が初恋をしました,/watch?v=D9EKBD-_Mos,188439,まーくんと猫,1340000,1年前,72929,258
初めての焼肉をドキドキしながら見守る猫家族がかわいい,/watch?v=4Kb5ViwJCag,65190,まーくんと猫,1340000,1年前,72929,89
暑くてぺちゃんこに潰れちゃう子猫がかわいい,/watch?v=h7VEDsS0Shw,54388,まーくんと猫,1340000,1年前,72929,75
ぺろぺろ甘えながらオナラしちゃう子猫がかわいい,/watch?v=WtjrkEhVi00,143023,まーくんと猫,1340000,1年前,72929,196
兄弟子猫の大喧嘩遊びがかわいい！,/watch?v=TGkQ_rMWOPc,73284,まーくんと猫,1340000,1年前,72929,100
子猫に初めて首輪を着けたら大暴れ！,/watch?v=4vCvZCFCfuc,73416,まーくんと猫,1340000,1年前,72929,101
野良猫にストーカーされたので全力で懲らしめてみた,/watch?v=WrnqnVCzaGc,37721,まーくんと猫,1340000,1年前,72929,52
絶対見てほしいです。,/watch?v=vCzMSUQD8iM,66732,まーくんと猫,1340000,1年前,72929,92
出産後初めてのお風呂でシャンプーされて大絶叫！,/watch?v=IZT7b0WWLb4,98954,まーくんと猫,1340000,1年前,72929,136
お布団で一緒に寝てくれる子猫が可愛すぎた,/watch?v=uI7QbOYMCQ4,123509,まーくんと猫,1340000,1年前,72929,169
子猫が超問題児に…仲良しだった猫家族の間に亀裂が走る！！,/watch?v=v8fKIJ4NsXI,56969,まーくんと猫,1340000,1年前,72929,78
エキゾチックショートヘアのしわに溜まった汚れをごっそり取ってみた！,/watch?v=et4Id3WAYbU,258842,まーくんと猫,1340000,1年前,72929,355
ご飯の皿に見えない蓋があったら子猫はどんな反応をするの？,/watch?v=9cZ4mpaFvc8,69598,まーくんと猫,1340000,1年前,72929,95
兄妹子猫の抱っこの好き嫌いが面白い,/watch?v=WspuEYJf2g0,80726,まーくんと猫,1340000,1年前,72929,111
子猫が初めて納豆を食べるとこうなりますw,/watch?v=_W5Q1cK9fb4,125051,まーくんと猫,1340000,1年前,72929,171
猫用自動給水器に子猫が大興奮！,/watch?v=gWd-tG078Bk,66375,まーくんと猫,1340000,1年前,72929,91
子猫が極小犬と初対面したら大惨事に・・・,/watch?v=EdjbrO1AfFo,240268,まーくんと猫,1340000,1年前,72929,329
子猫に初めて耳かきをしたら何とも言えない表情でかわいい,/watch?v=TicBXFAhSh8,274191,まーくんと猫,1340000,1年前,72929,376
おやつをおねだりする子猫の鳴き声がかわいい,/watch?v=ViOd6b4xiEc,88453,まーくんと猫,1340000,1年前,72929,121
ケージから脱走出来ずに落ち込む子猫がかわいい,/watch?v=MA6wkKpDUWc,75971,まーくんと猫,1340000,1年前,72929,104
鼻クソがそよいじゃう子猫がかわいい,/watch?v=DAR2SAVr5sQ,26619,まーくんと猫,1340000,1年前,72929,36
自分は散らかしてないと目で訴える子猫がかわいい,/watch?v=N1_YZ6DZlak,58569,まーくんと猫,1340000,1年前,72929,80
どうしても薬を飲みたくない子猫がかわいい,/watch?v=G4u04dw9Tu4,702065,まーくんと猫,1340000,1年前,72929,963
病院で子猫がワクチン接種！注射を我慢してる姿もかわいい,/watch?v=DltaOY1v9eM,104505,まーくんと猫,1340000,1年前,72929,143
ルンバを自分で操作する子猫がかわいい,/watch?v=9qEaydHKurQ,33055,まーくんと猫,1340000,1年前,72929,45
初めてのファーミネーターが嫌すぎる子猫がかわいい,/watch?v=E2lQtYwnYA4,108433,まーくんと猫,1340000,1年前,72929,149
虫を必死に食べようとする子猫がかわいい,/watch?v=mEV6La9ebes,32138,まーくんと猫,1340000,1年前,72929,44
枕にしても怒らないもふもふの子猫がかわいい,/watch?v=qdupCtVqaIY,65318,まーくんと猫,1340000,1年前,72929,90
突然産箱に閉じ込められた子猫の表情がこちらです,/watch?v=JoWtWqCTDUI,67770,まーくんと猫,1340000,1年前,72929,93
自分はやっていないと目で訴える子猫がかわいい,/watch?v=QneGtQzbnMw,96480,まーくんと猫,1340000,1年前,72929,132
子猫の育児に疲れた母猫を救いたい【顎ニキビ治療】,/watch?v=6d6-XYBuAEg,56947,まーくんと猫,1340000,1年前,72929,78
エサをおねだりする子猫の鳴き声がかわいい,/watch?v=IQ2tP17DgKc,648222,まーくんと猫,1340000,1年前,72929,889
お風呂で命乞いする子猫がかわいい,/watch?v=J7SvU_AOeaM,820856,まーくんと猫,1340000,1年前,72929,1126
階段が怖くて泣き出してしまう子猫がかわいい,/watch?v=HN-WLJ92G1E,487347,まーくんと猫,1340000,1年前,72929,668
回し車を上手に回せないドジっ子な妹子猫がかわいい,/watch?v=HMsc4eL3_2A,46143,まーくんと猫,1340000,1年前,72929,63
飼い主の匂いに発情しちゃう子猫がかわいい,/watch?v=j6ikQTodDjE,36555,まーくんと猫,1340000,1年前,72929,50
巨大化してしまった子猫がかわいい,/watch?v=6pXKPGhAr-s,20559,まーくんと猫,1340000,1年前,72929,28
子猫の日常に癒される,/watch?v=EjYCeoi4gNI,20205,まーくんと猫,1340000,1年前,72929,28
生後３カ月になっても乳離れ出来ない子猫,/watch?v=YsHgdZsEvBc,42116,まーくんと猫,1340000,1年前,72929,58
子猫ブチギレで大変なことに・・・【子猫の成長日記 #67】Kitten and Cinderella Castle,/watch?v=cP19dkpqEf0,26750,まーくんと猫,1340000,1年前,72929,37
子猫がついに念願を達成しました！！【子猫の成長日記 #66】Twin kittens,/watch?v=Z9zEL3Hjbr0,33972,まーくんと猫,1340000,1年前,72929,47
ルンバに乗るのが大好きな白猫が可愛すぎたw【Kitten rides on roomba】【子猫の成長日記 #66】,/watch?v=0H7RDjXmZag,21609,まーくんと猫,1340000,1年前,72929,30
子猫にダンボールで巨大回し車を作る！！DIY【Cardboard Kitten Turning Wheel】【子猫の成長日記 #65】,/watch?v=gZxA7ipMcMA,27047,まーくんと猫,1340000,1年前,72929,37
短足すぎる子猫がぴょんぴょん飛び跳ねる姿がかわいい！【Short legs kitten is cute】【子猫の成長日記 #64】,/watch?v=s6A8ayv0lz0,21206,まーくんと猫,1340000,1年前,72929,29
子猫の動画を映画館で上映してみた,/watch?v=zUt2yhMBYGc,11119,まーくんと猫,1340000,1年前,72929,15
短足すぎてキャットタワーから落ちちゃう子猫【Kitten falling from a cat tower】【子猫の成長日記 #63】,/watch?v=-JMo0KbTSm0,56109,まーくんと猫,1340000,1年前,72929,77
子猫に巨大プラレールをプレゼントしたらまさかの展開に・・・【機関車トーマス】,/watch?v=P-cKOpA78Z8,19608,まーくんと猫,1340000,1年前,72929,27
子猫が洗濯機の中で反省しててかわいい,/watch?v=1PtheC6AcuE,118915,まーくんと猫,1340000,1年前,72929,163
大絶叫！！お風呂を死ぬほど嫌がる子猫 【Kitten screaming and yelling in the bath】【子猫の成長日記 #60】,/watch?v=5_TECTMROhk,95673,まーくんと猫,1340000,1年前,72929,131
子猫と息子が初対面した結果w,/watch?v=EIaq-Wn8u0Y,43368,まーくんと猫,1340000,1年前,72929,59
短足すぎる子猫が猫パンチする姿がかわいい！【The short-legged kitten has a pretty cat punch】【子猫の成長日記 #59】,/watch?v=eNMAOeRSdKE,71920,まーくんと猫,1340000,1年前,72929,99
子猫は自分の名前を理解している？4匹で実験してみたらまさかの結果に…！【子猫の成長日記 #58】,/watch?v=f-u4JpqE-GQ,482581,まーくんと猫,1340000,1年前,72929,662
子猫を助ける母猫の姿に癒される【すべり台から急降下・・・！？】The kitten looks pretty on a slide【子猫の成長日記 #58】,/watch?v=he8_8QfG9aM,54175,まーくんと猫,1340000,1年前,72929,74
子猫が０円で熱狂する方法！！【How to make a kitten enthusiast free】【子猫の成長日記 #57】,/watch?v=4KYEnYo8dHg,19169,まーくんと猫,1340000,1年前,72929,26
子猫が初めて外国人と会ったら,/watch?v=OnE-SVOo_1w,30353,まーくんと猫,1340000,1年前,72929,42
子猫初めてのワクチン接種！診察台でまさかの・・【Vaccination of kittens】【子猫の成長日記 #55】,/watch?v=X4SWHtzXxlM,71092,まーくんと猫,1340000,1年前,72929,97
子猫がおしゃぶり（指しゃぶり）をおねだりしてくるから構ったらそのまま寝たwww【The kitten is so cute】【子猫の成長日記  #54】,/watch?v=FybJDmvlofQ,32622,まーくんと猫,1340000,1年前,72929,45
初めてのルンバに戸惑う子猫がかわいい,/watch?v=rLK7aJvbtaI,37758,まーくんと猫,1340000,1年前,72929,52
"子猫の前で仰向けになる父猫！その""感動的""な理由とは！？【Cat family with love】【子猫の成長日記  #53】",/watch?v=WmfYEGTMX4w,70364,まーくんと猫,1340000,1年前,72929,96
子猫とイクメン父猫が遊ぶ姿がかわいくて癒される！！【Parenting cat】【子猫の成長日記  #52】,/watch?v=jEB-3N3_f2M,50286,まーくんと猫,1340000,1年前,72929,69
子猫がメイドカフェで働くことになりました！【Funny kitten】,/watch?v=IOzPlRbqErc,15080,まーくんと猫,1340000,1年前,72929,21
子猫が産箱(分娩室)を卒業しました。母猫と一緒に感謝を伝えます。【Thank you mother cat】【子猫の成長日記  #51】,/watch?v=sios1O77hXs,31668,まーくんと猫,1340000,1年前,72929,43
"出産から生後30日までの""子猫の成長が一目でわかる！""笑いあり！涙あり！家族の物語に心が暖まります！",/watch?v=XzA5E6lFDr0,163696,まーくんと猫,1340000,1年前,72929,224
"子猫が初めて見る""あるもの""に興味津々!!この顔は何に食いついてる!?【Cute kitten】【子猫の成長日記  #50】",/watch?v=9W3-fF-NfnQ,33613,まーくんと猫,1340000,1年前,72929,46
ねこじゃすりに甘える子猫がかわいい【Sweetened kitten】,/watch?v=VPj6SMRlAk0,26261,まーくんと猫,1340000,1年前,72929,36
紙袋からにゅるっと飛び出す子猫がかわいい【Cute cat playing with a paper bag】【子猫の成長日記  #49】,/watch?v=15sKnmtmuH4,33105,まーくんと猫,1340000,1年前,72929,45
よちよちさんぽする子猫がかわいい【Kitten to explore】【子猫の成長日記  #48】,/watch?v=FLH3mN5lTWs,28843,まーくんと猫,1340000,1年前,72929,40
子猫から飼い主に緊急SOS‼︎一体何が...!?,/watch?v=xT0er34sFXk,80459,まーくんと猫,1340000,1年前,72929,110
子猫のキメ顔がおもしろいw【Cute and funny kitten】【子猫の成長日記  #47】,/watch?v=z3ASDexqO3w,22969,まーくんと猫,1340000,1年前,72929,31
生後46日目！壁をよじ登る子猫がかわいすぎる！www【スパイダーマン】【A cute kitten climbing a wall】【子猫の成長日記  #46】,/watch?v=gccyNzV0fu8,53363,まーくんと猫,1340000,1年前,72929,73
子猫がポケモンの世界に飛び込んだ！！,/watch?v=p2-VvDeUpYI,9650,まーくんと猫,1340000,1年前,72929,13
生後45日目！暴走する子猫が家中で大暴れ！そこに何故かドヤ顔の父猫がwww【子猫の大運動会】【子猫の成長日記  #45】,/watch?v=ZO1oNEbiq4w,63697,まーくんと猫,1340000,1年前,72929,87
再会した猫家族にトラブル発生...！！子猫も困惑。これは一体...？？,/watch?v=J0_A0dkjgHw,311725,まーくんと猫,1340000,1年前,72929,427
猫家族が全員集合の生放送！！【報告もあります】,/watch?v=T1gC9U9o4hY,24618,まーくんと猫,1340000,1年前,72929,34
生後44日目！子猫のじゃれ合いが熱戦すぎて激かわいいw【子猫プロレス】【子猫の成長日記  #44】,/watch?v=8nFgMJh4Ob0,34980,まーくんと猫,1340000,1年前,72929,48
生後43日目！1日に20時間寝る赤ちゃん猫が可愛くて癒される！【子猫の成長日記  #43】Kitten to take a nap in an unprotected figure is pretty,/watch?v=nZPbBZhP7rA,35062,まーくんと猫,1340000,1年前,72929,48
"初めての""ちゅ〜る""に大興奮する子猫がたまらないかわいさ！【美し過ぎる子猫】kittens are excited in eating candy for cats",/watch?v=LB6ADENNkmU,44926,まーくんと猫,1340000,1年前,72929,62
"子猫が初めてトイレでうんちする姿が可愛くて感動する！【成長を実感】【子猫の成長日記  #42】cute kitten, first poo impressed.",/watch?v=YC-j6ok8S-M,527544,まーくんと猫,1340000,1年前,72929,723
子猫が爪とぎし始めたら可愛さマシマシだった件【驚愕のかわいさ】【子猫の成長日記  #41】,/watch?v=yDP2l1-6aRw,39966,まーくんと猫,1340000,1年前,72929,55
反抗期の子猫にトイレを教える英才教育猫ママに頭が上がらない！【子猫の成長日記 #40】,/watch?v=kHmq2c4mJSY,45116,まーくんと猫,1340000,1年前,72929,62
子猫を猫鍋にして美味しく頂いてみた,/watch?v=gIUdpO52wcs,39767,まーくんと猫,1340000,1年前,72929,55
子猫が初めてお皿でご飯を食べる！兄妹猫は上手に食べられる！？【子猫の成長日記  #39】,/watch?v=jqg9xsqV6SQ,34486,まーくんと猫,1340000,1年前,72929,47
生後38日目！子猫が甘えてくる姿に萌える！【美しすぎる子猫】【子猫の成長日記  #38】,/watch?v=Uv-rGOnXeWU,524683,まーくんと猫,1340000,1年前,72929,719
子猫や嫁猫と１ヶ月ぶりに再会する父猫の姿に涙が止まらない,/watch?v=nfdzlWBLz7U,415286,まーくんと猫,1340000,1年前,72929,569
子猫にドッキリ仕掛けたらリアクションが可愛すぎた！w【サランラップドッキリ】,/watch?v=YQsH_LlMHfo,121336,まーくんと猫,1340000,1年前,72929,166
父猫決意の去勢手術！家族と無事に再会できるのか・・・！？,/watch?v=DTbiPMPVkMc,25102,まーくんと猫,1340000,1年前,72929,34
【惑星ループ】子猫と元ダンサーが踊ってみた！,/watch?v=LNPMlOWkJts,30159,まーくんと猫,1340000,1年前,72929,41
生後37日目！子猫同士のディープキスって見たことありますか？【子猫の成長日記  #37】,/watch?v=QX5fhI2AUp8,41312,まーくんと猫,1340000,1年前,72929,57
