title,url,view,channel_name,channel_subscriber,create_stamp,mean_view,mean_comparison
ASMR MATCHA SHAVED ICE DESSERT 🍨BINGSU🍨 EATING SOUNDS MUKBANG,/watch?v=x49AQX0Z9hM,94274,MINEE EATS,1730000,1年前,608807,15
ASMR RAMYUN NOOLDES SPAM RICE BURGER *SLURP* EATING SOUNDS MUKBANG,/watch?v=oXI64wbrei8,420981,MINEE EATS,1730000,1年前,608807,69
ASMR 24K EDIBLE GOLD SAUSAGE RICE CAKE DUMPLINGS RICE BALLS EATING SOUNDS MUKBANG,/watch?v=6qSGqm3y8P4,196756,MINEE EATS,1730000,1年前,608807,32
ASMR EDIBLE SLIME FOOD PRANK ICE CREAM COOKIES COTTON CANDY🍦🍪🍭 EATING SOUNDS MUKBANG,/watch?v=KgivVUlnt58,316002,MINEE EATS,1730000,1年前,608807,52
ASMR BLACK BEAN NOODLES JJAJANGMYEON EATING SOUNDS MUKBANG NO TALKING,/watch?v=4yy5XGwVZa8,244289,MINEE EATS,1730000,1年前,608807,40
ASMR FIRE SAUCE FRIED CHICKEN & STRETCHY CHEESE 🧀 EATING SOUNDS MUKBANG NO TALKING,/watch?v=UTWMVH1NjuE,300656,MINEE EATS,1730000,1年前,608807,49
ASMR CHEESY BAKED SPAGHETTI 🍝  EATING SOUNDS NO TALKING MUKBANG,/watch?v=UzLXvYoYwFQ,279022,MINEE EATS,1730000,1年前,608807,46
ASMR GIANT MERINGUE *Soft Crunch* EATING SOUNDS NO TALKING MUKBANG,/watch?v=ksm9LI9xZt4,225377,MINEE EATS,1730000,1年前,608807,37
ASMR EXTREMELY CRUNCHY ENOKI MUSHROOMS with SPICY FIRE SAUCE EATING SOUNDS NO TALKING MUKBANG,/watch?v=8VjkaVduEdM,378455,MINEE EATS,1730000,1年前,608807,62
ASMR CORN CHEESE HOT CHEETOS CORN ON THE COB EATING SOUNDS MUKBANG,/watch?v=e_mbWWpJPs0,149472,MINEE EATS,1730000,1年前,608807,25
ASMR SUGARCANE HONEYCOMB JACKFRUIT EATING SOUNDS NO TALKING MUKBANG,/watch?v=mdTMvNJKaII,717030,MINEE EATS,1730000,1年前,608807,118
ASMR FRESH SPRING ROLLS *CRUNCHY* EATING SOUNDS MUKBANG,/watch?v=OxqtzYn5EIw,325340,MINEE EATS,1730000,1年前,608807,53
ASMR EDIBLE BATH BOMBS *FOAMY&POPPING* EATING SOUNDS *PRANK MUKBANG,/watch?v=c7meLBvKt6E,554607,MINEE EATS,1730000,1年前,608807,91
ASMR TOASTED MARSHMALLOWS S'MORES DIP *FLUFFY SOFT CRUNCH* EATING SOUNDS MUKBANG,/watch?v=C7oH8HUoAuI,499695,MINEE EATS,1730000,1年前,608807,82
ASMR 🥟DUMPLINGS🥟 with Fire Sauce🔥 EATING SOUNDS NO TALKING MUKBANG,/watch?v=FjCdhPzMtSw,310329,MINEE EATS,1730000,1年前,608807,51
ASMR XXTRA HOT CHEETOS FIRE NOODLES MAC&CHEESE EATING SOUNDS MUKBANG,/watch?v=-Hrs6CHRCsI,238640,MINEE EATS,1730000,1年前,608807,39
ASMR BUBBLE TEA BOBA MILK TEA GULPING SOUNDS MACARONS No Talking MUKBANG,/watch?v=aK1lyowIYAI,265664,MINEE EATS,1730000,1年前,608807,44
ASMR CHEESY CREAMY CARBO FIRE UDON NOODLES EATING SOUNDS MUKBANG,/watch?v=pGN8sL6KS7I,239005,MINEE EATS,1730000,1年前,608807,39
ASMR ICE❄️Cold Crunchy Ice Soft Ice Eating Sounds No Talking Mukbang,/watch?v=e1Bp0m073Gk,1501241,MINEE EATS,1730000,1年前,608807,247
ASMR SOUPY FIRE NOODLES WITH SHRIMPS FISH CAKES 불닭볶음탕면 EATING SOUNDS MUKBANG,/watch?v=9-AA2et8cOI,557075,MINEE EATS,1730000,1年前,608807,92
ASMR PURPLE NOODLE TTEOKBOKKI BUBBLE TEA CANDIED GRAPES GUMMY MACARONS ROCK CANDY CABBAGE,/watch?v=Ohpa8yKedSM,199039,MINEE EATS,1730000,1年前,608807,33
ASMR LAMB CHOP & ASPARAGUS EATING SOUNDS (No Talking) MUKBANG,/watch?v=ny34azU7_zk,215593,MINEE EATS,1730000,1年前,608807,35
ASMR PINK PASTA MACARONS MARSHMALLOWS DRAGON FRUITS LYCHEE COOKIES Eating Sounds Mukbang,/watch?v=B41I62IybiQ,448675,MINEE EATS,1730000,1年前,608807,74
ASMR CHEESY MOZZARELLA CHEDDAR CORN DOGS *CRUNCHY* EATING SOUNDS MUKBANG (No Talking),/watch?v=PZQKhBTocew,256362,MINEE EATS,1730000,1年前,608807,42
"ASMR BLACK FOOD (NOODLES, CANDIED FRUITS, TAPIOCA PEARLS, CEREAL MARSHMALLOW) Eating Sounds",/watch?v=dWBKnfaOaIw,203608,MINEE EATS,1730000,1年前,608807,33
ASMR CHICKEN SOUP (SAVAGE EATING) BAEKSUK EATING SOUNDS (NO TALKING) MUKBANG,/watch?v=n0bcvYnO34M,406127,MINEE EATS,1730000,1年前,608807,67
ASMR ALOE VERA RAW YAM (EXTREMELY CRUNCHY&SLIMY) EATING SOUNDS MUKBANG,/watch?v=9f8k2Hxd8GQ,157194,MINEE EATS,1730000,1年前,608807,26
ASMR BLACK BEAN NOODLES+RICE CAKES Jjapagetti Tteokbokki (No Talking) Eating Sounds MUKBANG,/watch?v=N7LjkTY2KTY,295656,MINEE EATS,1730000,1年前,608807,49
ASMR SPICY PORK BELLY SSAM Gochujang Samgyeopsal Eating Sounds MUKBANG,/watch?v=GSf-6CuRe8M,127789,MINEE EATS,1730000,1年前,608807,21
ASMR Nik-L-Nip WAX BOTTLES COCONUT SLICES OLD SCHOOL GUMMY CANDY (No Talking) Eating Sounds MUKBANG,/watch?v=b4mJ092dudM,936808,MINEE EATS,1730000,1年前,608807,154
ASMR KFC CHEETOS SANDWICH FRIES No Talking Eating Sounds MUKBANG,/watch?v=ebDtZU_BdAk,220200,MINEE EATS,1730000,1年前,608807,36
ASMR TACO BELL CRUNCHY TACOS NACHO FRIES No Talking EATING SOUNDS MUKBANG,/watch?v=_qqoR00mHH4,230558,MINEE EATS,1730000,1年前,608807,38
ASMR CARBO FIRE NOODLES  CHEESE STICKS 까르보불닭볶음면+치즈스틱 먹방 Eating Sounds,/watch?v=6mMVR-uyhBU,891329,MINEE EATS,1730000,1年前,608807,146
ASMR MALATANG Spicy Chinese Hot Pot 마라탕 먹방 Eating Sounds Mukbang,/watch?v=eTZ77q1SzkQ,289736,MINEE EATS,1730000,1年前,608807,48
ASMR JJAPAGURI BEEF SIRLOIN STEAK 채끝살 짜파구리 먹방 Eating Sounds Mukbang,/watch?v=unz0heg9P8E,416795,MINEE EATS,1730000,1年前,608807,68
ASMR POPPING BOBA 팝핑보바 리얼사운드 먹방 Eating Sounds Mukbang,/watch?v=Zb-HJZYgG-U,233077,MINEE EATS,1730000,1年前,608807,38
ASMR FRIED CHICKEN SKIN SPICY TTEOKBOKKI RICE CAKE 닭껍질튀김+떡볶이 먹방 Eating Sounds Mukbang,/watch?v=2ksKZ4i5HHE,717508,MINEE EATS,1730000,1年前,608807,118
ASMR 🍣SUSHI🍣 초밥 리얼사운드 먹방 Eating Sounds Mukbang | MINEE EATS,/watch?v=qHVEtP900Bs,271852,MINEE EATS,1730000,作成者:1年前,608807,45
ASMR MALA FIRE CHICKEN+NOODLES 마라불닭치킨+볶음면 먹방 Eating Sounds Mukbang,/watch?v=ziTYZOoUuIg,310098,MINEE EATS,1730000,1年前,608807,51
ASMR POPPING BOBA WATERMELON PUNCH 팝핑보바 수박화채 먹방🍉Eating Sounds Mukbang,/watch?v=PSk2CvEXDjg,838507,MINEE EATS,1730000,1年前,608807,138
ASMR WIDE GLASS NOODLE TTEOKBOKKI 중국당면 떡볶이 먹방 Eating Sounds Mukbang,/watch?v=oc5MhHohFGE,747409,MINEE EATS,1730000,1年前,608807,123
ASMR FRIED CHICKEN WINGS 치킨윙 리얼사운드 먹방 Eating Sounds Mukbang,/watch?v=au49cNIgmgM,194869,MINEE EATS,1730000,1年前,608807,32
ASMR INDIAN MAGGI NOODLES 인도라면 매기누들 리얼사운드 먹방 Eating Sounds Mukbang,/watch?v=9uGQ3zz0Bp8,858415,MINEE EATS,1730000,1年前,608807,141
ASMR MOON CAKE 월병 🥮 리얼사운드 먹방 Eating Sounds Mukbang,/watch?v=4-LLg5Vl8Ho,175811,MINEE EATS,1730000,1年前,608807,29
ASMR Cheesy Sesame Ramen Noodles 치즈참깨라면 리얼사운드 먹방 Eating Sounds Mukbang,/watch?v=tf7iVpC0nrU,1308254,MINEE EATS,1730000,1年前,608807,215
ASMR KIMCHI BIBIMBAP (BIG BITES) 김치비빔밥 리얼사운드 먹방 Eating Sounds Mukbang,/watch?v=wrSVT2IwqAQ,225551,MINEE EATS,1730000,1年前,608807,37
ASMR PORK BELLY CHUNK & KIMCHI 통삼겹살+김치 리얼사운드 먹방 Eating Sounds Mukbang,/watch?v=tmFeYiNlIjo,1494943,MINEE EATS,1730000,1年前,608807,246
ASMR Chicken BAKSO Meatball FIRE GLASS NOODLE SOUP 치킨미트볼 납작당면 불닭볶음탕면 먹방 Eating Sounds Mukbang,/watch?v=w27OYNInq0M,260113,MINEE EATS,1730000,1年前,608807,43
ASMR JELLO ROLL-UPS 젤로롤 먹방 Eating Sounds Mukbang,/watch?v=cLWD3uxpOxM,394001,MINEE EATS,1730000,1年前,608807,65
ASMR Rib Eye STEAK Cheesy Spicy Udon NOODLES 꽃등심 스테이크 치즈불닭볶음우동 먹방,/watch?v=_T8JK3x4Rko,275509,MINEE EATS,1730000,1年前,608807,45
ASMR BLACK BEAN NOODLES FRIED DUMPLINGS 짜장라면 군만두 먹방 Eating Sounds Mukbang,/watch?v=pVPcVH2m4YY,1136316,MINEE EATS,1730000,1年前,608807,187
ASMR SPICY RAW CRABS RICE BALLS 양념게장 주먹밥 먹방 Eating Sounds Mukbnag,/watch?v=M7SQya1khAA,237006,MINEE EATS,1730000,1年前,608807,39
ASMR SPICY Paccheri PASTA CHEESE STICKS 매운튜브파스타+치즈스틱 먹방 Eating Sounds Mukbang,/watch?v=vrJeYH2VIFk,290148,MINEE EATS,1730000,1年前,608807,48
ASMR GALAXY CANDY KYOHO JELLY EARTH GUMMY UFO CANDY 갤럭시캔디 쿄호젤리 지구젤리 UFO캔디 먹방,/watch?v=lNMDAIVMdxs,1892710,MINEE EATS,1730000,1年前,608807,311
"CASINO ASMR Edible Money, Cards, Poker Chips, Dice 먹는 돈,카드,포커칩,주사위 카지노 먹방 Eating Sounds Mukbang",/watch?v=2iomUf6h9UY,1223830,MINEE EATS,1730000,1年前,608807,201
ASMR Giant Rice Cake Glass Noodles Tteokbokki 납작당면 가래떡 떡볶이 먹방 Eating Sounds Mukbang,/watch?v=OPCurST-VT8,471322,MINEE EATS,1730000,1年前,608807,77
ASMR PANCIT CANTON NOODLES+SHRIMPS 필리핀라면 판싯칸톤+새우 먹방 Eating Sounds Mukbang,/watch?v=VQjbOJ1XP1A,161237,MINEE EATS,1730000,1年前,608807,26
ASMR Cheesy Scallion Pancake Crunchy Kimchi 치즈파전 총각김치 먹방 Eating Sounds Mukbang,/watch?v=Mylo5pWVUmg,111903,MINEE EATS,1730000,1年前,608807,18
ASMR GIANT TAPIOCA PEARLS BOBA 대왕 타피오카펄 먹방 Eating Sounds Mukbang,/watch?v=MMrn5EU9whs,1049572,MINEE EATS,1730000,1年前,608807,172
ASMR Spicy Cold NOODLES Watermelon 괄도네넴띤 수박 먹방 Eating Sounds Mukbang,/watch?v=bKvT-oJMbdE,232329,MINEE EATS,1730000,1年前,608807,38
ASMR WHOLE ALOE VERA CHALLENGE 통알로에 챌린지 먹방 Eating Sounds Mukbang,/watch?v=u-lTVvIItFs,1064999,MINEE EATS,1730000,1年前,608807,175
ASMR Korean Fried Chicken Cheese Balls PopRocks 양념치킨 치즈볼 팝락캔디 먹방 Eating Sounds Mukbang,/watch?v=4NxB0iXYc3A,227430,MINEE EATS,1730000,1年前,608807,37
"ASMR Edible Shoe, Necklace, Bracelet(Nerd Rope) 먹는 구두,목걸이,팔찌(너드로프) 먹방 Eating Sounds Mukbang",/watch?v=4qUF46v-dmM,566285,MINEE EATS,1730000,1年前,608807,93
ASMR PASSION FRUITS 패션후르츠 먹방 Eating Sounds Mukbang | MINEE EATS,/watch?v=hnx881B0Edw,242130,MINEE EATS,1730000,作成者:1年前,608807,40
ASMR FIRE SAUCE Mozzarella ONION RINGS 불닭소스 모짜렐라 양파튀김 먹방 Eating Sounds Mukbang,/watch?v=j8y2ERURQZQ,206896,MINEE EATS,1730000,1年前,608807,34
ASMR FRIED MILK Leche frita 우유튀김 먹방 Spanish Dessert Eating Sounds Mukbang,/watch?v=VDTOXGmkwqo,297251,MINEE EATS,1730000,1年前,608807,49
ASMR Mini Nuclear Fire+Ghost Pepper Noodles 미니핵불닭볶음면 고스트페퍼라면 먹방 Eating Sounds Challenge Mukbang,/watch?v=atU04kcmPfE,1664777,MINEE EATS,1730000,1年前,608807,273
ASMR Korean Retro Candy Bubble Tea 달고나 쫀드기 버블티 먹방 Eating Sounds Mukbang,/watch?v=gYtrWdg4t74,293042,MINEE EATS,1730000,1年前,608807,48
ASMR Edible School Supplies 먹는학용품 먹방 Eating Sounds Mukbang | MINEE EATS,/watch?v=xjlW4QUdnn0,1469737,MINEE EATS,1730000,作成者:1年前,608807,241
ASMR Creamy Cheesy PASTA ALFREDO Fire Sauce Sausage 알프레도 크림파스타 불닭소스 소시지 먹방 Eating Sounds Mukbang,/watch?v=j-HL_4AYCDs,464871,MINEE EATS,1730000,1年前,608807,76
ASMR ALOE VERA *POPSICLE *JELLY 알로에 얼린알로에 알로에젤리 먹방 Eating Sounds Mukbang,/watch?v=flIWl6hwBYE,1761350,MINEE EATS,1730000,1年前,608807,289
ASMR Black Bean Fire Noodles BBQ RIBS 불닭게티 등갈비 바베큐폭립 먹방 Eating Sounds Mukbang,/watch?v=sQq9EtNFCNo,309928,MINEE EATS,1730000,1年前,608807,51
ASMR 🍈MELON PUNCH🍈 메론화채 먹방 Eating Sounds Mukbang  | MINEE EATS,/watch?v=IE3L8mQPIf4,260710,MINEE EATS,1730000,作成者:1年前,608807,43
ASMR ICE CREAM EDIBLE SPOON Galaxy Candy 아이스크림 먹는숟가락 갤럭시캔디 먹방 Eating Sounds Mukbang | MINEE EATS,/watch?v=9GRVfkhoBOY,182208,MINEE EATS,1730000,作成者:1年前,608807,30
ASMR Edible Hair Brush Daebak Ghost Pepper Noodles 먹는빗 대박 고스트페퍼 라면 챌린지 먹방 Challenge Mukbang,/watch?v=xZiCSEOpXSY,469426,MINEE EATS,1730000,1年前,608807,77
ASMR FROZEN GUMMY CANDY KYOHO JELLY POPSICLES 얼린젤리 얼린쿄호젤리 젤리아이스바 먹방 | MINEE EATS,/watch?v=aJHV5p0MzBQ,959700,MINEE EATS,1730000,作成者:1年前,608807,158
ASMR Samyang Carbo Tteokbokki+Mozzarella Corn Dog 까르보불닭떡볶이+모짜렐라핫도그 먹방 Eating Sounds Mukbang,/watch?v=Er-x3fWBwW0,387306,MINEE EATS,1730000,1年前,608807,64
ASMR Sturgeon CAVIAR Edible Spoons 캐비어 먹는숟가락 먹방 Eating Sounds Mukbang | MINEE EATS,/watch?v=gwLbDnIAv8c,577607,MINEE EATS,1730000,作成者:1年前,608807,95
ASMR SUSHI SASHIMI Big Bites 초밥 회 먹방 Eating Sounds Mukbang | MINEE EATS,/watch?v=9NwTKCWBsIQ,536245,MINEE EATS,1730000,作成者:1年前,608807,88
ASMR GRAPE SHAVED ICE DESSERT BINGSU 청포도빙수 먹방 Eating Sounds Mukbang | MINEE EATS,/watch?v=stVB6oacuvw,227541,MINEE EATS,1730000,作成者:1年前,608807,37
ASMR Samyang Spicy Rice Cake Tteokbokki Onion RIngs 불닭떡볶이 양파튀김 어니언링 먹방 Eating Sounds Mukbang,/watch?v=KR4boKT1tUA,247775,MINEE EATS,1730000,1年前,608807,41
"ASMR Spicy Fried Chicken, Mac&Cheese, Carbo Fire Noodles 불닭소스치킨, 맥앤치즈, 까르보불닭볶음면 먹방 | MINEE EATS",/watch?v=Y1ryHeG6H6k,316467,MINEE EATS,1730000,作成者:1年前,608807,52
"ASMR Most Popular Food on My Channel 미니잇츠 채널 인기메뉴 (알로에,벌집꿀,탕후루,딸기찹쌀떡,쿄호젤리,까르보불닭,떡볶이) 먹방 | MINEE EATS",/watch?v=H72M48D_mtY,1638194,MINEE EATS,1730000,作成者:1年前,608807,269
ASMR Chocolate Edible Spoons 먹는 숟가락 초콜릿 먹방 Eating Sounds Mukbang | MINEE EATS,/watch?v=IiWcBWbstZs,226046,MINEE EATS,1730000,作成者:1年前,608807,37
ASMR Black Bean Noodles Jjajangmyeon 짜장면+군만두 Fried Dumplings 먹방 | MINEE EATS,/watch?v=3ThkxuGuxvs,257689,MINEE EATS,1730000,作成者:1年前,608807,42
ASMR Cockle Bibimbap+Soybean Paste Stew 꼬막비빔밥+된장찌개 먹방,/watch?v=qFO89NU7OuU,179463,MINEE EATS,1730000,1年前,608807,29
ASMR Spicy Konjac Jelly Tteokbokki 곤약떡볶이 먹방 | MINEE EATS,/watch?v=AnOLZmu9MWw,279013,MINEE EATS,1730000,作成者:1年前,608807,46
ASMR LOTTERY CANDY 복권사탕 먹방 | MINEE EATS,/watch?v=caReHaBqiiM,281793,MINEE EATS,1730000,作成者:1年前,608807,46
ASMR Bacon&Kimchi Wrapped Bibimmyun  베이컨&김치말이 비빔면 먹방 Spicy Cold Ramen Noodles | MINEE EATS,/watch?v=i2Oxqpj0zrA,358035,MINEE EATS,1730000,作成者:1年前,608807,59
ASMR Honeycomb+Edible Spoon 벌집꿀+먹는숟가락 먹방 | MINEE EATS,/watch?v=WHvDm63GcXQ,1203153,MINEE EATS,1730000,作成者:1年前,608807,198
ASMR Spicy Squid Noodle Soup JJAMPONG 오징어짬뽕 먹방 | MINEE EATS,/watch?v=Qjs9HKIvnlU,173009,MINEE EATS,1730000,作成者:1年前,608807,28
ASMR CHEESY KING CRAB CARBO FIRE NOODLES 킹크랩 까르보 불닭볶음면 먹방 | MINEE EATS,/watch?v=t0BC8piZxYA,378686,MINEE EATS,1730000,作成者:1年前,608807,62
ASMR Candied Watermelon&Pineapple TANGHULU 수박&파인애플 탕후루 먹방🍉🍍 | MINEE EATS,/watch?v=6EmnBMJ2UgA,293827,MINEE EATS,1730000,作成者:1年前,608807,48
ASMR COLD NOODLES NAENGMYEON 물냉+비냉 냉면 먹방 *BIG BITES* | MINEE EATS,/watch?v=b1oqOc78qBA,289369,MINEE EATS,1730000,作成者:1年前,608807,48
ASMR JELLO WATERMELON 젤로수박 수박젤리🍉 먹방 | MINEE EATS,/watch?v=0-ZRe-st-54,595028,MINEE EATS,1730000,作成者:1年前,608807,98
"ASMR McDonald's BIG MAC, Chicken Nuggets 맥도날드 빅맥, 치킨너겟 먹방 | MINEE EATS",/watch?v=bIP4ZUxyWUA,213206,MINEE EATS,1730000,作成者:1年前,608807,35
ASMR FROZEN BUBBLE TEA 버블티빙수 Tapioca Pearl (Boba) Bingsu 먹방 | MINEE EATS,/watch?v=KVRo8jf1BOI,470306,MINEE EATS,1730000,作成者:1年前,608807,77
ASMR MINI NUCLEAR FIRE NOODLE CHALLENGE 미니 핵불닭볶음면 챌린지 먹방🔥 | MINEE EATS,/watch?v=HNsQek2U32A,767417,MINEE EATS,1730000,作成者:1年前,608807,126
ASMR SWEDISH CANDY 스웨디시 젤리 먹방 Part.2 | MINEE EATS,/watch?v=3Eh8fHsEI90,1197631,MINEE EATS,1730000,作成者:1年前,608807,197
"ASMR SUSHI & SALMON SASHIMI *BIG BITES* 초밥, 연어회 먹방 | MINEE EATS",/watch?v=Jm1HPDYSzXg,380810,MINEE EATS,1730000,作成者:1年前,608807,63
ASMR CHEESY RAMEN NOODLE SOUP 치즈라면 먹방 | MINEE EATS,/watch?v=nRsypq9o-CI,662759,MINEE EATS,1730000,作成者:1年前,608807,109
"ASMR JELLY ICE POPS 젤리 아이스팝 (보석곤약, 코코넛젤리 나타드코코) 먹방 | MINEE EATS",/watch?v=eWlqwNs6jVw,225850,MINEE EATS,1730000,作成者:1年前,608807,37
ASMR SHRIMPS & SEA GRAPES 칵테일새우+바다포도 먹방 | MINEE EATS,/watch?v=hc36ryI9_es,166376,MINEE EATS,1730000,作成者:1年前,608807,27
ASMR Edible Straw Pasta 먹을수있는 빨대 파스타 | MINEE EATS,/watch?v=yXhhTKcUuFM,333896,MINEE EATS,1730000,作成者:1年前,608807,55
ASMR Animal Style Fries 애니멀스타일 감자튀김 먹방 | MINEE EATS,/watch?v=6vMH0GdXBt4,1218383,MINEE EATS,1730000,作成者:1年前,608807,200
ASMR Jelly Noodles 젤리국수 우무묵 tokoroten 먹방 | MINEE EATS,/watch?v=l7nLsT2tX70,420680,MINEE EATS,1730000,作成者:1年前,608807,69
ASMR OCTOPUS CRACKER TAKO SENBEI 문어과자 타코센베이 먹방 | MINEE EATS,/watch?v=Iv8ziQXdN3s,172149,MINEE EATS,1730000,作成者:1年前,608807,28
ASMR RAW OYSTERS 생굴 먹방 | MINEE EATS,/watch?v=AXxgNOXmlRU,245303,MINEE EATS,1730000,作成者:1年前,608807,40
ASMR DIM SUM 딤섬 먹방 | MINEE EATS,/watch?v=o23ydhHNm3I,188946,MINEE EATS,1730000,作成者:1年前,608807,31
ASMR JEWEL KONJAC 보석곤약 먹방 | MINEE EATS,/watch?v=w_mw0JzT3v8,320940,MINEE EATS,1730000,作成者:1年前,608807,53
"ASMR Fruit&CherryBlossom JELLY 과일젤리, 벚꽃젤리🌸 먹방 | MINEE EATS",/watch?v=77PmOcAjFfc,314748,MINEE EATS,1730000,作成者:1年前,608807,52
ASMR Deep Fried Squid *CRUNCHY* 오징어튀김 먹방🦑 | MINEE EATS,/watch?v=C_ds7hRjNUs,248218,MINEE EATS,1730000,作成者:1年前,608807,41
ASMR Black Bean Noodles JJAJANGMYEON 짜장면 먹방 | MINEE EATS,/watch?v=OYx5WcxlVB8,300557,MINEE EATS,1730000,作成者:1年前,608807,49
ASMR JAPANESE CANDY 일본사탕 먹방 | MINEE EATS,/watch?v=YsJZ0nYli50,880603,MINEE EATS,1730000,作成者:1年前,608807,145
ASMR CHEESE PIZZA🍕 치즈피자 먹방 | MINEE EATS,/watch?v=kr-tStwyaEY,560035,MINEE EATS,1730000,作成者:1年前,608807,92
"ASMR OCTOPUS & BABY OCTOPUS🐙 문어,쭈꾸미 먹방 | MINEE EATS",/watch?v=8pFpZrh4wU8,301393,MINEE EATS,1730000,作成者:1年前,608807,50
ASMR UFO CANDY Part.2 우주캔디 2탄 | MINEE EATS,/watch?v=hoDSqKgTzpA,291751,MINEE EATS,1730000,作成者:1年前,608807,48
ASMR CHEESY CARBO FIRE NOODLE TTEOKBOKKI 치즈까르보불닭 떡볶이 먹방,/watch?v=VXBXT99XVv8,1398621,MINEE EATS,1730000,1年前,608807,230
ASMR SEAWEED KONJAC NOODLES 해초곤약국수 먹방 | MINEE EATS,/watch?v=pnntIWI1fDw,251505,MINEE EATS,1730000,作成者:1年前,608807,41
ASMR GALAXY CANDY 갤럭시캔디 먹방 | MINEE EATS,/watch?v=DVnDnzjeFvo,800989,MINEE EATS,1730000,作成者:1年前,608807,132
"ASMR KOREAN FOOD 김밥, 치킨, 떡볶이 먹방 (gimbap, fried chicken, tteokbokki) *whisper*",/watch?v=rTXdiNpnqto,214248,MINEE EATS,1730000,1年前,608807,35
ASMR Cheese Baguette🧀  치즈바게트 먹방 | MINEE EATS,/watch?v=NlV8g2hoqLE,238156,MINEE EATS,1730000,作成者:1年前,608807,39
"ASMR FRIED Shrimp🍤& Onion Rings 새우튀김,양파튀김 먹방 CRUNCHY FOOD | MINEE EATS",/watch?v=8G-YpnMSyMg,316628,MINEE EATS,1730000,作成者:1年前,608807,52
ASMR Maggi Pedas Giler tom yummz SPICY NOODLES 말레이시아 매운라면 매기 페다스 길러 똠얌꿍맛 먹방,/watch?v=OuumnamiNec,440785,MINEE EATS,1730000,1年前,608807,72
"ASMR CANDIED Mochi Ice Cream 아이스크림찹쌀떡 탕후루 (Planet Gummy, Strawberry Marshmallow 지구젤리, 딸기마시멜로우) 먹방",/watch?v=a5dgJA4SoNo,3468504,MINEE EATS,1730000,1年前,608807,570
ASMR Buttered Abalone 전복버터구이 먹방 | MINEE EATS,/watch?v=j590BJxuvJQ,211734,MINEE EATS,1730000,作成者:1年前,608807,35
ASMR Muscat Grape Gummy Jelly 샤인머스켓 포도젤리 먹방 | MINEE EATS,/watch?v=xIQ-7t0ngQc,800122,MINEE EATS,1730000,作成者:1年前,608807,131
ASMR Wide Udon Noodle Tteokbokki 넓적우동떡볶이 먹방 | MINEE EATS,/watch?v=80-BCUaHLX0,711687,MINEE EATS,1730000,作成者:1年前,608807,117
ASMR SALMON ROE over Rice 연어알덮밥 먹방 | MINEE EATS,/watch?v=aOeOWzFZr8Y,213981,MINEE EATS,1730000,作成者:1年前,608807,35
ASMR CHICKEN FEET (DAKBAL) 닭발 먹방 | MINEE EATS,/watch?v=ArO9oCx0pnM,627393,MINEE EATS,1730000,作成者:1年前,608807,103
ASMR PLANET GUMMY CANDY 지구젤리 먹방🌎 | MINEE EATS,/watch?v=dsjsbfmMdvc,1120816,MINEE EATS,1730000,作成者:1年前,608807,184
ASMR KONJAC JELLY 곤약젤리 먹방🍋| MINEE EATS,/watch?v=xoJm7XzRHxc,597930,MINEE EATS,1730000,作成者:1年前,608807,98
"ASMR Fluke&Cuttlefish SASHIMI 광어회, 갑오징어회 먹방🐟🦑",/watch?v=p_cdU-jAmks,508455,MINEE EATS,1730000,1年前,608807,84
ASMR Pig's Trotters JOKBAL🍖 족발 먹방🍖 | MINEE EATS,/watch?v=-u0X9mvWGMk,319604,MINEE EATS,1730000,作成者:1年前,608807,52
ASMR Deep Fried MACARONS 마카롱튀김 먹방 | MINEE EATS,/watch?v=CWOLfAaGMgA,184705,MINEE EATS,1730000,作成者:1年前,608807,30
ASMR GIANT GUMMY WORM CANDY 대왕 지렁이젤리 먹방,/watch?v=Vd640Y5NH3I,428928,MINEE EATS,1730000,1年前,608807,70
ASMR SALMON SASHIMI 연어회 먹방,/watch?v=66eIpoLPRWE,390507,MINEE EATS,1730000,1年前,608807,64
ASMR KOHAKUTOU AGAR JELLY 코하쿠토 한천젤리 먹방💎,/watch?v=p3sqAIfZDHo,546234,MINEE EATS,1730000,1年前,608807,90
ASMR KYOHO🍇 JELLY 쿄호🍇젤리 먹방 | MINEE EATS,/watch?v=UiqhcbbvAs8,16144043,MINEE EATS,1730000,作成者:1年前,608807,2652
ASMR Soy Sauce Raw Egg Wide Udon Noodles 간장계란넓적우동 먹방,/watch?v=HOuanE1VNQY,532906,MINEE EATS,1730000,1年前,608807,88
ASMR Yeolmu Guksu (Cold Kimchi Noodle Soup) 열무국수 먹방 *Big Bites*,/watch?v=BH3qTJokwto,497244,MINEE EATS,1730000,1年前,608807,82
ASMR Soft Tofu Stew (SOONDUBU JJIGAE) 순두부찌개 먹방,/watch?v=284c6Nrc_yk,676331,MINEE EATS,1730000,1年前,608807,111
ASMR NOODLE CAKE *Thank You 1M* 라면케이크 먹방 *백만감사합니다* | MINEE EATS,/watch?v=8PWJhYOeso0,2573406,MINEE EATS,1730000,作成者:1年前,608807,423
ASMR NOODLE TTEOKBOKKI +Glass Noodles 누들떡볶이 먹방 (중국당면 추가),/watch?v=nb1OG36zfK4,673644,MINEE EATS,1730000,1年前,608807,111
ASMR KING CRAB 킹크랩 먹방,/watch?v=FfzZ3aRpevM,584649,MINEE EATS,1730000,1年前,608807,96
ASMR Strawberries&Whipped Cream 딸기+생크림 먹방🍓☁️,/watch?v=LyfJkCebzTY,501490,MINEE EATS,1730000,1年前,608807,82
ASMR Boiled EGGS 삶은계란 먹방🥚,/watch?v=qvnWG4WTHfM,480303,MINEE EATS,1730000,1年前,608807,79
ASMR Enoki Mushrooms 팽이버섯 먹방 *SATiSFYING CRUNCH*,/watch?v=P0xIomVpXZ4,308838,MINEE EATS,1730000,1年前,608807,51
ASMR SPICY WIDE GLASS NOODLES 비빔중국당면 먹방,/watch?v=6SZa6SuNujs,655702,MINEE EATS,1730000,1年前,608807,108
ASMR YEOLMU KIMCHI BIBIMBAP *BIG BITES* 열무비빔밥+된장찌개 먹방 (with Doenjang Jjigae),/watch?v=b9h_wh7H_WY,1612923,MINEE EATS,1730000,1年前,608807,265
ASMR Satellite Wafers aka UFO Candy 우주캔디 먹방,/watch?v=Fr6-2-hM4jg,1773780,MINEE EATS,1730000,1年前,608807,291
ASMR Handmade Marshmallows 수제마시멜로우 먹방 *Satisfying Sounds*,/watch?v=dSbnaOJ5w9U,1241207,MINEE EATS,1730000,1年前,608807,204
ASMR Strawberry Jelly 생딸기젤리 먹방🍓💦,/watch?v=vUaEfnkOMi8,1682084,MINEE EATS,1730000,1年前,608807,276
ASMR GIMMARI FRIED SEAWEED ROLL 김말이 치즈떡볶이 소스에 찍어서 먹방 (CHEESY Tteokbokki Sauce),/watch?v=_fVUMqemUGw,1922172,MINEE EATS,1730000,1年前,608807,316
ASMR CREAMY CHEESY Kimchi Pasta 🧀김치크림파스타 먹방🧀,/watch?v=v91q5SJnNWE,505725,MINEE EATS,1730000,1年前,608807,83
ASMR SPICY Dumplings with Fire Sauce 매운 불닭소스 만두 먹방🥟,/watch?v=D5AjIoz12HY,1931235,MINEE EATS,1730000,1年前,608807,317
"ASMR 🍣SUSHI🍣 Sea Urchin, Fatty Tuna, Salmon Roll 성게,참치뱃살,연어롤 초밥 먹방",/watch?v=m1QaLnt7eVQ,358530,MINEE EATS,1730000,1年前,608807,59
ASMR Instant Black Bean Noodles 짜파게티 먹방 | MINEE EATS,/watch?v=EfgyyNUPGso,867860,MINEE EATS,1730000,作成者:1年前,608807,143
"Most Popular ASMR Foods *CANDIED* 알로에,벌집꿀,딸기,타피오카펄 탕후루 먹방 | MINEE EATS",/watch?v=ipQq-YWvFWk,4784537,MINEE EATS,1730000,作成者:1年前,608807,786
ASMR GREEN TEA DESSERTS 녹차 디저트 여러가지 먹방🍵,/watch?v=d15jFvpc7AI,313412,MINEE EATS,1730000,1年前,608807,51
ASMR FISH CAKE+RICE CAKE 어묵+떡 (물떡) 먹방 *CHEWY* Eating Sounds,/watch?v=tvnaEFGMzAE,269850,MINEE EATS,1730000,1年前,608807,44
ASMR Carbo Fire GLASS NOODLES 까르보불닭 중국당면 먹방 Feat. Fried Chicken 치킨,/watch?v=DDFe-a2yJsw,1266257,MINEE EATS,1730000,1年前,608807,208
ASMR GIANT Mozzarella Corn Dog 대왕 모짜렐라핫도그 먹방 (Part 3) | MINEE EATS,/watch?v=lgzU11YnOPs,2186400,MINEE EATS,1730000,作成者:1年前,608807,359
ASMR S'MORES *Crunchy Marshmallows* 스모어 먹방🍫🍪,/watch?v=QvMW408DevE,433984,MINEE EATS,1730000,1年前,608807,71
ASMR CHEESE DONKKASEU 치즈돈까스 먹방 *Crunchy* Eating Sounds,/watch?v=gT3W_eSc8xw,242849,MINEE EATS,1730000,1年前,608807,40
ASMR NUCLEAR FIRE NOODLES+RICE CAKES (RABOKKI) 핵불닭 라볶이 먹방🔥,/watch?v=wpNWvU7ceQc,1124060,MINEE EATS,1730000,1年前,608807,185
ASMR Sour GUMMY 🍭 CANDY 🍭 Worms 지렁이젤리 먹방,/watch?v=GL-b0FUTTwk,313364,MINEE EATS,1730000,1年前,608807,51
"ASMR GIMBAP🍙& NOODLES🍜 삼각김밥,컵라면,바나나우유 먹방 (Feat. Banana Milk🍌)",/watch?v=y5aSC-nBcr8,300516,MINEE EATS,1730000,1年前,608807,49
ASMR Strawberry BINGSU 딸기빙수 먹방 SHAVED ICE Dessert🍓❄️,/watch?v=avS8YKSBh7M,1019993,MINEE EATS,1730000,1年前,608807,168
ASMR Black Bean Glass Noodles 중국당면 짜장면 먹방 (Jjajangmyeon🍜),/watch?v=tyhPB7Xv4vM,1151281,MINEE EATS,1730000,1年前,608807,189
