title,url,view,channel_name,channel_subscriber,create_stamp,mean_view,mean_comparison
ASMR HONEYCOMB WAFFLE 벌집꿀 와플🍯,/watch?v=Afbym9Xc2BA,342799,MINEE EATS,1730000,1年前,608807,56
ASMR ROCK CANDY 락캔디 먹방 *SATISFYING CRUNCH*,/watch?v=i3Pe6-AAEVU,582367,MINEE EATS,1730000,1年前,608807,96
ASMR SEA GRAPES 바다포도 먹방🍇(Part.2),/watch?v=zOreQ3hsgSY,1988665,MINEE EATS,1730000,1年前,608807,327
ASMR Strawberry Chocolate Chapssaltteok (Mochi) 딸기초코찹쌀떡 먹방🍓🍫,/watch?v=3aDRyAmV3dw,1491543,MINEE EATS,1730000,1年前,608807,245
ASMR 🍣SUSHI🍣 *Big Bites* 초밥 먹방🥢,/watch?v=bCa1zdRo0x0,1065158,MINEE EATS,1730000,1年前,608807,175
ASMR Inkigayo Sandwich🥪인기가요 샌드위치 먹방🥪,/watch?v=QEbC3ocikpU,347958,MINEE EATS,1730000,1年前,608807,57
ASMR SEA SNAILS 골뱅이 먹방 *CHEWY* Eating Sounds,/watch?v=H2VaRRwvuVs,251743,MINEE EATS,1730000,1年前,608807,41
ASMR New Fire Chewy Noodles (Jjolbokki) 불닭볶음면 쫄볶이 먹방,/watch?v=TLa4sZ9cBow,513236,MINEE EATS,1730000,1年前,608807,84
"ASMR Candied Fruits🍊🍓귤,딸기 탕후루 먹방",/watch?v=DhDrw14bq0A,2502548,MINEE EATS,1730000,1年前,608807,411
ASMR Extra-Wide NOODLE TTEOKBOKKI 중국당면 떡볶이 먹방,/watch?v=NU5Eb8X785w,2759681,MINEE EATS,1730000,1年前,608807,453
ASMR FRIED CHICKEN with SPICY FIRE SAUCE 불닭치킨 먹방 *MESSY* Eating,/watch?v=XXizUhSWyeo,1165948,MINEE EATS,1730000,1年前,608807,192
ASMR Chocolate Rocks 조약돌초콜릿 먹방 Crunchy🍫 Eating Sounds,/watch?v=CpLCZ2NW_iI,317871,MINEE EATS,1730000,1年前,608807,52
ASMR Homemade BURGER 수제버거 먹방🍔*Messy Big Bites*,/watch?v=5lh5YnxCOqg,286810,MINEE EATS,1730000,1年前,608807,47
ASMR Retro CANDY (Part.2) 미국불량식품 (2탄) 먹방🍬,/watch?v=xaIxzMKcwYk,3303005,MINEE EATS,1730000,1年前,608807,543
"ASMR Air-Fried Rice Cake (Tteok&Kirimochi) 에어프라이떡 (떡국떡, 키리모찌) 먹방",/watch?v=zhORO-MfViQ,579457,MINEE EATS,1730000,1年前,608807,95
ASMR Pikachu Tonkatsu 피카츄 돈까스 먹방 *Crunchy* Sounds,/watch?v=XJIVQ3Y9bdY,327236,MINEE EATS,1730000,1年前,608807,54
ASMR COTTON CANDY 솜사탕 먹방☁️*Fluffy *Soft Sounds,/watch?v=c_vlXSd6vN0,558003,MINEE EATS,1730000,1年前,608807,92
ASMR Cold Ramen Noodles (Bibimmyeon) + Pork Belly 비빔면+삼겹살 먹방,/watch?v=WSExh2BQRlc,788995,MINEE EATS,1730000,1年前,608807,130
ASMR UMAIBO Japanese Snack 우마이봉 일본과자 먹방 *CRUNCHY* Corn Puffs,/watch?v=1FBESXkhnwY,214268,MINEE EATS,1730000,1年前,608807,35
ASMR Xylitol Crystals 자일리톨 원석 먹방 (Extremely CRUNCHY),/watch?v=6IwfwqvU3GY,536215,MINEE EATS,1730000,1年前,608807,88
ASMR Banquet NOODLES *Big Bites* 잔치국수 먹방,/watch?v=ysEEnHeKLLE,334775,MINEE EATS,1730000,1年前,608807,55
ASMR SUGAR+TOMATOES 설탕범벅 토마토 먹방🍅 *JUICY CRUNCHY*,/watch?v=KHI4zd-TkVI,282853,MINEE EATS,1730000,1年前,608807,46
ASMR CARBO Fire NOODLES 까르보 불닭볶음면 먹방 *꾸덕꾸덕*,/watch?v=WZrsASo5yPM,7036532,MINEE EATS,1730000,1年前,608807,1156
ASMR Strawberry Sandwich 딸기샌드위치 먹방🍓*Whipped Cream*,/watch?v=jrzK8clT6_c,368204,MINEE EATS,1730000,1年前,608807,60
ASMR ALOE VERA (Part.4) 알로에 먹방 *Soaked in Sugar Water*,/watch?v=_SIYvbZKsNs,881891,MINEE EATS,1730000,1年前,608807,145
ASMR DANGO🍡당고 먹방🍡*STICKY CHEWY* SOUNDS,/watch?v=78VsAYz8h1k,396308,MINEE EATS,1730000,1年前,608807,65
ASMR 🍫CEREAL(+Marshmallow) 코코볼+마시멜로우 시리얼 먹방🥣,/watch?v=9oLPdC5H-c8,253451,MINEE EATS,1730000,1年前,608807,42
ASMR CUP RAMEN NOODLES 컵라면 먹방,/watch?v=u1ke0N6i_5s,351541,MINEE EATS,1730000,1年前,608807,58
ASMR JELLYFISH Salad 해파리냉채 먹방,/watch?v=q4jiPryXM8U,233558,MINEE EATS,1730000,1年前,608807,38
ASMR FLYING FISH ROE 날치알 먹방,/watch?v=lnrQGnwBbBk,2293550,MINEE EATS,1730000,1年前,608807,377
ASMR GIMBAP 김밥 먹방,/watch?v=HspKH05C1A4,426663,MINEE EATS,1730000,1年前,608807,70
ASMR FREEZE DRIED FRUITS 동결건조과일 먹방🍓,/watch?v=I9ZFspptrKM,422632,MINEE EATS,1730000,1年前,608807,69
ASMR STARFRUITS 스타후르츠 먹방⭐️,/watch?v=cIQXIkSY8k8,1260446,MINEE EATS,1730000,1年前,608807,207
ASMR CONCH 소라 먹방,/watch?v=K-wvK0Vp-IE,375567,MINEE EATS,1730000,1年前,608807,62
ASMR GRASS JELLY 잔디젤리 먹방,/watch?v=UOiSoLBHgrs,1602264,MINEE EATS,1730000,1年前,608807,263
ASMR JIPBAB Rice&Side Dishes 집밥 먹방,/watch?v=qpeCnNG8jPI,488374,MINEE EATS,1730000,1年前,608807,80
ASMR CHOCOLATE DIPPED ICE CREAM 초콜릿아이스크림 먹방,/watch?v=QU30B9tp8iM,497047,MINEE EATS,1730000,1年前,608807,82
ASMR CHOCOLATE TRUFFLES 파베초콜릿 먹방,/watch?v=0ZbmSsrun0Y,1479026,MINEE EATS,1730000,1年前,608807,243
ASMR 🍍TTEOKBOKKI 파인애플떡볶이 먹방 SpicyChewy RiceCake,/watch?v=Clc0LTZFBD8,543366,MINEE EATS,1730000,1年前,608807,89
ASMR SOUPY FIRE NOODLES 불닭볶음탕면 먹방🔥,/watch?v=M7yApUibsnc,3192683,MINEE EATS,1730000,1年前,608807,524
ASMR Chili SHRIMP Eating Sounds 칠리새우 리얼사운드 먹방,/watch?v=DuPzNT0hrM4,411005,MINEE EATS,1730000,1年前,608807,68
ASMR Sweet&Sour Pork TANGSUYUK 탕수육 리얼사운드 먹방 Eating Sounds,/watch?v=xStCPLPb2Ao,235200,MINEE EATS,1730000,1年前,608807,39
ASMR Vietnamese Spring Rolls 월남쌈 리얼사운드 먹방 Eating Sounds,/watch?v=muQ0scsG6aU,613047,MINEE EATS,1730000,1年前,608807,101
ASMR Shrimp Tempura *CRUNCHY* Eating Sounds *바삭* 새우튀김 리얼사운드 먹방,/watch?v=F2xy6OuYh0o,493794,MINEE EATS,1730000,1年前,608807,81
ASMR COCONUT JELLY (Nata De Coco) 코코넛젤리 (나타드코코) *Crunchy&Chewy* Eating Sounds 리얼사운드 먹방,/watch?v=JChywE8cXD0,906808,MINEE EATS,1730000,1年前,608807,149
ASMR MACARONS Eating Sounds 마카롱 리얼사운드 먹방,/watch?v=iwQHMO8QlVM,380974,MINEE EATS,1730000,1年前,608807,63
ASMR Indomie Mi Goreng Noodles *Big Bites* 인도미 미고랭 라면 리얼사운드 먹방 Eating Sounds,/watch?v=Pdf09pVZxtU,771822,MINEE EATS,1730000,1年前,608807,127
"ASMR Marshmallow, Meringues, Ladyfinger 수제마시멜로우, 머랭쿠키, 레이디핑거 리얼사운드 먹방 Eating Sounds",/watch?v=gED1fTvzZCI,822894,MINEE EATS,1730000,1年前,608807,135
ASMR BOBA(Tapioca Pearls) HONEYCOMB *Sticky+Chewy* 보바(타피오카펄) 벌집꿀 리얼사운드 먹방 Eating Sounds,/watch?v=9JofuRYzpkw,1788854,MINEE EATS,1730000,1年前,608807,294
ASMR Vietnamese PHO Eating Sounds 베트남 쌀국수 리얼사운드 먹방,/watch?v=YbqJlq4vHtY,497428,MINEE EATS,1730000,1年前,608807,82
ASMR Aloe Vera Eating Sounds (Part 3) 알로에 리얼사운드 먹방,/watch?v=JoKggIKYTEE,1204327,MINEE EATS,1730000,1年前,608807,198
ASMR BUBBLE TEA (Boba/Grass Jelly/Aloe Vera) 버블티 리얼사운드 먹방 Eating Sounds,/watch?v=yWjvwLAH3FI,2594802,MINEE EATS,1730000,1年前,608807,426
ASMR Stir-fried GOPCHANG (Beef Intestines) 곱창볶음 리얼사운드 먹방 Eating Sounds,/watch?v=1FFZQb83FfY,275509,MINEE EATS,1730000,1年前,608807,45
ASMR Mitarashi DANGO *Chewy* Eating Sounds 당고 리얼사운드 먹방,/watch?v=VHqEkT_PScE,1219438,MINEE EATS,1730000,1年前,608807,200
ASMR MERINGUES Eating Sounds 머랭쿠키 리얼사운드 먹방,/watch?v=Ssp5PLJYa4Y,1331232,MINEE EATS,1730000,1年前,608807,219
ASMR LOBSTER Tail 랍스터 꼬리 리얼사운드 먹방 Eating Sounds *Happy New Year*,/watch?v=h1sdV_6affg,691438,MINEE EATS,1730000,1年前,608807,114
ASMR Samyang Carbo&Cheese Fire Noodles 까르보&치즈 불닭볶음면 리얼사운드 먹방 Eating Sounds (Part2),/watch?v=gMV-dtXRNMY,3830088,MINEE EATS,1730000,1年前,608807,629
ASMR Sweet Shrimp Sushi+Fried Shrimp Head *BigBites* 생새우초밥+새우머리튀김 리얼사운드 먹방 Eating Sounds,/watch?v=Ec83wNDbAAY,385203,MINEE EATS,1730000,1年前,608807,63
ASMR Pororo Cup Tteokbokki (Spicy & Creamy Rice Cake) 뽀로로 컵떡볶이 (매콤떡볶이vs크림떡볶이) 리얼사운드 먹방 Eating Sounds,/watch?v=wF6MvAbNomQ,541761,MINEE EATS,1730000,1年前,608807,89
ASMR Spicy Raw Crabs (Yangnyeom Gejang) Eating Sounds 양념게장 리얼사운드 먹방,/watch?v=YS_x-fe3vAE,1961267,MINEE EATS,1730000,1年前,608807,322
ASMR Kimchi Fried Rice Eating Sounds 김치볶음밥 리얼사운드 먹방,/watch?v=sho2FzYvJQ4,240893,MINEE EATS,1730000,1年前,608807,40
ASMR Octopus Eating Sounds 문어숙회 리얼사운드 먹방,/watch?v=1FbxI33cy9Y,418359,MINEE EATS,1730000,1年前,608807,69
ASMR Chocolate Ciffon Cake 초코쉬폰 케이크 리얼사운드 먹방 Eating Sounds,/watch?v=ujYSvM9cW6U,231056,MINEE EATS,1730000,1年前,608807,38
ASMR Filipino Spaghetti🍝 필리핀 스파게티 리얼사운드 먹방 Eating Sounds,/watch?v=O0w8RUuNDR8,473313,MINEE EATS,1730000,1年前,608807,78
ASMR HONEYCOMB & French Brie CHEESE *STICKY* 벌집꿀&프랑스치즈 리얼사운드 먹방 Eating Sounds,/watch?v=UHGgwIZr8Lo,2600333,MINEE EATS,1730000,1年前,608807,427
ASMR Spicy Seafood Noodle Soup (Jjamppong) *Slurp* 짬뽕 리얼사운드 먹방 Eating Sounds,/watch?v=X90s6F5MBG4,293235,MINEE EATS,1730000,1年前,608807,48
ASMR SUSHI *Big Bites* 초밥 리얼사운드 먹방 Eating Sounds Part2,/watch?v=91Mf1OFvmtI,786306,MINEE EATS,1730000,1年前,608807,129
"ASMR Chocolate Fondue 초콜릿퐁듀 (딸기,체리,마시멜로우,청포도,프레첼) 리얼사운드 먹방 Eating Sounds",/watch?v=PPC7vq2vZfA,339430,MINEE EATS,1730000,1年前,608807,56
ASMR Pavlova (Meringue Cake) 파블로바(머랭케이크) 리얼사운드 먹방 Eating Sounds *Satisfying Soft Crunch*,/watch?v=XqhuOoRrkWY,186851,MINEE EATS,1730000,1年前,608807,31
ASMR Black Bean Noodles (Jjajangmyeon) *Big Bites* 짜장면 리얼사운드 먹방 Eating Sounds,/watch?v=yKjbRfxgEUo,2895453,MINEE EATS,1730000,1年前,608807,476
ASMR Christmas Cookies 크리스마스 쿠키 리얼사운드 먹방 Eating Sounds,/watch?v=LSF-oD7C2mY,159431,MINEE EATS,1730000,1年前,608807,26
ASMR POMEGRANATE 석류 리얼사운드 먹방 Eating Sounds,/watch?v=VQk33SbYQ_s,407375,MINEE EATS,1730000,1年前,608807,67
"ASMR Samyang Fire Noodles *BIG BITES* 불닭볶음면(Mala, Nuclear, Jjajang, Original) 리얼사운드 먹방 Eating Sounds",/watch?v=eSWEi8NNTOQ,2636189,MINEE EATS,1730000,1年前,608807,433
ASMR Churros *Crunchy* 츄러스 리얼사운드 먹방 Eating Sounds,/watch?v=XlZBxEbeUWY,204770,MINEE EATS,1730000,1年前,608807,34
ASMR FISH CAKE KONJAC NOODLE SOUP 곤약국수 어묵탕 리얼사운드 먹방 Eating Sounds,/watch?v=ThYmLSddmB8,274402,MINEE EATS,1730000,1年前,608807,45
ASMR Enoki Mushroom *Crunchy* 팽이버섯 리얼사운드 먹방 Eating Sounds,/watch?v=xzAx2Hvm8bU,215557,MINEE EATS,1730000,1年前,608807,35
ASMR Hotteok (Korean Sweet Pancake) 호떡 리얼사운드 먹방 Eating Sounds,/watch?v=4x6eA2cqT0I,170999,MINEE EATS,1730000,1年前,608807,28
ASMR MOZZARELLA RICE CAKE SKEWERS (Tteokkochi) 치즈가래떡꼬치 리얼사운드 먹방 Eating Sounds,/watch?v=_17pwQe-UHA,1089215,MINEE EATS,1730000,1年前,608807,179
ASMR CHEESE STEAMED EGG (Gyeranjjim) 치즈계란찜 리얼사운드 먹방 Eating Sounds,/watch?v=KIpz7Yxb9Gg,314234,MINEE EATS,1730000,1年前,608807,52
ASMR Samyang Spicy Fire Tteokbokki 불닭떡볶이 리얼사운드 먹방 Eating Sounds,/watch?v=Wjukr-pWfdE,572017,MINEE EATS,1730000,1年前,608807,94
ASMR Berries&Whipped Cream 베리베리생크림 Eating Sounds,/watch?v=w4FUk9ZGRNA,1826981,MINEE EATS,1730000,1年前,608807,300
ASMR CHEESE FONDUE 치즈퐁듀 리얼사운드 먹방 Eating Sounds,/watch?v=pqVv4rwhHc0,373262,MINEE EATS,1730000,1年前,608807,61
ASMR Marshmallow Pop 마시멜로우팝 리얼사운드 먹방 Eating Sounds,/watch?v=fRkuDT3Ndsg,1617206,MINEE EATS,1730000,1年前,608807,266
ASMR TIRAMISU Cake *Thank You 500K* 티라미수 리얼사운드 먹방 Eating Sounds,/watch?v=5AnYLptey14,380853,MINEE EATS,1730000,1年前,608807,63
ASMR CREAMY PASTA Tagliatelle Alfredo 크림파스타 리얼사운드 먹방 Eating Sounds,/watch?v=wAzrwdXMJrc,571066,MINEE EATS,1730000,1年前,608807,94
ASMR KiriMochi Tteokbokki | Super Stretchy Rice Cake 키리모찌 떡볶이 리얼사운드 먹방 Eating Sounds,/watch?v=6SizqWpEjZo,1900668,MINEE EATS,1730000,1年前,608807,312
ASMR EMOJI CHOCOLATE 이모티콘 초콜릿 리얼사운드 먹방 Eating Sounds,/watch?v=GvwhpJ_KHk8,279641,MINEE EATS,1730000,1年前,608807,46
ASMR Ribeye STEAK SUSHI *Big Bites* 스테이크 초밥 리얼사운드 먹방 Eating Sounds,/watch?v=C9VLZaO8bc4,223803,MINEE EATS,1730000,1年前,608807,37
ASMR Korean Army Stew BUDAE JJIGAE *Slurp* 부대찌개 리얼사운드 먹방 Eating Sounds,/watch?v=kp5QgMmb-mA,483227,MINEE EATS,1730000,1年前,608807,79
ASMR Fried Mini Crab Snack *CRUNCHY* 미니꽃게과자 리얼사운드 먹방 Eating Sounds,/watch?v=YlQl233LavA,281291,MINEE EATS,1730000,1年前,608807,46
ASMR Jewel Jelly KOHAKUTOU 코하쿠토 리얼사운드 먹방 Part2 Eating Sounds,/watch?v=Nce3jUTzUb0,924708,MINEE EATS,1730000,1年前,608807,152
ASMR Korean Blood Sausage (SOONDAE) 순대 리얼사운드 먹방 Eating Sounds,/watch?v=J7N9MdJFVFo,301443,MINEE EATS,1730000,1年前,608807,50
ASMR PICKLE CHALLENGE *CRUNCHY* (ASMR Phan) 피클 챌린지 리얼사운드 먹방 Eating Sounds,/watch?v=h4nBNfUiY7c,290179,MINEE EATS,1730000,1年前,608807,48
ASMR EMOJI GUMMIES 이모티콘 젤리 리얼사운드 먹방 Eating Sounds,/watch?v=hpaTwVLk7Xo,902516,MINEE EATS,1730000,1年前,608807,148
ASMR BACON Wrapped MOZZARELLA CORN DOG 베이컨말이 모짜렐라 핫도그 리얼사운드 먹방 Eating Sounds,/watch?v=XeR9HuuuauY,275807,MINEE EATS,1730000,1年前,608807,45
ASMR ROTISSERIE CHICKEN *HAPPY THANKSGIVING* 통닭 리얼사운드 먹방 Eating Sounds,/watch?v=hZNQuoSInqo,1343912,MINEE EATS,1730000,1年前,608807,221
ASMR Mini Doughnuts 미니 도넛 리얼사운드 먹방 Eating Sounds,/watch?v=dBXqvWIZ56Q,184716,MINEE EATS,1730000,1年前,608807,30
ASMR CREAM CURRY UDON NOODLES *BIG BITES* 크림카레우동 리얼사운드 먹방 Eating Sounds,/watch?v=dT6A9DoMeHI,535039,MINEE EATS,1730000,1年前,608807,88
ASMR SPICY FISH CAKE NOODLES 매운어묵+넓적쌀국수 리얼사운드 먹방 Eating Sounds,/watch?v=5m0J9Q-Z3ow,872579,MINEE EATS,1730000,1年前,608807,143
ASMR RETRO CANDY 미국불량식품 리얼사운드 먹방 Eating Sounds,/watch?v=z-fDnbQUQWw,3398758,MINEE EATS,1730000,1年前,608807,558
ASMR ALOE VERA & HONEYCOMB *SLIMY+STICKY* 알로에&벌집꿀 리얼사운드 먹방 Eating Sounds,/watch?v=Njs5AQtBlmw,7674017,MINEE EATS,1730000,1年前,608807,1261
ASMR LEGO CANDY 레고사탕 리얼사운드 먹방 Eating Sounds,/watch?v=AkfnDgmqG8s,253585,MINEE EATS,1730000,1年前,608807,42
ASMR Kimchi Wrapped Pork Belly 김치말이삼겹살 리얼사운드 먹방 Eating Sounds,/watch?v=-i1-cbeerB0,545655,MINEE EATS,1730000,1年前,608807,90
ASMR MACARONS 마카롱 리얼사운드 먹방 Eating Sounds,/watch?v=VscdcNju4YU,636105,MINEE EATS,1730000,1年前,608807,104
"ASMR RICE CAKE & BEAN JELLY 떡, 양갱 리얼사운드 먹방 *수능응원* Eating Sounds",/watch?v=uGoJYwVH2qc,995491,MINEE EATS,1730000,1年前,608807,164
ASMR DEEP FRIED FISH Horse Mackerel *CRUNCHY* 생선튀김 (아지후라이) 리얼사운드 먹방 Eating Sounds,/watch?v=x4wwBhxq6oY,182636,MINEE EATS,1730000,1年前,608807,30
ASMR Chocolate Covered Biscuit Sticks PEPERO 빼빼로 리얼사운드 먹방 Eating Sounds,/watch?v=njvBGroK12E,125783,MINEE EATS,1730000,1年前,608807,21
ASMR SUSHI *BIG BITES* 초밥 리얼사운드 먹방 Eating Sounds,/watch?v=d3h3m74TYvQ,1513194,MINEE EATS,1730000,1年前,608807,249
ASMR SPICY FIRE CUP NOODLES 컵불닭볶음면 리얼사운드 먹방 Eating Sounds,/watch?v=kg8tyRknwhQ,1695320,MINEE EATS,1730000,1年前,608807,278
ASMR OREO O's CEREAL w/ Marshmallows 오레오오즈 리얼사운드 먹방 Eating Sounds,/watch?v=bDpCeIDsxJQ,368854,MINEE EATS,1730000,1年前,608807,61
ASMR KIRIMOCHI & HONEYCOMB 키리모찌&벌집꿀 리얼사운드 먹방 Eating Sounds,/watch?v=2jaJb9ULKLw,2245735,MINEE EATS,1730000,1年前,608807,369
ASMR Hand-Torn Noodle Soup SUJEBI 수제비 리얼사운드 먹방 Eating Sounds,/watch?v=ql3EmNEwZVE,250452,MINEE EATS,1730000,1年前,608807,41
ASMR POPPING BOBA 팝핑보바 리얼사운드 먹방 Eating Sounds,/watch?v=f8C-J2heYts,1120983,MINEE EATS,1730000,1年前,608807,184
ASMR Spicy Jjajang GIANT RICE CAKE+UDON NOODLES 매운짜장 가래떡+우동면 리얼사운드 먹방 Eating Sounds,/watch?v=Gzs6-fn0oN0,1207510,MINEE EATS,1730000,1年前,608807,198
ASMR NATTO *SLIMY* fermented soybeans 낫또 리얼사운드 먹방 Eating Sounds,/watch?v=AmMXAri3zoc,849956,MINEE EATS,1730000,1年前,608807,140
ASMR Pop Rocks *POPPING* CANDY 팝핑캔디 리얼사운드 먹방 Eating Sounds,/watch?v=_yugUMz0fug,698087,MINEE EATS,1730000,1年前,608807,115
ASMR McDonalds CHICKEN NUGGETS *AuzSOME Austin's* CHALLENGE 맥도날드 치킨너겟 챌린지 Eating Sounds,/watch?v=0E6NIO5tdxo,889325,MINEE EATS,1730000,1年前,608807,146
ASMR CHOCOLATE COVERED STRAWBERRY&MARSHMALLOW *HAPPY HALLOWEEN* 딸기&마시멜로우 초콜릿퐁듀 Eating Sounds,/watch?v=gitSVOX0ln4,588195,MINEE EATS,1730000,1年前,608807,97
ASMR Bean Sprout Bulgogi Noodles 콩나물불고기+넓적쌀국수 리얼사운드 먹방 Eating Sounds,/watch?v=AwEN3jFXwa4,286559,MINEE EATS,1730000,1年前,608807,47
ASMR SUSHI CANDY 초밥젤리 리얼사운드 먹방 Eating Sounds,/watch?v=Fslaj17ZLM4,1597601,MINEE EATS,1730000,1年前,608807,262
ASMR RICE CAKE HWAGWAJA 화과자 리얼사운드 먹방 Eating Sounds,/watch?v=zuvPMl5eeE8,472931,MINEE EATS,1730000,1年前,608807,78
ASMR CHEESY KUJIRAI RAMEN NOODLES 쿠지라이식 라면 리얼사운드 먹방 Eating Sounds,/watch?v=DvWfHNFx7jo,362543,MINEE EATS,1730000,1年前,608807,60
"ASMR CHEESECAKE+CHOCOLATE CAKE 꾸덕한 치즈케이크, 초콜릿케이크 Eating Sounds",/watch?v=0syVczgRVS8,365292,MINEE EATS,1730000,1年前,608807,60
ASMR KOREAN SWEETS HANGWA 한과 리얼사운드 먹방 Eating Sounds,/watch?v=f83UeUWN-5Q,135038,MINEE EATS,1730000,1年前,608807,22
ASMR American Snacks Chips&Cookies 미국과자 리얼사운드 먹방 Eating Sounds,/watch?v=Aw7VQHPkDn8,139681,MINEE EATS,1730000,1年前,608807,23
ASMR GULAB JAMUN INDIAN SWEET 굴랍자문 리얼사운드 먹방 Eating Sounds,/watch?v=9WpL8K-pzYQ,709376,MINEE EATS,1730000,1年前,608807,117
ASMR Strawberry Marshmallow & Meringue Cookies 딸기마시멜로우+머랭쿠키 Eating Sounds,/watch?v=iatnwW3IICA,2614785,MINEE EATS,1730000,1年前,608807,429
ASMR Southern BBQ Platter 미국식 바비큐 리얼사운드 먹방 Eating Sounds,/watch?v=OufPSS9MaKc,844930,MINEE EATS,1730000,1年前,608807,139
ASMR CURRY FIRE NOODLES 커리불닭볶음면 리얼사운드 먹방 Eating Sounds,/watch?v=GQHajDXTg-w,461415,MINEE EATS,1730000,1年前,608807,76
ASMR SALMON&FISH EGG over RICE *BIGBITES* 연어날치알덮밥 리얼사운드 먹방 Eating Sounds,/watch?v=vuP9bUUcLtI,400641,MINEE EATS,1730000,1年前,608807,66
ASMR BACON-WRAPPED RICE CAKES 베이컨말이 가래떡 리얼사운드 먹방 Eating Sounds,/watch?v=-l-hk8nDGHs,145102,MINEE EATS,1730000,1年前,608807,24
ASMR Marshmallow CEREAL *Crunchy* 마시멜로우 시리얼 리얼사운드 먹방 Eating Sounds,/watch?v=Voumh3N6lZ8,1635868,MINEE EATS,1730000,1年前,608807,269
ASMR Spaghetti Aglio e Olio *BigBites* 알리오올리오 스파게티 리얼사운드 먹방 Eating Sounds,/watch?v=Q4gYTA0mXjc,286654,MINEE EATS,1730000,1年前,608807,47
ASMR Tapioca Pearls (BOBA) 타피오카펄 리얼사운드 먹방 Eating Sounds,/watch?v=xnT7LmzAUL8,236499,MINEE EATS,1730000,1年前,608807,39
ASMR SPICY SEAFOOD NOODLES aka Stir-fry JJAMPONG 볶음진짬뽕 리얼사운드 먹방 Eating Sounds,/watch?v=Bob9tAGTcSY,336801,MINEE EATS,1730000,1年前,608807,55
ASMR MOCHI ICE CREAM 아이스크림 찹쌀떡 리얼사운드 먹방 Eating Sounds,/watch?v=CH3MB3d-3eQ,1394506,MINEE EATS,1730000,1年前,608807,229
ASMR INDIAN SWEETS 인도 전통과자 리얼사운드 먹방 Eating Sounds,/watch?v=yJdQVJA0cSM,453270,MINEE EATS,1730000,1年前,608807,74
ASMR SALMON & FISH EGG Temaki (Hand Roll SUSHI) 연어회&날치알 데마끼 리얼사운드 먹방 Eating Sounds,/watch?v=4URNS7x3FBs,375079,MINEE EATS,1730000,1年前,608807,62
ASMR Vegetable Platter *CRUNCHY* 각종 채소 리얼사운드 먹방 Eating Sounds,/watch?v=BkH6ANC2QCc,410711,MINEE EATS,1730000,1年前,608807,67
ASMR Cheesy TTEOKBOKKI with FIRE NOODLES 불닭볶음면치즈라볶이 리얼사운드 먹방 Eating Sounds,/watch?v=ddqjRV9CCoc,1815099,MINEE EATS,1730000,1年前,608807,298
ASMR Astronaut Ice Cream🚀👩‍🚀🍦우주아이스크림 리얼사운드 먹방 Eating Sounds,/watch?v=xsVDhPejTys,578194,MINEE EATS,1730000,1年前,608807,95
ASMR UDON NOODLE SOUP *SLURP* 새우튀김우동 리얼사운드 먹방 Eating Sounds,/watch?v=iU-tcbvEA3Y,916233,MINEE EATS,1730000,1年前,608807,150
ASMR Pişmaniye TURKISH COTTON CANDY 터키구름사탕 리얼사운드 먹방 Eating Sounds,/watch?v=oKs_x18X1OY,581140,MINEE EATS,1730000,1年前,608807,95
ASMR Soft&Hard ICE Eating Sounds *Crunchy* 얼음 리얼사운드 먹방,/watch?v=ZlaHYcuRRGA,646557,MINEE EATS,1730000,1年前,608807,106
ASMR HASH BROWNS *Crunchy* 해시브라운 리얼사운드 먹방 Eating Sounds,/watch?v=_lkHPaPvYpU,186438,MINEE EATS,1730000,1年前,608807,31
ASMR Daegu RICE CAKE in Syrup 대구꿀떡 리얼사운드 먹방 Eating Sounds,/watch?v=WFr96tRw4cU,1203517,MINEE EATS,1730000,1年前,608807,198
ASMR Stir-Fried SQUID NOODLES 오징어볶음면 리얼사운드 먹방 Eating Sounds,/watch?v=sG4OK-ldH00,425147,MINEE EATS,1730000,1年前,608807,70
ASMR CUSTARD PUDDING *SoftTingle* 커스타드푸딩 리얼사운드 먹방 Eating Sounds,/watch?v=xSAe61YOud4,277696,MINEE EATS,1730000,1年前,608807,46
ASMR SASHIMI Eating Sounds 회 리얼사운드 먹방,/watch?v=xBv89UhfLM4,870820,MINEE EATS,1730000,1年前,608807,143
ASMR SILKWORM PUPA (BEONDEGI) 번데기 리얼사운드 먹방 Eating Sounds,/watch?v=yDGYCtHhaCI,180367,MINEE EATS,1730000,1年前,608807,30
ASMR Korean Fried Chicken (Yang-Nyum Chicken) 양념치킨 리얼사운드 먹방 Eating Sounds,/watch?v=3wJ_M8hSD6A,993765,MINEE EATS,1730000,1年前,608807,163
ASMR KONJAC JELLY *Soft Tingles* 곤약젤리 리얼사운드 먹방 Eating Sounds,/watch?v=4813SmrxVy0,400807,MINEE EATS,1730000,1年前,608807,66
ASMR BLACK BEAN NOODLES (JJAJANGMYEON) *BIG BITES* 짜장면 리얼사운드 먹방 Eating Sounds,/watch?v=YTr79IVZSiI,2093158,MINEE EATS,1730000,1年前,608807,344
ASMR TURKISH DELIGHT *Sticky* 터키쉬 딜라이트 리얼사운드 먹방 Eating Sounds,/watch?v=2FLBfXHnlyg,1998897,MINEE EATS,1730000,1年前,608807,328
ASMR SPICY COLD NOODLES (Bibim-Naengmyeon) 비빔냉면 리얼사운드 먹방 Eating Sounds,/watch?v=D8o2n5A30a8,607198,MINEE EATS,1730000,1年前,608807,100
ASMR SONGPYEON (Korean Rice Cake for Chuseok) 송편 리얼사운드 먹방 Eating Sounds,/watch?v=Aazw9tRkyPc,153312,MINEE EATS,1730000,1年前,608807,25
ASMR HONEYCOMB DAIFUKU MOCHI 벌집꿀 찹쌀떡 리얼사운드 먹방 Eating Sounds,/watch?v=BXJ2g9vduOg,670454,MINEE EATS,1730000,1年前,608807,110
ASMR RAINBOW CORN CHEESE 무지개콘치즈 리얼사운드 먹방 Eating Sounds,/watch?v=wAGQxu0bPDw,415032,MINEE EATS,1730000,1年前,608807,68
ASMR TANGSUYUK | Korean-Chinese Sweet&Sour Pork 탕수육 리얼사운드 먹방 *CRUNCHY* Eating Sounds,/watch?v=fM0irDMzt6E,171355,MINEE EATS,1730000,1年前,608807,28
ASMR NUCLEAR FIRE NOODLES (Challenge) *messy* 핵불닭볶음면 리얼사운드 챌린지 먹방 Eating Sounds,/watch?v=zLx4FnSvzzE,1823758,MINEE EATS,1730000,1年前,608807,300
ASMR Jelly Bubbles | Extreme Eating Sounds 버블젤리 리얼사운드 먹방,/watch?v=5FHwllovSPs,651258,MINEE EATS,1730000,1年前,608807,107
ASMR Cheese Doughnuts *Crunchy&Chewy* 치즈볼 리얼사운드 먹방 Eating Sounds,/watch?v=cP8wIWEwjPs,339260,MINEE EATS,1730000,1年前,608807,56
ASMR RAW OYSTERS 생굴 리얼사운드 먹방 Eating Sounds,/watch?v=KNdT_gpu1Mo,269900,MINEE EATS,1730000,1年前,608807,44
ASMR SWEDISH CANDY 스웨디시 젤리 리얼사운드 먹방 Eating Sounds,/watch?v=ZTB1voR6V54,1773720,MINEE EATS,1730000,1年前,608807,291
ASMR SPICY BABY OCTOPUS 쭈꾸미볶음 리얼사운드 먹방 Eating Sounds,/watch?v=NYlfSTJ99iU,236820,MINEE EATS,1730000,1年前,608807,39
ASMR ACORN JELLY (DOTORIMUK) 도토리묵 리얼사운드 먹방 Eating Sounds,/watch?v=iXZu0Zrk-3I,128450,MINEE EATS,1730000,1年前,608807,21
ASMR SHRIMP COCKTAIL 칵테일새우 리얼사운드 먹방 No Talking Eating Sounds,/watch?v=EItpKFO6L3s,228451,MINEE EATS,1730000,1年前,608807,38
ASMR SPICY MALA FIRE NOODLES (CHALLENGE) 마라 불닭볶음면 리얼사운드 (챌린지) 먹방 Eating Sounds,/watch?v=xQ8D31VKH_E,351073,MINEE EATS,1730000,1年前,608807,58
ASMR KONJAC 곤약 리얼사운드 먹방 Eating Sounds,/watch?v=h7YbGIgM300,857287,MINEE EATS,1730000,1年前,608807,141
ASMR PORK SKIN *Chewy&Sticky* 돼지껍데기 리얼사운드 먹방 Eating Sounds,/watch?v=l8Ae7jGtwFk,327903,MINEE EATS,1730000,1年前,608807,54
ASMR Shrimp Tempura *CRUNCHY* 새우튀김 리얼사운드 먹방 Eating Sounds,/watch?v=RNyhzHRmGDg,406352,MINEE EATS,1730000,1年前,608807,67
ASMR Cheesy Tteokbokki with Udon Noodles 치즈우동떡볶이 리얼사운드 먹방 Eating Sounds,/watch?v=Eg-4-kQ7jxg,3367685,MINEE EATS,1730000,1年前,608807,553
ASMR Korean Chapssal Doughnuts *Crunchy&Chewy* 찹쌀도넛 리얼사운드 먹방 Eating Sounds,/watch?v=uuUFAp3z_Og,224219,MINEE EATS,1730000,1年前,608807,37
ASMR Harry Potter Jelly Bean (Challenge) 해리포터젤리빈 리얼사운드 먹방 Eating Sounds,/watch?v=Ps5wkad9nqc,546526,MINEE EATS,1730000,1年前,608807,90
ASMR SEA GRAPES *Crunchy&Popping* 바다포도 리얼사운드 먹방 Eating Sounds,/watch?v=RyW0NRUlMZ0,2301740,MINEE EATS,1730000,1年前,608807,378
