title,url,view,channel_name,channel_subscriber,create_stamp,mean_view,mean_comparison
あの日のこと全てお話します　#861,/watch?v=ji_IXDWAlQg,14623,うさ男,44100,21時間前,18408,79
ウサ飼いさんに聞きました！今あげてるチモシー（牧草）は何ですか？　#860,/watch?v=v-E6MW0AciY,11260,うさ男,44100,3日前,18408,61
3歳、5歳、7歳はうさぎの厄年　#859,/watch?v=k9hqyE2QDSE,9653,うさ男,44100,4日前,18408,52
【後編】おもてなし民泊「ウサギさん家」オープン　#858,/watch?v=ZOppEewTW5M,19710,うさ男,44100,5日前,18408,107
【前編】おもてなし民泊「ウサギさん家」オープン　#857,/watch?v=bwzjBac6hYA,16101,うさ男,44100,6日前,18408,87
俺が悪いんやない…ウサの可愛いシッポが悪いんや！　#856,/watch?v=bYwaSHsdZI0,16955,うさ男,44100,1週間前,18408,92
お母さんから貰ったプレゼントが嬉しすぎたウサギ　#855,/watch?v=ABBxHv2X8TU,24641,うさ男,44100,1週間前,18408,134
もはや野生を忘れたうさぎ　#854,/watch?v=TVQw759Tu4I,22702,うさ男,44100,1週間前,18408,123
お姉ちゃん主導のウサの3歳の誕生日パーチー　#853,/watch?v=X_LYPkNIXn4,10035,うさ男,44100,1週間前,18408,55
思ったより高かった…近未来型のアルミトンネル買ってみた　#852,/watch?v=lqbwOrMFX4A,15847,うさ男,44100,1週間前,18408,86
【年齢換算表】うさぎの年齢を人の年齢に換算すると何歳？　#851,/watch?v=uB0HmFV9bsA,17667,うさ男,44100,1週間前,18408,96
ウサギとの日曜日の過ごし方！みんなで花火大会にも行きました　#850,/watch?v=8BkB9AUtxx4,11050,うさ男,44100,2週間前,18408,60
目の前でコテンの出血大サービスのウサちゃん　#849,/watch?v=geVRV7OUaJ0,16888,うさ男,44100,2週間前,18408,92
アイスクリームのように溶けるうさぎ　#848,/watch?v=BLZoPSDWebg,9244,うさ男,44100,2週間前,18408,50
やっぱり生のニンジンのポリが一番でした　#847,/watch?v=jOgMYWg2tT4,8110,うさ男,44100,2週間前,18408,44
かっぱえびせんを食べてる訳ではありません　#846,/watch?v=QLiHG3T2l_I,10118,うさ男,44100,2週間前,18408,55
プニプニで気持ちいいウサギのほっぺ　#845,/watch?v=4pOtBjjfU3M,11335,うさ男,44100,3週間前,18408,62
妻のスカートの中で遊ぶうさぎ　#844,/watch?v=2R7qk4dBtF0,13848,うさ男,44100,3週間前,18408,75
ハッスルしすぎて息があがるウサギ　#843,/watch?v=Pc8c3ZEBZAA,18956,うさ男,44100,3週間前,18408,103
マッサージ直後に爆睡するお客さん　#842,/watch?v=ABaU8L6cAYU,33137,うさ男,44100,3週間前,18408,180
トントンであやされるウサギ　#841,/watch?v=-b5WE2zH7FU,16394,うさ男,44100,3週間前,18408,89
寝落ちする飼い主が続出！ウサギの強力な癒しパワー　#840,/watch?v=smTNiTjr0q8,12478,うさ男,44100,3週間前,18408,68
宇宙船に乗ったことを悔やんでも悔やみきれないウサギ　#839,/watch?v=5PrGpyzYa18,16512,うさ男,44100,4週間前,18408,90
美味しいものを沢山食べれて幸せなうさぎ　#838,/watch?v=99FhLOhOfNg,21754,うさ男,44100,4週間前,18408,118
おやつの場所はちゃーーーんと分かっているうさぎ　#837,/watch?v=hg8T86lDw2A,11529,うさ男,44100,1か月前,18408,63
宿命には逆らえないうさぎ　#836,/watch?v=d-PyNfPoyGM,20287,うさ男,44100,1か月前,18408,110
父の企みに気づき怒りの足ダン2発！　#835,/watch?v=x_E3LhUnDc8,21831,うさ男,44100,1か月前,18408,119
扉が開くと凸してくるウサギ　#834,/watch?v=AuRIIgx4FTM,13365,うさ男,44100,1か月前,18408,73
ジャストフィットするうさぎの頭ととカエルのお尻　#833,/watch?v=YN2x0Bdynu0,12572,うさ男,44100,1か月前,18408,68
仕事前に過ごすウサギとの3時間　#832,/watch?v=--8es3Mu01A,23155,うさ男,44100,1か月前,18408,126
ホリホリを邪魔するものは何人たりとも許さないうさぎ　#831,/watch?v=D_6391QqSN8,26638,うさ男,44100,1か月前,18408,145
再生ニンジンの葉をでっかく育てるコツ教えます！　#830,/watch?v=zJ9-y0vxZBk,12477,うさ男,44100,1か月前,18408,68
梅雨のジメジメで寝てばかりのうさぎ　#829,/watch?v=4EwHj-HM6ko,16295,うさ男,44100,1か月前,18408,89
ウサギの老後の事が詳しく学べる本を買ったら、まだそんな歳じゃないと怒られました #828,/watch?v=IyRmtuzfG_o,13670,うさ男,44100,1か月前,18408,74
見事にうさ吸い失敗したでござる！の巻 #827,/watch?v=Cl3hgYpM0s4,14601,うさ男,44100,1か月前,18408,79
露骨にイヤな顔をするウサギ #826,/watch?v=UoKvA0ZGo-A,14687,うさ男,44100,1か月前,18408,80
ウサギの爪切りをわざわざ2階の部屋でやる理由 #825,/watch?v=BEa3pZQ90BI,10701,うさ男,44100,1か月前,18408,58
吠えるうさぎ #824,/watch?v=vdKrqDNcc3M,18887,うさ男,44100,1か月前,18408,103
ちょっ、おまwwww #823,/watch?v=4fJoRw7tbxk,22507,うさ男,44100,1か月前,18408,122
待ちきれなかったうさぎ！瓶に頭つっこむ　#822,/watch?v=8ozcHefIx0Q,17097,うさ男,44100,1か月前,18408,93
抽選中のうさぎ　#821,/watch?v=5Gk1dTT_HUc,9390,うさ男,44100,1か月前,18408,51
地上波デビューを果たしたうさぎ　#820,/watch?v=teDSSttpwOY,27227,うさ男,44100,1か月前,18408,148
病院に連れて行かれました　#819,/watch?v=thahJNJ0jbA,27650,うさ男,44100,1か月前,18408,150
うさぎと一緒なら草抜きも楽しい　#818,/watch?v=bkFtzkaVn3o,13052,うさ男,44100,1か月前,18408,71
うさぎも気になるジョイントマットのズレ対策！　#817,/watch?v=6lLQUudeOPo,11851,うさ男,44100,1か月前,18408,64
闇を切り裂く漆黒のウサギ　#816,/watch?v=EcwpK5l2-0I,10198,うさ男,44100,1か月前,18408,55
アレが気になってちょいちょいコッチを確認するウサギ　#815,/watch?v=dhgQHnRO__A,14570,うさ男,44100,1か月前,18408,79
外いきたいよぉ〜！アピールをしてくるウサギに負けてばかりの飼い主　#813,/watch?v=IrLC1i-o0Uc,11313,うさ男,44100,1か月前,18408,61
オヤツを奪い逃げ去るうさぎ　#812,/watch?v=vgrNPDbvvBc,15649,うさ男,44100,1か月前,18408,85
お腹が痛いの？大好物のオヤツにも知らんぷりでケージから出てこないウサギに心配が止まらない家族　#811,/watch?v=0egqIIGPmtE,198548,うさ男,44100,1か月前,18408,1079
エアコンって消すと暑いし付けると寒いよね問題　#810,/watch?v=SPYMm8xkqtM,14417,うさ男,44100,2か月前,18408,78
【3日間限定プレゼント企画】700回〜800回のウサの可愛いをハイライトで振り返ります　#809,/watch?v=c3GXG_8yZks,12058,うさ男,44100,2か月前,18408,66
カーテン卒業したらリビングが復活しました #808,/watch?v=iao0lkzkAwU,9177,うさ男,44100,2か月前,18408,50
一緒に映画鑑賞するも眠気の限界をむかえるウサギ #807,/watch?v=8IBpHL9Q0h8,14531,うさ男,44100,2か月前,18408,79
妻はそれをチ◯コベットと呼ぶ #806,/watch?v=m2YKdkGSHFk,16935,うさ男,44100,2か月前,18408,92
季節外れのコタツが楽しすぎるウサギと飼い主 #805,/watch?v=o6Dmn7XIImE,9421,うさ男,44100,2か月前,18408,51
ウサギにバレずにブラッシングせよ！ #804,/watch?v=RgacvPHu68g,8532,うさ男,44100,2か月前,18408,46
うさぎ様の「うまい！」のために！独自開発ミニミニミニキャロット #803,/watch?v=lAs7W_UBwbs,10864,うさ男,44100,2か月前,18408,59
高価な大人のアソビ！うさ男葛（クズ）育てます #802,/watch?v=HxqOaVNyPe4,13393,うさ男,44100,2か月前,18408,73
うさぎのお尻についてる鈴カステラを頬張りたい #801,/watch?v=Pl8iLNH4lXM,15733,うさ男,44100,2か月前,18408,85
妻と一体化するウサギ #800,/watch?v=SDeFbRr8QNc,14680,うさ男,44100,2か月前,18408,80
使わなくなった布団をウサギにあげてみた！ #799,/watch?v=9YqmRIfBjPc,22367,うさ男,44100,2か月前,18408,122
ちょっとニガテな窓際の克服に挑むうさぎさん #798,/watch?v=b9KgXUPGmBE,8964,うさ男,44100,2か月前,18408,49
ウサギの鼻の下の秘密知りたくないですか？ #797,/watch?v=7F5AOb3VLU4,17784,うさ男,44100,2か月前,18408,97
ノーカット1本勝負！うさぎの爪切りの全て見せます #796,/watch?v=Cbdt33D28Mk,15507,うさ男,44100,2か月前,18408,84
ばにゃにゃ甘ーーーーーっい！の顔をするウサギ #795,/watch?v=zJALKCNu4Jo,20101,うさ男,44100,2か月前,18408,109
うさぎが窓際までお見送りにきてくれる本当の理由 #794,/watch?v=-HZx9ZCfS9U,12381,うさ男,44100,2か月前,18408,67
料理／漫画／モフ！ゆったりと流れるうさぎと過ごす穏やかな休日 #793,/watch?v=rNWOUc2tHTc,19033,うさ男,44100,2か月前,18408,103
チャンネル登録4万人を記念してお食事会を開催 #792,/watch?v=v0bZppRncQk,9340,うさ男,44100,2か月前,18408,51
それでは参ります！ #791,/watch?v=stLxraMsXcM,15217,うさ男,44100,2か月前,18408,83
あなたのお家のうさぎは何タイプ？うさぎの性格診断 #790,/watch?v=nP5FXJX6ZBs,14081,うさ男,44100,2か月前,18408,76
テーブルの上のおやつが気になって掴まり立ちするうさぎ #789,/watch?v=rYnfme70E7A,14038,うさ男,44100,2か月前,18408,76
簡単でオススメ！再生野菜でうさぎのおやつ作り #788,/watch?v=xyslV_EgAFI,13231,うさ男,44100,2か月前,18408,72
まだまだあるぞ！うさぎの可愛いパーツマニアック編 #787,/watch?v=LPq4iUgrUF0,12659,うさ男,44100,2か月前,18408,69
昼寝中の妻の上にテーマパークを作ってみた #786,/watch?v=YffcKHCYFa8,21165,うさ男,44100,2か月前,18408,115
遂にウサにもコラボのお話がきました #785,/watch?v=ll4rj9yLqaU,24686,うさ男,44100,2か月前,18408,134
私のまるごとバナナどこ？バナナの匂いを嗅ぎつけてソワソワするうさぎ #784,/watch?v=PG2JVsxs2Xs,22517,うさ男,44100,2か月前,18408,122
自分の顔の何倍もあるキャベツにかぶり付くうさぎ #783,/watch?v=n3XtCcdTI6Q,21535,うさ男,44100,3か月前,18408,117
堕落した嫁チャンの愛読書に鬼アゴすりするうさぎ #782,/watch?v=0v2g0DWcJGk,19348,うさ男,44100,3か月前,18408,105
【永久保存版】うさぎの可愛いパーツBest5作ろうと思って完成させたらBest11になってた件 #781,/watch?v=H-uvnexcFPo,30854,うさ男,44100,3か月前,18408,168
爪切りだったとは聞かされていないウサギ #780,/watch?v=-dUejoykvrU,20079,うさ男,44100,3か月前,18408,109
ピーター教のすべてを話します #779,/watch?v=A5rghEv3CR4,10702,うさ男,44100,3か月前,18408,58
気持ちいいほど吸い込まれていく春菊！#778,/watch?v=VQrVFrN9BeU,31436,うさ男,44100,3か月前,18408,171
おとん、なにしとん？ #777,/watch?v=HGINH3gfHQk,18046,うさ男,44100,3か月前,18408,98
決意の表情！怒られるの分かってるけどチャレンジしたくなっちゃうウサギ #776,/watch?v=iT6_VHF8hk8,15844,うさ男,44100,3か月前,18408,86
可愛くてちょっと笑えるうさぎのモグモグタイム #775,/watch?v=dCAnUTtTeyc,18741,うさ男,44100,3か月前,18408,102
オヤツをよこせぇー！と言わんばかりにダンボール戦車から顔を出すうさぎ #774,/watch?v=8RxEYB5w13M,15906,うさ男,44100,3か月前,18408,86
大掃除の一大イベントには必ず顔を出すウサギ #773,/watch?v=Vf63rJOFsQc,11306,うさ男,44100,3か月前,18408,61
Official足ダンdism 「Pretender」 #772,/watch?v=vOjWzB1pY6Q,12960,うさ男,44100,3か月前,18408,70
うさぎに学ぶStayHomeのやり方 #771,/watch?v=cfwAimn1Vhk,38352,うさ男,44100,3か月前,18408,208
