title,url,view,channel_name,channel_subscriber,create_stamp,mean_view,mean_comparison
谷川岳ロープーウェイ下りタイムラプス,/watch?v=sleOUb4cDzE,38,殿と毎日楽しく生活,4,1か月前,155,25
殿のお出迎え撮ってみた,/watch?v=P236AbCz5Xo,36,殿と毎日楽しく生活,4,2年前,155,23
〖ASMR風 〗沖縄の海ぶどう食べてみた〖 生活音入りまくり〗,/watch?v=0C-8_ideRq8,713,殿と毎日楽しく生活,4,2年前,155,460
〖 ASMR〗殿ちゃんにちゅーるあげてみた。〖 ぽくなった〗,/watch?v=73e0iwfAHV8,48,殿と毎日楽しく生活,4,2年前,155,31
猫じゃらしを抱きながら眠る殿ちゃん,/watch?v=g9emMj6ZIv4,24,殿と毎日楽しく生活,4,2年前,155,15
うちの猫ちゃんにマタタビあげたら大暴走,/watch?v=m6uy6iFzEVQ,73,殿と毎日楽しく生活,4,2年前,155,47
