title,url,view,channel_name,channel_subscriber,create_stamp,mean_view,mean_comparison
【大興奮】レーザーポインターで今日も大暴れする猫がこちらです！笑,/watch?v=76GV6NhB4aw,106,猫の兄妹ツナハム,110,2日前,354,30
かまって欲しい猫VS漫画が読みたい飼い主！,/watch?v=xJqWLkL3TeA,149,猫の兄妹ツナハム,110,6日前,354,42
一緒にお昼寝しよう！溶けるようにゴロゴロしちゃう猫！【癒し】,/watch?v=C-_CgserbYU,171,猫の兄妹ツナハム,110,1週間前,354,48
初めての猫草！美味しそうにむしゃむしゃ食べる猫がこちらです！w　First cat grass♩,/watch?v=aJA4Afmk1_w,186,猫の兄妹ツナハム,110,1週間前,354,53
爪切りが嫌過ぎてブチ切れ!?する猫がこちらw　Cats who hate nail clippers！,/watch?v=7Rwj8_snwjc,144,猫の兄妹ツナハム,110,2週間前,354,41
猫とソファーでラブラブしようとした結果・・・・w　If you try to relax with a cat...,/watch?v=yAo4gy_RhYE,162,猫の兄妹ツナハム,110,2週間前,354,46
水遊び用の猫おもちゃで遊ぼう！水を怖がらずに遊んじゃう猫w Cat playing in water,/watch?v=h4y4BoNEOZU,176,猫の兄妹ツナハム,110,3週間前,354,50
初めてのレーザーポインターに猫が大興奮！その反応がこちら・・・w【猫用おもちゃ】,/watch?v=QlRhfksISGs,152,猫の兄妹ツナハム,110,3週間前,354,43
猫草の種まきに興味津々になっちゃう猫がこちら・・・！アラサーOLのんびりな休日。Grow cat grass!,/watch?v=xLS-Ew4aSWw,186,猫の兄妹ツナハム,110,1か月前,354,53
【作業・勉強用動画】猫と一緒に作業しましょう！,/watch?v=dWlsJNjcHEg,178,猫の兄妹ツナハム,110,1か月前,354,50
ちゅ〜るを必死に食べる猫がかわいい！Cute cat desperately eating a snack,/watch?v=0QtG_5wzAmI,161,猫の兄妹ツナハム,110,1か月前,354,45
兄妹猫のシンクロチャレンジやってみた結果・・・・・！w,/watch?v=W441NR3aNds,149,猫の兄妹ツナハム,110,1か月前,354,42
新しいブラシで猫をブラッシングしたら・・・想像以上に抜け毛の量がすごかったw　Cat brushed with new brush！,/watch?v=ASf8sJya_pA,160,猫の兄妹ツナハム,110,1か月前,354,45
兄妹猫はどっちが重たい？猫の体重測定をしました！【スコティッシュフォールド】,/watch?v=78RDxW2lz8k,146,猫の兄妹ツナハム,110,1か月前,354,41
メス猫発情期の鳴き声がすごいっ！！※雄猫閲覧注意！笑,/watch?v=swy02mzut0w,825,猫の兄妹ツナハム,110,1か月前,354,233
猫がまたたびに酔っぱらうとこうなります！笑  I gave my cat a Matatabi for the first time!,/watch?v=QldurTQrLt8,147,猫の兄妹ツナハム,110,1か月前,354,42
猫とアラサーOLのモーニングルーティン！【morning routine】,/watch?v=_9xNXV2YG2s,237,猫の兄妹ツナハム,110,1か月前,354,67
初めてチュールアイスをあげたら猫の食いつきが凄かった！w,/watch?v=HoOUrifBnxs,195,猫の兄妹ツナハム,110,1か月前,354,55
【猫・錠剤】嫌がらずすんなり薬を飲む賢い猫！A cat that does not dislike taking medicine.,/watch?v=8y57Nvvf9mI,154,猫の兄妹ツナハム,110,1か月前,354,44
飼い主の腕をギュッとしておやつを食べる猫がかわいい！笑 Cute cat holding hand and eating snack.,/watch?v=-rbGX0N9y3w,148,猫の兄妹ツナハム,110,2か月前,354,42
メス猫のフェロモンにフレーメン反応する猫！笑 cat's Flehmen response,/watch?v=yFesfg6Zowc,166,猫の兄妹ツナハム,110,2か月前,354,47
猫が生まれて初めて氷を見ると・・・こうなります！笑 Cat touching ice for the first time.,/watch?v=8lsmsGqfE_g,151,猫の兄妹ツナハム,110,2か月前,354,43
猫を飼う前に見てほしい【一人暮らしで猫を飼うと生活がこうなる】可能性があります！,/watch?v=teeUD3B2Y94,177,猫の兄妹ツナハム,110,2か月前,354,50
病気？？？猫の下痢が続いたので病院へ行きました・・・Cat disease? Went to the hospital.,/watch?v=3G-2hfrvFso,246,猫の兄妹ツナハム,110,2か月前,354,69
【猫用おもちゃ】羽根の猫じゃらしが猫たちに大好評すぎ！w,/watch?v=sFF2f4Ekc-E,211,猫の兄妹ツナハム,110,2か月前,354,60
初めて炭酸水を見た猫はどんな反応をするのか・・・？！What if a cat sees soda for the first time?,/watch?v=P6R3DnkSsSw,210,猫の兄妹ツナハム,110,2か月前,354,59
目薬が苦手な猫。獣医さんに教わった目薬のさし方にチャレンジ！Easy! Cat eye drops,/watch?v=wFiWZhGqj90,729,猫の兄妹ツナハム,110,2か月前,354,206
誕生日おめでとう！猫用の手づくりご飯でツナハムのお祝いをしました♫ Festive riceCelebrated the cat!,/watch?v=2MxZ2MgYZ6c,219,猫の兄妹ツナハム,110,2か月前,354,62
【肉球ケア】肉球まわりのはみ毛をカットします！途中、アクシデントあり。。笑 Cuts hair around the cat's paws.,/watch?v=zoWOoR_5UzA,269,猫の兄妹ツナハム,110,2か月前,354,76
【猫用おもちゃ】飼い主も驚き！ほぼ寝転がって手抜きで遊ぶ猫の姿がこちら・・・w,/watch?v=CM7eP6A4JqU,255,猫の兄妹ツナハム,110,2か月前,354,72
【猫耳掃除】愛猫の耳掃除をしたらなんとも言えない表情に・・・！笑　Cat ear cleaning！Cat with a funny expression.,/watch?v=UWI1k3S9ckg,567,猫の兄妹ツナハム,110,2か月前,354,160
初めてのサーモンの刺身を食べた猫の反応がこちらですw【咀嚼音あり】What is the reaction when the cat eats salmon for the first time?,/watch?v=tm5KVq-BZZk,298,猫の兄妹ツナハム,110,2か月前,354,84
飼い主に猫まくらにされた猫はどんな反応をする？【癒し効果抜群の猫まくら集】It feels good to sleep a cat!,/watch?v=pvlK25H4b0M,283,猫の兄妹ツナハム,110,2か月前,354,80
【すごい】猫の身体能力が凄まじい！！何cm飛べるかチャレンジ！How high can a cat jump?,/watch?v=-d7USg2CrKY,262,猫の兄妹ツナハム,110,3か月前,354,74
ブラッシングしていたら猫に指を食べられました…笑  The cat ate a hand while brushing・・・!?,/watch?v=-M7rQzaV7Q0,246,猫の兄妹ツナハム,110,3か月前,354,69
【まさかの結末】電動シェーバーで猫の肉球のはみ毛を処理しようとした結果...Cat funny happening!,/watch?v=LJgsIlVCsDQ,297,猫の兄妹ツナハム,110,3か月前,354,84
【お昼寝用】猫と一緒にゴロゴロお昼寝しませんか？Would you like to take a nap with a cat?,/watch?v=9Y1Y7sa8TuI,253,猫の兄妹ツナハム,110,3か月前,354,71
【猫発情期】発情期になりかわいくキュルキュルないてしまう猫。cat in heat...,/watch?v=B0ARVAcdKZ4,401,猫の兄妹ツナハム,110,3か月前,354,113
パソコン越しにかまってアピールをする猫がかわいい！,/watch?v=ByMVpNstKiU,290,猫の兄妹ツナハム,110,3か月前,354,82
【猫お風呂】初めてのペット用バスタブで猫をお風呂に入れたら、、大変な事に！,/watch?v=AdT_tQOIaHc,267,猫の兄妹ツナハム,110,3か月前,354,75
【癒し】ブラッシングにとろけてしまいそうな猫。初のグルーミングブラシにチャレンジ！Cats delighted in brushing.,/watch?v=KLOOLGEjwLw,205,猫の兄妹ツナハム,110,3か月前,354,58
夢中でカリカリとウェットご飯を食べる猫の咀嚼音がかわいすぎる！【ASMR】【癒し音】Chewing sound of cat.,/watch?v=jW6Huyy_eWs,411,猫の兄妹ツナハム,110,3か月前,354,116
ダンボールに穴を空けたら猫が大はしゃぎ‼︎ 自粛期間中のんびり猫と遊ぶ＾＾A cat playing with cardboard is very excited!,/watch?v=u3efTp_cpe4,272,猫の兄妹ツナハム,110,3か月前,354,77
はじめての歯ブラシ！嫌すぎて全然歯磨きさせてくれない猫。First time! Brushing teeth of cat.,/watch?v=p7gRuF0N30k,200,猫の兄妹ツナハム,110,3か月前,354,56
ダンボール箱にひきこもる猫。Cats who love cardboard,/watch?v=xthrqqJQwWw,213,猫の兄妹ツナハム,110,3か月前,354,60
発情期になり、とてももどかしそうな猫‥。cat in heat,/watch?v=qol4p8Vcef4,243,猫の兄妹ツナハム,110,3か月前,354,69
【祝１歳♡ツナ&ハム】１歳を迎える猫の誕生日をお祝いをしました！,/watch?v=YaFqd2ilYM8,232,猫の兄妹ツナハム,110,3か月前,354,66
人間のように布団で眠る猫が可愛すぎる！The sleeping cat is like a human,/watch?v=KWMqP37wN6g,196,猫の兄妹ツナハム,110,4か月前,354,55
人気NO.１の電動おもちゃに大興奮する猫。A cat excited about electric toys,/watch?v=TiYt49kJS6E,325,猫の兄妹ツナハム,110,4か月前,354,92
もふもふ猫をお風呂に入れたら予想外に大人しかったwそして真の姿に‥！？Bath of a gentle cat. The cat becomes a true figure.,/watch?v=KwbBdRoGBhA,274,猫の兄妹ツナハム,110,4か月前,354,77
猫アプリに全く反応しない猫w寝転がってスマホながめてツナくんおじさん化。笑,/watch?v=ZaptEsnCbbY,194,猫の兄妹ツナハム,110,4か月前,354,55
ブラッシングが気持ち良くてとろけそうな猫が可愛い！,/watch?v=cMZrqfCQbLg,194,猫の兄妹ツナハム,110,4か月前,354,55
うちで踊ろう／星野源　飼い主のわがままに付き合う猫,/watch?v=AVAFA3CtAHo,197,猫の兄妹ツナハム,110,4か月前,354,56
ブラッシングが嫌すぎてしょんぼりしてしまった猫がかわいい。Cats who are not good at brushing,/watch?v=m6OxTBtXqA8,192,猫の兄妹ツナハム,110,4か月前,354,54
初めての納豆に猫はどんな反応をするのか？飼い主も予想外の反応が‥？！Cat eating natto for the first time,/watch?v=LIoMcFr6fHs,193,猫の兄妹ツナハム,110,4か月前,354,55
ご飯を焦らされている猫の姿がかわいい。The cat waiting for food is cute,/watch?v=w6-_SooGfBc,197,猫の兄妹ツナハム,110,4か月前,354,56
病気！？猫のお尻から血がたれて出てきたので‥病院へ連れて行きました。,/watch?v=B2UtxaQ4bzI,242,猫の兄妹ツナハム,110,4か月前,354,68
へそ天してごろごろする猫が可愛すぎる！2匹の猫がひたすらダラダラしちゃう。Cute cat relaxing,/watch?v=K0jC9m7mIs8,192,猫の兄妹ツナハム,110,4か月前,354,54
猫を飼う前に見てほしい【アパート暮らしで猫を飼うと部屋がこうなる】可能性があります。,/watch?v=MYYLIp9Va4U,6287,猫の兄妹ツナハム,110,4か月前,354,1776
ツンデレのギャップがかわいい猫　cat is all hot and cold on me.,/watch?v=soViGxWJer4,197,猫の兄妹ツナハム,110,4か月前,354,56
初めてミルクを飲む猫の反応は‥？興奮が抑えきれない！？Cat drinking milk for the first time. What kind of reaction?,/watch?v=SV4WWovXoSI,203,猫の兄妹ツナハム,110,4か月前,354,57
【簡単】猫にすんなり薬を飲ませる方法。嫌がる猫も飲めました！How to easily give a cat medicine,/watch?v=8b3f0lyeYjg,2397,猫の兄妹ツナハム,110,5か月前,354,677
猫のゴロゴロ音で免疫力アップ！？枕に横たわりゴロゴロするかわいい猫。,/watch?v=EArT5wiGzfo,201,猫の兄妹ツナハム,110,5か月前,354,57
嫌すぎて逃げ出す猫の目薬のさしかた。されるがままの猫が可愛い。Cat eye drops,/watch?v=RyG4JhmGlqc,1896,猫の兄妹ツナハム,110,5か月前,354,536
子ネコが家にやってきた！〜またまた問題発生！？〜　 Kitten came home Another problem occurred,/watch?v=D6szLJENI68,207,猫の兄妹ツナハム,110,5か月前,354,58
子ネコが家にやってきた！～初日からハプニング発生⁉︎～Kitten came home　Happening happens,/watch?v=78aYpj8O3lM,201,猫の兄妹ツナハム,110,5か月前,354,57
子ネコが家にやってきた！〜出会いからお迎え編〜　Kitten came home,/watch?v=_B4QTbPctvo,220,猫の兄妹ツナハム,110,5か月前,354,62
【猫おもちゃ】けりぐるみをプレゼントしてみたら‥予想外の反応が！Gifts for cats Kick toys What kind of reaction?,/watch?v=qOSjOmt9JFs,195,猫の兄妹ツナハム,110,5か月前,354,55
【睡眠・癒し・BGMなし】猫が眠りにつくまで。〜sleeping cat〜,/watch?v=xJY-Fvu4M8I,195,猫の兄妹ツナハム,110,5か月前,354,55
【睡眠・癒し・BGMあり】猫が眠りにつくまで。〜sleeping cat〜,/watch?v=AwIyogZCo9g,199,猫の兄妹ツナハム,110,5か月前,354,56
爪切りが嫌すぎてにらみつける猫。爪切り後とのギャップがすごい！【スコティッシュフォールド】,/watch?v=Ch03OAB7bpE,200,猫の兄妹ツナハム,110,5か月前,354,56
終始なんとも言えない表情で爪を切られる猫。【スコティッシュフォールド】,/watch?v=JnefPLvKWxg,195,猫の兄妹ツナハム,110,5か月前,354,55
猫おもちゃで一人遊びする猫をストーカーしてみた！,/watch?v=C5g35twNBi8,200,猫の兄妹ツナハム,110,5か月前,354,56
猫に大人気ちゅーるをあげてみたら食いつく様子がとんでもなくかわいい‥‥！！【スコティッシュフォールド】,/watch?v=_l5weohzMYs,201,猫の兄妹ツナハム,110,5か月前,354,57
【大興奮】初めてマグロを食べる反応が‥おもしろい猫！【スコティッシュフォールド】,/watch?v=6u0a0z0-UVw,201,猫の兄妹ツナハム,110,5か月前,354,57
ひたすらごろごろする猫が可愛すぎる！【スコティッシュフォールド】,/watch?v=wdk-Vbgzfq4,347,猫の兄妹ツナハム,110,6か月前,354,98
猫に自動で動くおもちゃを買ってみたら想像とは違う展開に！【スコティッシュフォールド】,/watch?v=G6soqDIjY68,201,猫の兄妹ツナハム,110,6か月前,354,57
飼い猫なのに野生の本能が丸出しになりました。【スコティッシュフォールド】,/watch?v=jD4Kf6JNX0w,209,猫の兄妹ツナハム,110,6か月前,354,59
眠たくてうとうとしちゃう猫。眠気と戦いおもしろい顔に・・・！【スコティッシュフォールド】,/watch?v=rzJz7XesQng,205,猫の兄妹ツナハム,110,6か月前,354,58
初のササミに大興奮して◯◯してしまったかわいい猫。 【スコティッシュフォールド】,/watch?v=n4VfiddvwZo,211,猫の兄妹ツナハム,110,6か月前,354,60
【初投稿】家族にお迎えした猫。新しいおもちゃに興奮が抑えきれない！？ 【スコティッシュフォールド】,/watch?v=D1X1vd3X4Vc,233,猫の兄妹ツナハム,110,6か月前,354,66
