title,url,view,channel_name,channel_subscriber,create_stamp,mean_view,mean_comparison
ASMR 소고기 미역국과 냉이무침 무생채 곤드레밥🍙 먹방 뀨엄마 mukbang eating sounds,/watch?v=-shuVe1_LTE,64,뀨엄마 KKYU MOM,66,5か月前,231,28
ASMR 예쁜 식용꽃🌺과 쭈꾸미🐙 먹방 뀨엄마 flower webfoot octopus mukbang eating sounds,/watch?v=y0v4mMa73Bw,90,뀨엄마 KKYU MOM,66,5か月前,231,39
ASMR 다이어트에 좋은 야콘과 제철 딸기 그리고 직접 캐서 튀긴 냉이튀김 먹방 뀨엄마 mukbang yacon strawberry eating sound,/watch?v=dg6-fb539s0,49,뀨엄마 KKYU MOM,66,5か月前,231,21
ASMR 바다포도와 낑깡 먹방 의외로 잘 어울리는 조합이었습니다 뀨엄마 sea grapes 海ぶどう eating sound mukbang,/watch?v=cKR59gTnMgY,92,뀨엄마 KKYU MOM,66,5か月前,231,40
ASMR mukbang 뀨엄마의 연어무쌈말이 먹방,/watch?v=7Rt8aLmPP-w,64,뀨엄마 KKYU MOM,66,6か月前,231,28
asmr 곤약으로 골뱅이파래곤약면무침 만들어먹었어여 뀨엄마 먹방 mukbang eating sounds eating shows realsounds,/watch?v=UdsfU0PzLTI,179,뀨엄마 KKYU MOM,66,10か月前,231,77
ASMR 달달한 멜론 먹방 뀨엄마 🍈 melons 瓜类 melonsM melonesM メロン mukbang eating shows eating sounds,/watch?v=znmiyEpMzj4,84,뀨엄마 KKYU MOM,66,11か月前,231,36
ASMR 복숭아 먹방 🍑 뀨엄마 peach mukbang EATING SOUNDS EATING SHOWS 咀嚼音もも 리얼사운드,/watch?v=0aIn0IofN90,286,뀨엄마 KKYU MOM,66,11か月前,231,124
ASMR 빼빼로 만들어 먹어봤어여 뀨엄마 먹방 🍫 pepero pocki mukbang eating sounds eating shows 리얼사운드,/watch?v=Jbnpvig9GTY,52,뀨엄마 KKYU MOM,66,11か月前,231,23
ASMR 찐 고구마와 열무김치 먹방 🌰 뀨엄마 sweet potato kimchi mukbang EATING SOUNDS EATING SHOWS 리얼사운드,/watch?v=80tWqab6rQY,278,뀨엄마 KKYU MOM,66,11か月前,231,120
생활asmr 뜨개질하는 소리🧶,/watch?v=9z9iAie7SPs,101,뀨엄마 KKYU MOM,66,11か月前,231,44
맛있는 단호박 찜🥧 먹방 뀨엄마 asmr sweet green pumpkin mukbang eaitng shows eating sounds,/watch?v=N4UeiIzAIGE,129,뀨엄마 KKYU MOM,66,11か月前,231,56
asmr Carbo buldak Rabokk 불닭볶음면 라볶이 먹어봤어여 뀨엄마 먹방 Eating Show Mukbang eating sounds,/watch?v=m5aHRL75ArY,125,뀨엄마 KKYU MOM,66,11か月前,231,54
asmr 사탕수수 껍질까는 소리 🌴 생활잡음 생활소음 칼질하는 소리,/watch?v=QMjaOhs5tdU,516,뀨엄마 KKYU MOM,66,11か月前,231,223
ASMR sugar cane 사탕수수 먹어봤어여 뀨엄마 먹방 🌴 eating sounds eating shows mukbang kkyu mom 咀嚼音 砂糖─,/watch?v=fGgEL2JcGSA,400,뀨엄마 KKYU MOM,66,11か月前,231,173
ASMR SEA GRAPES 바다포도랑 날치알 먹방 뀨엄마 咀嚼音海ぶどうeating sounds eating shows mukbang,/watch?v=QTLnjKKwWSw,1459,뀨엄마 KKYU MOM,66,11か月前,231,632
ASMR dragon fruit 용과 먹어봤어여 그맛은 마치... 뀨엄마 먹방 MUKBANG EATING SOUNDS EATING SHOWS 龍果,/watch?v=XDn_Mf0ntfo,100,뀨엄마 KKYU MOM,66,11か月前,231,43
ASMR Salmon Donburi 연어 덮밥 먹어봤어여 뀨엄마 먹방 리얼사운드 사케동 咀嚼音さけどんeating sounds eating shows mukbang,/watch?v=zF6cBmVQBrY,146,뀨엄마 KKYU MOM,66,11か月前,231,63
ASMR CELERY YAM MUKBANG 마와 샐러리 채소 먹방 뀨엄마 咀嚼音野菜 EATING SOUNDS EATING SHOWS 리얼사운드,/watch?v=Dv-jd9wCqww,122,뀨엄마 KKYU MOM,66,11か月前,231,53
ASMR Salmon Sushi 연어초밥 먹어봤어여 뀨엄마 먹방 EATING SOUNDS EATING SHOWS MUKBANG サーモン寿司,/watch?v=EkiKe14XLOM,279,뀨엄마 KKYU MOM,66,11か月前,231,121
ASMR SEAWEED EATING SOUND 세모가사리 해초 오이롤 먹어봤어여 뀨엄마 먹방 EATINGSHOW MUKBANG 리얼사운드 咀嚼音,/watch?v=5VjtcscKYzo,125,뀨엄마 KKYU MOM,66,11か月前,231,54
ASMR EDIBLE HAIR BRUSH 먹는 빗 과자 먹어봤어여 뀨엄마 먹방 MUKBANG EATING SOUND EATING SHOW 咀嚼音 食用ヘアブラシ,/watch?v=CtWa7gFXXAw,196,뀨엄마 KKYU MOM,66,11か月前,231,85
ASMR 상황극 롤플레잉 찜질방에 와서 백종원 냉라면을 먹었어여~ 뀨엄마 먹방 咀嚼音ラメーン eating sound eating show mukbang cold ramen,/watch?v=iAQP7M7lR9Q,81,뀨엄마 KKYU MOM,66,11か月前,231,35
ASMR 라이스 페이퍼 튀김과 말린 야채 먹방 바삭바삭 소리가 좋아여 뀨엄마 Eatingsound mukbang rice paper fried 咀嚼音 ライスペーパー,/watch?v=-8VhmmLrcng,91,뀨엄마 KKYU MOM,66,11か月前,231,39
ASMR Sea cucumber 해삼이랑 소라 먹방 뀨엄마 Eating sound mukbang realsound 咀嚼音海鼠と栄螺,/watch?v=J7sktf2iRmg,519,뀨엄마 KKYU MOM,66,11か月前,231,225
ASMR 뻥튀기 롱뻥 과자 먹어봤어여 바삭바삭 소리좋음 주의 Eating sound mukbang eating show 咀嚼音菓子,/watch?v=bNTRlpuSSZk,280,뀨엄마 KKYU MOM,66,11か月前,231,121
ASMR Rabbit apple & Aloe vera 알로에와 토끼들 먹방 뀨 엄마 咀嚼音　アロエ＆うさぎりんご Eating sound,/watch?v=XOFXIIVTCIE,78,뀨엄마 KKYU MOM,66,11か月前,231,34
ASMR Edible Dish Sponge mukbang 먹는 수세미 먹어봤어여 뀨맘 먹방 食用スポンジ 咀嚼音 MUKBANG EATING SOUNDS,/watch?v=6qzMoKpKMsw,120,뀨엄마 KKYU MOM,66,11か月前,231,52
재미없어하는 얼굴 뀨 엄마,/watch?v=WBs38JAP_0c,135,뀨엄마 KKYU MOM,66,1年前,231,58
ASMR Figs Eating sound mukbang 무화과 배터지게 먹었습니다~ 당분간은 생각 안 날거같아요 咀嚼音 いちじく,/watch?v=mTDZaJHwYcM,119,뀨엄마 KKYU MOM,66,1年前,231,52
SEA GRAPES ASMR 바다포도 먹어봤어여 캔디 엄마 咀嚼音 海ぶどう,/watch?v=IQeGOJAAgzc,815,뀨엄마 KKYU MOM,66,1年前,231,353
