title,url,view,channel_name,channel_subscriber,create_stamp,mean_view,mean_comparison
ASMR MELON CAKE DESSERTS MELON JELLY BREAD MUKBANG 咀嚼音 モッパン ケーキ メロン ゼリー デザートkue เค้ก EATING SOUNDS,/watch?v=AtVCIfsNTyg,23676,Jimmy ASMR,1030000,17時間前,656751,4
ASMR WATERMELON DESSERTS WATERMELON JELLY ICE CREAM COOKIE MUKBANG 咀嚼音 モッパン スイカアイスクリーム EATING SOUNDS,/watch?v=oc-pjqyx3ww,39839,Jimmy ASMR,1030000,1日前,656751,6
ASMR YELLOW FOOD CHEESE CAKE ICE CREAM HONEYCOMB MUKBANG 먹방 咀嚼音 モッパン アイスクリーム Es krim EATING SOUNDS,/watch?v=4-F624e-KBQ,51978,Jimmy ASMR,1030000,2日前,656751,8
ASMR SPICY BLACK BEAN NOODLES CHICKEN CHEESE BALLS COOKING MUKBANG 먹방 ラーメン チキン 咀嚼音 モッパンEATING SOUNDS,/watch?v=4Lqf7lDVQ14,71487,Jimmy ASMR,1030000,3日前,656751,11
ASMR MALTESERS MAGNUM HAAGEN-DAZS CHOCOLATE ICE CREAM MUKBANG モッパン 咀嚼音 チョコレートアイスクリーム EATING SOUNDS,/watch?v=3bDo_TudHUE,213678,Jimmy ASMR,1030000,4日前,656751,33
ASMR SPICY FIRE NOODLES SWEET FRIED CHICKEN MUKBANG 먹방 カルボプルダックポックンミョン チキン 咀嚼音 モッパン EATING SOUNDS,/watch?v=-isnvp4PC2g,66986,Jimmy ASMR,1030000,5日前,656751,10
ASMR BLUE FOODS CRYSTAL JELLY MACARON NERDS ROPE ROCK CANDY GUMMY 먹방 ゼリー デザート 咀嚼音 モッパン EATING SOUNDS,/watch?v=5s1urKtdTQc,66045,Jimmy ASMR,1030000,6日前,656751,10
ASMR MALTESERS MAGNUM CHOCOLATE ICE CREAM DESSERT MUKBANG 먹방モッパン 咀嚼音 チョコレートアイスクリーム デザートEATING SOUNDS,/watch?v=ojhpUpQt-NM,312632,Jimmy ASMR,1030000,1週間前,656751,48
ASMR PINK FOODS PINK JELLY MAGNUM CHOCOLATE ICE CREAM MACARON MUKBANG 먹방アイスクリーム ゼリー 咀嚼音EATING SOUNDS,/watch?v=QNLLIil6Nd8,71056,Jimmy ASMR,1030000,1週間前,656751,11
ASMR RAINBOW ICE CREAM PARTY MANGO MAGNUM CHOCOLATE DESSERT MUKBANG아이스크림 먹방 アイスクリーム 咀嚼音EATING SOUNDS,/watch?v=cQ0TZtknwxE,81294,Jimmy ASMR,1030000,1週間前,656751,12
ASMR TRIPLE CHEESEBURGERS MCDONALD'S CHICKEN MUKBANG 치즈버거 치킨 먹방 マクドナルド チーズバーガー チキン 咀嚼音 EATING SOUNDS,/watch?v=xf4Ev_QlmKg,176652,Jimmy ASMR,1030000,1週間前,656751,27
ASMR MAGNUM CHOCOLATE ICE CREAM PARTY DESSERT MUKBANG 매그넘 초콜릿 아이스크림 먹방 チョコレート デザート 咀嚼音 EATING SOUNDS,/watch?v=CcIal-YQZzU,460556,Jimmy ASMR,1030000,1週間前,656751,70
ASMR GAINT KISSES MAGNUM CHOCOLATE ICE CREAM PARTY MUKBANG 키세스 초콜릿 아이스크림 먹방 チョコレート咀嚼音 EATING SOUNDS,/watch?v=PCBPC45N9Fw,286481,Jimmy ASMR,1030000,1週間前,656751,44
ASMR STEAK CHEESY PASTA SPAGHETTI CARBONARA CHEESE FONDUE MUKBANG 까르보나라 먹방 咀嚼音 スパゲッティ EATING SOUNDS,/watch?v=gW7Zbssx12A,93601,Jimmy ASMR,1030000,1週間前,656751,14
ASMR MAGNUM CHOCOLATE ICE CREAM PARTY DESSERT MUKBANG 매그넘 초콜릿 아이스크림 파티 먹방 チョコレート 咀嚼音 EATING SOUNDS,/watch?v=IZLzgovcv8s,215601,Jimmy ASMR,1030000,2週間前,656751,33
ASMR CHOCOLATE ICE CREAM CAKE PARTY DESSERT MUKBANG 초콜릿 아이스크림 디저트 먹방 咀嚼音 チョコレート アイスクリームEATING SOUNDS,/watch?v=Y4hwmcJ4rig,317405,Jimmy ASMR,1030000,2週間前,656751,48
ASMR JELLY NOODLES RAINBOW CREPE CAKE JELLO DESSERT MUKBANG 젤리 국수 케이크 먹방 ゼリー ケーキ  咀嚼音 EATING SOUNDS,/watch?v=AI0QRUtghRA,249390,Jimmy ASMR,1030000,2週間前,656751,38
ASMR MALTESERS MAGNUM CHOCOLATE ICE CREAM CAKE DESSERT MUKBANG 초콜릿 디저트 먹방咀嚼音 チョコレー デザートEATING SOUNDS,/watch?v=Pt1KEzB5LK0,784810,Jimmy ASMR,1030000,2週間前,656751,119
ASMR SPICY TTEOKBOKKI MOZZARELLA CHEESE BBQ CHICKEN MUKBANG 응급실 떡볶이 치즈추가 치킨 먹방トッポッキ 咀嚼音EATING SOUNDS,/watch?v=WuB3NF_tiTw,126432,Jimmy ASMR,1030000,2週間前,656751,19
ASMR MALTESERS MAGNUM CHOCOLATE ICE CREAM DESSERT MUKBANG 몰티져스 매그넘 초콜릿 아이스크림 먹방咀嚼音チョコレーEATING SOUNDS,/watch?v=wx-en1wZJd8,304130,Jimmy ASMR,1030000,2週間前,656751,46
ASMR MALTESERS MAGNUM CHOCOLATE ICE CREAM DESSERT MUKBANG 몰티져스 허쉬 초콜릿 아이스크림 먹방咀嚼音 チョコレーEATING SOUNDS,/watch?v=AM_7di9arWY,196626,Jimmy ASMR,1030000,2週間前,656751,30
ASMR FRIED CHICKEN FIRE NOODLES HASH BROWNS COOKING MUKBANG 뿌링클 치킨 치즈볼 먹방 チキン 咀嚼音 モッパン EATING SOUNDS,/watch?v=QVrl06-QjWY,148516,Jimmy ASMR,1030000,3週間前,656751,23
ASMR MALTESERS MAGNUM CHOCOLATE ICE CREAM DESSERT MUKBANG 몰티져스 매그넘 초콜릿아이스크림 먹방咀嚼音 チョコレーEATING SOUNDS,/watch?v=pXIjouHwmAw,546485,Jimmy ASMR,1030000,3週間前,656751,83
ASMR CHOCOLATE CAKE MAGNUM ICE CREAM DESSERT MUKBANG 초콜릿 케이크 매그넘 디저트 먹방 咀嚼音 チョコレー デザート EATING SOUNDS,/watch?v=e4a-qu64RWQ,188655,Jimmy ASMR,1030000,3週間前,656751,29
ASMR SAUSAGE PIZZA SPICY FIRE NOODLES BURGER KING MUKBANG 소세지 피자 불닭볶음면 먹방 ピザ 咀嚼音 モッパン EATING SOUNDS,/watch?v=OT8Qe0bnYUc,121032,Jimmy ASMR,1030000,3週間前,656751,18
ASMR MALTESERS MAGNUM CHOCOLATE ICE CREAM CAKE DESSERT MUKBANG 몰티져스 초콜릿 디저트 먹방咀嚼音 チョコレーEATING SOUNDS,/watch?v=gdfGSLEsbTY,239068,Jimmy ASMR,1030000,3週間前,656751,36
ASMR MAGNUM CHOCOLATE ICE CREAM PARTY DESSERT MUKBANG 매그넘 초콜릿 아이스크림 파티 먹방 チョコレート 咀嚼音 EATING SOUNDS,/watch?v=O9utOFEUOho,1271783,Jimmy ASMR,1030000,3週間前,656751,194
ASMR KIELBASA SAUSAGE FIRE NOODLES SPAM MUKBANG 킬바사 소세지 불닭볶음면 먹방 プルダックポックンミョン 咀嚼音 モッパン EATING SOUNDS,/watch?v=vDRdQDnXGH8,77462,Jimmy ASMR,1030000,3週間前,656751,12
ASMR MALTESERS MAGNUM CHOCOLATE ICE CREAM OREO DESSERT MUKBANG 몰티져스 초콜릿 디저트 먹방咀嚼音 チョコレーEATING SOUNDS,/watch?v=nP_gWvogspg,207539,Jimmy ASMR,1030000,4週間前,656751,32
ASMR MALTESERS MAGNUM CHOCOLATE ICE CREAM DESSERT MUKBANG 몰티져스 초콜릿 아이스크림 먹방 チョコレート 咀嚼音 EATING SOUNDS,/watch?v=nh87VTzUSeg,410028,Jimmy ASMR,1030000,4週間前,656751,62
"ASMR 14,444 SHU SPICY THE DEVIL OF FIRE NOODLE COOKING MUKBANG 불마왕라면 먹방辛いラーメン 咀嚼音 モッパン EATING SOUNDS",/watch?v=HjbNamlSlr4,75435,Jimmy ASMR,1030000,4週間前,656751,11
ASMR MALTESERS MAGNUM CHOCOLATE CAKE ICE CREAM DESSERT MUKBANG 몰티져스 초콜릿 디저트 먹방咀嚼音 チョコレーEATING SOUNDS,/watch?v=GdXzD-AJyic,324400,Jimmy ASMR,1030000,1か月前,656751,49
ASMR SAUSAGE PIZZA HOT CHEETOS CARBO FIRE NOODLES CHICKEN MUKBANG 소세지 피자 먹방ピザ 咀嚼音 モッパンEATING SOUNDS,/watch?v=w8WDAZEQh4k,462759,Jimmy ASMR,1030000,1か月前,656751,70
ASMR EDIBLE LIPSTICKS MALTESERS CHOCOLATE ICE CREAM MUKBANG 먹는 립스틱 초콜릿 먹방モッパン 咀嚼音 チョコレーEATING SOUNDS,/watch?v=dhFgusy71cI,271864,Jimmy ASMR,1030000,1か月前,656751,41
ASMR MALTESERS MAGNUM CHOCOLATE ICE CREAM DESSERT MUKBANG 몰티져스 초콜릿 디저트 먹방モッパン 咀嚼音 チョコレーEATING SOUNDS,/watch?v=nyKqK9H-ktc,181877,Jimmy ASMR,1030000,1か月前,656751,28
ASMR SAUSAGE CHEESE PIZZA SPICY FIRE NOODLES MUKBANG피자 불닭볶음면 먹방ピザ プルダックポックンミョン 咀嚼音 モッパンEATING SOUNDS,/watch?v=a-yX8zdJuAo,126348,Jimmy ASMR,1030000,1か月前,656751,19
ASMR MALTESERS MAGNUM CHOCOLATE ICE CREAM DESSERT MUKBANG 몰티져스 초콜릿 디저트 먹방モッパン 咀嚼音 チョコレーEATING SOUNDS,/watch?v=ICQmQByy5JY,529768,Jimmy ASMR,1030000,1か月前,656751,81
ASMR MAGNUM CHOCOLATE ICE CREAM DESSERT MUKBANG 매그넘 초콜릿 아이스크림 먹방モッパン 咀嚼音 チョコレートEs krim EATING SOUNDS,/watch?v=X0xeD97uNms,366255,Jimmy ASMR,1030000,1か月前,656751,56
ASMR TRIPLE CHEESEBURGERS MCDONALDS CHICKEN HASH BROWNS  MUKBANG 치즈버거 맥도날드 먹방マクドナルド 咀嚼音EATING SOUNDS,/watch?v=0Y0Q99EoShg,259603,Jimmy ASMR,1030000,1か月前,656751,40
ASMR CHOCOLATE MALTESERS MAGNUM ICE CREAM DESSERT MUKBANG 몰티져스 초콜릿 아이스크림 먹방 チョコレート 咀嚼音 EATING SOUNDS,/watch?v=I-Ok416BJIo,223589,Jimmy ASMR,1030000,1か月前,656751,34
ASMR GHOST PEPPER NOODLES vs SPICY FIRE NOODLES MUKBANG 고스트페퍼 라면 불닭볶음면 먹방 ゴーストペッパー 咀嚼音 EATING SOUNDS,/watch?v=5Os2SDwx_s4,179442,Jimmy ASMR,1030000,1か月前,656751,27
ASMR MALTESERS MAGNUM CHOCOLATE ICE CREAM DESSERT MUKBANG 몰티져스 초콜릿 디저트 먹방 チョコレート 咀嚼音 EATING SOUNDS,/watch?v=DTZyNEr1p44,247439,Jimmy ASMR,1030000,1か月前,656751,38
ASMR CARBO FIRE CHICKEN NOODLES CHEESE CUTLET MUKBANG 까르보불닭볶음면 먹방 プルダックポックンミョン チキン 咀嚼音 EATING SOUNDS,/watch?v=_jlethAMV8s,146606,Jimmy ASMR,1030000,1か月前,656751,22
ASMR MALTESERS MAGNUM CHOCOLATE ICE CREAM DESSERT MUKBANG 몰티져스 초콜릿 아이스크림 먹방 チョコレート 咀嚼音 EATING SOUNDS,/watch?v=DfuFNBuMdSk,563677,Jimmy ASMR,1030000,1か月前,656751,86
ASMR HOT CHEETOS GAINT SAUSAGE CHEESY CORN DOGS MUKBANG 대왕 소세지 먹방 ソーセージ チーズ 咀嚼音 Sosis EATING SOUNDS,/watch?v=hjxnR5H77to,256150,Jimmy ASMR,1030000,1か月前,656751,39
ASMR MALTESERS MAGNUM CHOCOLATE ICE CREAM DESSERT MUKBANG 몰티져스 초콜릿 아이스크림 먹방 チョコレート 咀嚼音 EATING SOUNDS,/watch?v=khsL02AcWY4,399520,Jimmy ASMR,1030000,1か月前,656751,61
ASMR GIANT SAUSAGE CHEESE STICKS COOKING MUKBANG 대왕 소세지 치즈스틱 먹방 咀嚼音 モッパン 大食い チーズ ソーセージ Sosis SOUNDS,/watch?v=gmIl4szxywo,145488,Jimmy ASMR,1030000,1か月前,656751,22
ASMR MALTESERS MAGNUM CHOCOLATE ICE CREAM PARTY MUKBANG 몰티져스 초콜릿 아이스크림 먹방 咀嚼音 チョコアイス EATING SOUNDS,/watch?v=zXNQSUXsziw,534376,Jimmy ASMR,1030000,1か月前,656751,81
ASMR SPICY PEPPER BLACK BEAN NOODLES JAJANGMYEON SPAM MUKBANG 고추짜장 스팸 먹방 辛い ジャージャー麺 咀嚼音EATING SOUNDS,/watch?v=z-uf1AMIZkA,96364,Jimmy ASMR,1030000,1か月前,656751,15
ASMR MALTESERS MAGNUM CHOCOLATE ICE CREAM DESSERT MUKBANG 몰티져스 초콜릿 아이스크림 먹방 チョコレート 咀嚼音 EATING SOUNDS,/watch?v=KQ5fdKs_lsA,633805,Jimmy ASMR,1030000,1か月前,656751,97
ASMR TRIPLE CHEESEBURGERS MCDONALDS HASH BROWNS MUKBANG 트리플 치즈버거 먹방 トリプルチーズバーガー 咀嚼音 EATING SOUNDS,/watch?v=cij-gDvdhZw,195440,Jimmy ASMR,1030000,1か月前,656751,30
ASMR MALTESERS S'MORES DIP MAGNUM CHOCOLATE ICE CREAM DESSERT MUKBANG 초콜릿 먹방 チョコレート 咀嚼音EATING SOUNDS,/watch?v=dUAEnkqo_us,408834,Jimmy ASMR,1030000,1か月前,656751,62
ASMR GHOST PEPPER NOODLES vs SILBI KIMCHI SAUSAGE MUKBANG 고스트페퍼 실비김치ゴーストペッパー 辛いキムチ 咀嚼音 EATING SOUNDS,/watch?v=AI418KXhfIs,182755,Jimmy ASMR,1030000,1か月前,656751,28
ASMR MALTESERS MAGNUM CHOCOLATE ICE CREAM DESSERT MUKBANG 몰티져스 초콜릿 아이스크림 먹방 チョコレート 咀嚼音 EATING SOUNDS,/watch?v=a-yVqk79qiM,668353,Jimmy ASMR,1030000,1か月前,656751,102
ASMR GIANT SAUSAGE CHEESY COOKING MUKBANG 대왕 소세지 먹방 咀嚼音 モッパン 大食い チーズ ソーセージ Sosis keju EATING SOUNDS,/watch?v=HddYKSU8jtM,105665,Jimmy ASMR,1030000,1か月前,656751,16
ASMR MALTESERS MAGNUM HAAGEN-DAZS CHOCOLATE ICE CREAM DESSERT MUKBANG아이스크림 먹방チョコレート 咀嚼音EATING SOUNDS,/watch?v=FfkwOVY15-Y,320632,Jimmy ASMR,1030000,1か月前,656751,49
ASMR SPICY SILBI KIMCHI SPAM COOKING MUKBANG 매운 실비김치 스팸 먹방 辛いキムチ スパム 咀嚼音 モッパン 大食い 泡菜 EATING SOUNDS,/watch?v=pVgfL8hQWxs,73290,Jimmy ASMR,1030000,1か月前,656751,11
ASMR MALTESERS MAGNUM CHOCOLATE ICE CREAM DESSERT MUKBANG 몰티져스 초콜릿 아이스크림 먹방 チョコレート 咀嚼音 EATING SOUNDS,/watch?v=Zm-OK_eP5DM,1559433,Jimmy ASMR,1030000,1か月前,656751,237
ASMR MOST POPULAR SPICY CUP NOODLES RAMEN SAUSAGE MUKBANG 신라면 소세지辛ラーメン ソーセージ 咀嚼音 Sosis EATING SOUNDS,/watch?v=0VPFZ3s2Jvw,79692,Jimmy ASMR,1030000,1か月前,656751,12
ASMR MALTESERS MAGNUM CHOCOLATE ICE CREAM DESSERT MUKBANG 몰티져스 초콜릿 아이스크림 먹방 チョコレート 咀嚼音 EATING SOUNDS,/watch?v=PLksr13gqnQ,3948636,Jimmy ASMR,1030000,1か月前,656751,601
ASMR HOT CHEETOS SAUSAGE SPAM CHEESY COOKING MUKBANG 치토스 소세지 스팸 먹방 スパム ソーセージ Sosis 咀嚼音 EATING SOUNDS,/watch?v=vYztYiKfXh8,163698,Jimmy ASMR,1030000,1か月前,656751,25
ASMR MALTESERS MAGNUM NATUUR CHOCOLATE ICE CREAM DESSERT MUKBANG 초콜릿 아이스크림 먹방 チョコレート咀嚼音EATING SOUNDS,/watch?v=JRiUBK3xvPU,289996,Jimmy ASMR,1030000,2か月前,656751,44
ASMR 2X GIANT KIELBASA SAUSAGE FIRE NOODLES MUKBANG 대왕 킬바사 소세지 불닭볶음면 咀嚼音 ソーセージ Sosis EATING SOUNDS,/watch?v=SLyUN32-wPA,121063,Jimmy ASMR,1030000,2か月前,656751,18
ASMR MALTESERS MAGNUM CHOCOLATE ICE CREAM DESSERT MUKBANG 몰티져스 초콜릿 아이스크림 먹방 チョコレート 咀嚼音 EATING SOUNDS,/watch?v=aYeBTTaxVvI,170848,Jimmy ASMR,1030000,2か月前,656751,26
ASMR SAUSAGE SPAM CHEESY MUKBANG COOKING 대왕 소세지 먹방 치즈소스 スパム ソーセージ チーズ 咀嚼音 モッパン Sosis EATING SOUNDS,/watch?v=EWrc14pkEEY,209855,Jimmy ASMR,1030000,2か月前,656751,32
ASMR MALTESERS MAGNUM CHOCOLATE ICE CREAM DESSERT MUKBANG 몰티져스 초콜릿 아이스크림 먹방 チョコレート 咀嚼音 EATING SOUNDS,/watch?v=Uy6BcbhJN0g,211894,Jimmy ASMR,1030000,2か月前,656751,32
ASMR SPICY BLACK BEAN NOODLES VAMPIRE CHICKEN MUKBANG 진진짜라 뱀파이어 치킨 먹방 チキン ラーメン 咀嚼音 モッパンEATING SOUNDS,/watch?v=sInSEFm68K0,135215,Jimmy ASMR,1030000,2か月前,656751,21
ASMR MALTESERS MAGNUM CHOCOLATE ICE CREAM DESSERT MUKBANG 몰티져스 초콜릿 아이스크림 먹방 チョコレート 咀嚼音 EATING SOUNDS,/watch?v=mC5Gtzbc7DA,720400,Jimmy ASMR,1030000,2か月前,656751,110
ASMR SPICY TTEOKBOKKI MOZZARELLA CHEESE FRIED MUKBANG 응급실떡볶이 치즈 먹방 トッポッキ チーズ 咀嚼音 モッパン EATING SOUNDS,/watch?v=ndDNKjoEWNY,291082,Jimmy ASMR,1030000,2か月前,656751,44
ASMR MALTESERS MAGNUM CHOCOLATE ICE CREAM DESSERT MUKBANG 몰티져스 초콜릿 아이스크림 먹방 チョコレート 咀嚼音 EATING SOUNDS,/watch?v=X3iHpZ700Xo,847920,Jimmy ASMR,1030000,2か月前,656751,129
ASMR BLACK BEAN NOODLES SWEET FRIED CHICKEN COOKING MUKBANG 짜파게티 양념 치킨 먹방 チキン ラーメン 咀嚼音 EATING SOUNDS,/watch?v=wNn_gGGxc7w,74153,Jimmy ASMR,1030000,2か月前,656751,11
ASMR MAGNUM CHOCOLATE ICE CREAM DESSERT MUKBANG 초콜릿 아이스크림 먹방 チョコレートアイスクリーム 咀嚼音 Es krim EATING SOUNDS,/watch?v=Zjb-QVqpreg,163802,Jimmy ASMR,1030000,2か月前,656751,25
ASMR SAUSAGE CHEESY PARTY MUKBANG COOKING 대왕소세지 먹방 치즈소스ソーセージ 咀嚼音 モッパン Sosis NO TALKING EATING SOUNDS,/watch?v=qAeCaQ7U5aY,417693,Jimmy ASMR,1030000,2か月前,656751,64
ASMR MALTESERS MAGNUM CHOCOLATE ICE CREAM DESSERT MUKBANG 몰티져스 초콜릿 아이스크림 먹방 チョコレート 咀嚼音 EATING SOUNDS,/watch?v=xK9jeCD6ig0,5418437,Jimmy ASMR,1030000,2か月前,656751,825
ASMR CHEESE KIELBASA SAUSAGE COOKING MUKBANG 치즈 퐁듀 킬바사 소세지 咀嚼音 チーズ ソーセージ 香肠 Sosis keju EATING SOUNDS,/watch?v=DsGUt58vGSE,468059,Jimmy ASMR,1030000,2か月前,656751,71
ASMR MAGNUM LIPS CHOCOLATE ICE CREAM DESSERT MUKBANG 매그넘 초콜릿 아이스크림 먹방 チョコレート咀嚼音Es krim EATING SOUNDS,/watch?v=c7Q58BUNzWA,78424,Jimmy ASMR,1030000,2か月前,656751,12
ASMR SPICY CREAMY CHEESE NOODLES KIELBASA SAUSAGE MUKBANG 크림진짬뽕 킬바사 소세지 ソーセージ 咀嚼音Sosis EATING SOUNDS,/watch?v=BuXcyR5jXd0,363314,Jimmy ASMR,1030000,2か月前,656751,55
ASMR MALTESERS MAGNUM CHOCOLATE ICE CREAM DESSERT MUKBANG 몰티져스 매그넘 초콜릿 아이스크림 먹방 チョコレート EATING SOUNDS,/watch?v=47svN0S1qE0,528412,Jimmy ASMR,1030000,2か月前,656751,80
ASMR MUKBANG 까르보불닭볶음면 자메이카 통다리 치킨 SPICY FIRE NOODLES BBQ CHICKEN 辛いラーメン 辛いチキン 咀嚼音 ayam EATING SOUNDS,/watch?v=vJn8HJFUA_o,240200,Jimmy ASMR,1030000,2か月前,656751,37
ASMR MAGNUM CHOCOLATE ICE CREAM DESSERT MUKBANG 매그넘 초콜릿 아이스크림 디저트 먹방 アイスクリーム Es krim EATING SOUNDS,/watch?v=7PBXi5Ay5xo,255342,Jimmy ASMR,1030000,2か月前,656751,39
ASMR CHEESY CREAM PASTA SPAGHETTI CARBONARA MUKBANG モッパン 咀嚼音 チーズスパゲッティ 치즈 크림파스타 먹방Keju EATING SOUNDS,/watch?v=NnWUNPtYSu4,140800,Jimmy ASMR,1030000,2か月前,656751,21
ASMR MALTESERS MAGNUM CHOCOLATE ICE CREAM CAKE MUKBANG 咀嚼音チョコレートケーキ Cokelat 몰티져스 초콜릿 먹방EATING SOUNDS,/watch?v=s2BhyKnj3u4,2208515,Jimmy ASMR,1030000,2か月前,656751,336
ASMR SPICY FIRE NOODLES BLACK BEAN NOODLES MUKBANG 咀嚼音 プルダックポックンミョンチャパゲティ불닭볶음면 짜파게티 먹방 EATING SOUNDS,/watch?v=BcR1Z_yY5ks,109985,Jimmy ASMR,1030000,2か月前,656751,17
ASMR MAGNUM CHOCOLATE ICE CREAM PARTY MUKBANG 매그넘 초콜릿 아이스크림 먹방 モッパン 咀嚼音 チョコアイス Es krim EATING SOUNDS,/watch?v=0Ytbzlio9N0,4836719,Jimmy ASMR,1030000,2か月前,656751,736
ASMR MOZZARELLA CHEESY CORN DOGS MUKBANG 명랑핫도그 모짜렐라치즈 먹방モッパン モッツァレラチーズホットドッグ 咀嚼音 Keju EATING SOUNDS,/watch?v=6O71ZqdpMJQ,114474,Jimmy ASMR,1030000,2か月前,656751,17
ASMR MAGNUM CHOCOLATE ICE CREAM DESSERT MUKBANG 매그넘 초콜릿 아이스크림 먹방モッパン チョコアイス 咀嚼音Es krim EATING SOUNDS,/watch?v=6qOnL_f-4Y8,86162,Jimmy ASMR,1030000,2か月前,656751,13
ASMR MUKBANG 치토스 킬바사 소세지 핫도그 먹방 CHEETOS KIELBASA SAUSAGE HOT DOG モッパン チトス ソーセージ ホットドッグ EATING SOUNDS,/watch?v=4rIXoaBrL5U,99133,Jimmy ASMR,1030000,2か月前,656751,15
ASMR MAGNUM MALTESERS CHOCOLATE ICE CREAM MUKBANG モッパン チョコアイス 咀嚼音 몰티져스 매그넘 초콜릿 아이스크림 먹방EATING SOUNDS,/watch?v=FuqPRBi39EY,1228592,Jimmy ASMR,1030000,2か月前,656751,187
ASMR MOZZARELLA FIRE NOODLES CHEESY COOKING MUKBANG モッパン 咀嚼音 チーズ プルダックポックンミョン 불닭볶음면 먹방 EATING SOUNDS,/watch?v=sKbf_1c5Hrg,242271,Jimmy ASMR,1030000,2か月前,656751,37
ASMR MAGNUM CHOCOLATE ICE CREAM DESSERT MUKBANG 咀嚼音 チョコレートアイスクリーム 매그넘 초콜릿 먹방 Es krim EATING SOUNDS,/watch?v=lXVf0D23LLA,1615650,Jimmy ASMR,1030000,2か月前,656751,246
ASMR HOT CHEETOS BBQ FRIED CHICKEN MUKBANG 咀嚼音 フライドチキン チートス 大食い 치토스 치킨 황금올리브 닭다리 먹방 鸡 EATING SOUNDS,/watch?v=H-ubOv338Bw,109691,Jimmy ASMR,1030000,2か月前,656751,17
ASMR MALTESERS MAGNUM CHOCOLATE ICE CREAM MUKBANG 咀嚼音 チョコレートアイスクリーム 몰티져스 초콜릿 먹방Es krim EATING SOUNDS,/watch?v=c9_2Y9NBvrE,1804236,Jimmy ASMR,1030000,2か月前,656751,275
ASMR HOT CHEETOS CHEESE BALLS FRIED MUKBANG 咀嚼音 大食い  チートス チーズボール 뿌링치즈볼 치토스 먹방bola keju EATING SOUNDS,/watch?v=M5rBo9aKORE,69344,Jimmy ASMR,1030000,3か月前,656751,11
ASMR CHOCOLATE ICE CREAM MUKBANG 咀嚼音 大食い チョコレート アイスクリーム 초콜릿 아이스크림 먹방Es krim NO TALKING EATING SOUNDS,/watch?v=r1a90JROIp4,812325,Jimmy ASMR,1030000,3か月前,656751,124
ASMR CHEESEBURGER ONION RINGS FRIES MUKBANG 咀嚼音 大食い チーズバーガー オニオンリング フライドポテト치즈버거 어니언링 먹방EATING SOUNDS,/watch?v=cHCqts9vLP8,56263,Jimmy ASMR,1030000,3か月前,656751,9
ASMR OREO MAGNUM CHOCOLATE ICE CREAM MUKBANG 咀嚼音 大食い チョコレート アイスクリーム オレオ 초콜릿 먹방 Cokelat EATING SOUNDS,/watch?v=h06i0gWvAyw,447193,Jimmy ASMR,1030000,3か月前,656751,68
ASMR HOT CHEETOS CHICKEN CHEESEBURGER HASH BROWNS MUKBANG 咀嚼音 大食い チートス チキン チーズバーガー 치킨먹방EATING SOUNDS,/watch?v=8ORs8OxI4JI,114958,Jimmy ASMR,1030000,3か月前,656751,18
ASMR MAGNUM CHOCOLATE ICE CREAM DESSERT MUKBANG 咀嚼音 チョコレートアイスクリーム デザート 아이스크림 먹방Es krim EATING SOUNDS,/watch?v=T1McWvBF7bc,1719313,Jimmy ASMR,1030000,3か月前,656751,262
ASMR MOST POPULAR FOOD KFC CHEESEBURGER FRIED CHICKEN MUKBANG 咀嚼音 チキン チーズハンバーグ 햄버거 먹방 EATING SOUNDS,/watch?v=A7A2lFsII2c,90750,Jimmy ASMR,1030000,3か月前,656751,14
ASMR MAGNUM CHOCOLATE ICE CREAM S'MORES DIP MUKBANG 咀嚼音 チョコレート アイスクリーム ヌテラ 초콜릿 스모어딥 먹방 EATING SOUNDS,/watch?v=2yJWOr2bVKg,171363,Jimmy ASMR,1030000,3か月前,656751,26
ASMR HOT CHEETOS SPAM SAUSAGE CORN DOG CHEESY MUKBANG 咀嚼音 スパム ソーセージ チートス チーズ 스팸 핫도그 먹방 EATING SOUNDS,/watch?v=aeHappO-QOA,188199,Jimmy ASMR,1030000,3か月前,656751,29
ASMR MALTESERS MAGNUM HAAGEN-DAZS CHOCOLATE ICE CREAM MUKBANG 咀嚼音アイスクリーム 초콜릿 먹방Es krim EATING SOUNDS,/watch?v=gZ0eaUHsT4w,851174,Jimmy ASMR,1030000,3か月前,656751,130
ASMR HOT CHEETOS CHEESEBURGER HASH BROWNS MUKBANG チートス チーズ ハンバーガー ハッシュブラウン 咀嚼音 치즈버거 먹방 EATING SOUNDS,/watch?v=GadQpxfiIL0,83959,Jimmy ASMR,1030000,3か月前,656751,13
ASMR MALTESERS MAGNUM CHOCOLATE ICE CREAM MUKBANG チョコレートアイスクリーム 咀嚼音 몰티져스 초콜릿 먹방Es krim EATING SOUNDS,/watch?v=nMf6kPTIkoQ,372599,Jimmy ASMR,1030000,3か月前,656751,57
ASMR SPICY FIRE NOODLES CHEESY PIZZA SAUSAGE MUKBANG チーズピザプルダックソーセージ 咀嚼音 불닭볶음면 치즈피자 먹방 EATING SOUNDS,/watch?v=11n6jN8dcaY,124864,Jimmy ASMR,1030000,3か月前,656751,19
ASMR MAGNUM CHOCOLATE ICE CREAM DESSERT MUKBANG チョコレートアイスクリーム デザート 咀嚼音 아이스크림 먹방Es krim EATING SOUNDS,/watch?v=XlcXNEOM5Zw,863171,Jimmy ASMR,1030000,3か月前,656751,131
ASMR CHEESEBURGERS HASH BROWNS FRIES CHICKEN MUKBANG チーズ ハンバーガー ハッシュブラウン 咀嚼音 치즈버거 먹방 EATING SOUNDS,/watch?v=snZK8K33UIQ,52771,Jimmy ASMR,1030000,3か月前,656751,8
ASMR MAGNUM MALTESERS CHOCOLATE ICE CREAM MUKBANG チョコレートアイスクリーム咀嚼音 몰티져스 초콜릿 먹방Cokelat EATING SOUNDS,/watch?v=xnJZgjcIU3U,2428622,Jimmy ASMR,1030000,3か月前,656751,370
ASMR CHEESY CARBONARA FIRE NOODLES KIELBASA SAUSAGE MUKBANG チーズプルダック 咀嚼音 불닭볶음면 먹방Sosis EATING SOUNDS,/watch?v=iTz1q-fC65k,772779,Jimmy ASMR,1030000,3か月前,656751,118
ASMR MAGNUM CHOCOLATE  ICE CREAM MUKBANG マグナム チョコレート アイスクリーム デザート咀嚼音 초콜릿 먹방 Cokelat EATING SOUNDS,/watch?v=D-vqaT01MfY,175727,Jimmy ASMR,1030000,3か月前,656751,27
ASMR KIELBASA SAUSAGE CHEESY COOKING MUKBANG キルバサソーセージチーズソース モッパン 咀嚼音 킬바사 소세지 먹방 Sosis EATING SOUNDS,/watch?v=KqnNn8DA90Q,407643,Jimmy ASMR,1030000,3か月前,656751,62
ASMR MAGNUM CHOCOLATE ICE CREAM MUKBANG マグナム チョコレート アイスクリーム デザート 咀嚼音 아이스크림 먹방 Es krim EATING SOUNDS,/watch?v=YkzGdDDD-Y0,201857,Jimmy ASMR,1030000,3か月前,656751,31
ASMR SPICY BLACK BEAN NOODLES CHEESE STICKS COOKING MUKBANG チャパグリ チーズスティック 咀嚼音 짜파구리 먹방 EATING SOUNDS,/watch?v=cadtuEIkBkM,133814,Jimmy ASMR,1030000,3か月前,656751,20
ASMR MAGNUM MALTESERS CHOCOLATE ICE CREAM MUKBANG チョコレートアイスクリームモルティザス咀嚼音 초콜릿 먹방Cokelat EATING SOUNDS,/watch?v=qe6XdlsZRTU,471067,Jimmy ASMR,1030000,3か月前,656751,72
ASMR DOUBLE CHEESEBURGERS FRIES SHRIMP ONION RING MUKBANG チーズ ハンバーガー エビフライ 咀嚼音 치즈버거 먹방 EATING SOUNDS,/watch?v=_FtkPD4HHa4,145795,Jimmy ASMR,1030000,3か月前,656751,22
ASMR MAGNUM HAAGEN-DAZS CHOCOLATE ICE CREAM MUKBANG チョコレートアイスクリーム 咀嚼音 아이스크림 먹방 Es krim EATING SOUNDS,/watch?v=L0YkuL0yUns,523339,Jimmy ASMR,1030000,3か月前,656751,80
ASMR CHEESY CORN DOGS MOZZARELLA MUKBANG ホットドッグ チーズ 咀嚼音 명랑핫도그 체다 치즈 소스 먹방 热狗 ฮอทดอก  EATING SOUNDS,/watch?v=4X21Z3HeemI,181926,Jimmy ASMR,1030000,3か月前,656751,28
ASMR MAGNUM CHOCOLATE ICE CREAM DESSERT MUKBANG 초콜릿아이스크림 먹방チョコレートアイスクリームデザート咀嚼音Es krim EATING SOUNDS,/watch?v=dTkLMEvNGf8,395807,Jimmy ASMR,1030000,3か月前,656751,60
ASMR GIANT SAUSAGE HOT DOG CHEESE SAUCE COOKING MUKBANG ソーセージチーズホットドッグ咀嚼音 소세지 먹방 Sosis EATING SOUNDS,/watch?v=7Ta7NP7VEWs,144776,Jimmy ASMR,1030000,3か月前,656751,22
