title,url,view,channel_name,channel_subscriber,create_stamp,mean_view,mean_comparison
ASMR ROPE JELLY CANDY MUKBANG DESSERT CRUNCHY 너드 로프 젤리 사탕 먹방 ロープゼリー NO TALKING EATING SOUNDS,/watch?v=mFkZcQLB9A4,28355,Jimmy ASMR,1030000,8か月前,656751,4
ASMR SPICY SEAFOOD BOIL SHRIMP OCTOPUS MUKBANG 마라 해물찜 새우 낙지 먹방 ヘムルチム NO TALKING EATING SOUNDS,/watch?v=JZuwlyKLUVE,19414,Jimmy ASMR,1030000,8か月前,656751,3
ASMR GIANT SALMON SUSHI NUCLEAR FIRE SAUCE MUKBANG 대왕연어초밥 핵불닭소스 먹방 サーモン寿司 NO TALKING EATING SOUNDS,/watch?v=IirEeYpkNsc,7404,Jimmy ASMR,1030000,8か月前,656751,1
ASMR RAW SHRIMP NUCLEAR FIRE SAUCE MUKBANG 생새우 핵불닭소스 먹방 生えび NO TALKING EATING SOUNDS,/watch?v=TGirgAqyHZM,61567,Jimmy ASMR,1030000,8か月前,656751,9
"ASMR SPICY MEAT SPAGHETTI FIRE NOODLES, KIELBASA SAUSAGE 미트 스파게티 불닭볶음면, 킬바사 소세지 먹방 EATING SOUNDS",/watch?v=Ruk9NRx0iEY,12720,Jimmy ASMR,1030000,8か月前,656751,2
ASMR RAW SALMON SASHIMI (GOLD) + NUCLEAR FIRE SAUCE MUKBANG 통연어 + 핵불닭소스 먹방 NO TALKING EATING SOUNDS,/watch?v=eSD_4PgfiJ8,6152,Jimmy ASMR,1030000,8か月前,656751,1
ASMR TANGHULU GOLD CANDIED FRUITS 황금 딸기 탕후루 먹방 NO TALKING EATING SOUNDS,/watch?v=jennlyqrFs8,6597,Jimmy ASMR,1030000,8か月前,656751,1
ASMR SALMON SASHIMI MUKBANG 연어 꼬치 먹방 NO TALKING EATING SOUNDS,/watch?v=G8INqz-TE-4,13173,Jimmy ASMR,1030000,8か月前,656751,2
ASMR GOLD PORK BELLY CHUNK KIMCHI CHEESE SAUCE MUKBANG 황금 통삼겹살 김치 치즈소스 먹방 NO TALKING EATING SOUNDS,/watch?v=LkvutDA9TBA,15899,Jimmy ASMR,1030000,8か月前,656751,2
ASMR TANGHULU CANDIED STRAWBERRIES RECIPE MUKBANG 딸기 탕후루 먹방 레시피 NO TALKING COOKING EATING SOUNDS,/watch?v=gpMwEtzHa4I,24020,Jimmy ASMR,1030000,8か月前,656751,4
ASMR MALTESERS CHOCOLATE BALLS OREO CEREAL MUKBANG 몰티져스 초콜릿 오레오 오븐홈런볼 먹방 NO TALKING EATING SOUNDS,/watch?v=XZYkGop2C9E,56557,Jimmy ASMR,1030000,8か月前,656751,9
ASMR SPICY ENOKI MUSHROOMS MUKBANG COOKING NUCLEAR FIRE SAUCE 핵불닭 마라 버섯 먹방 NO TALKING EATING SOUNDS,/watch?v=TFyUnLQabKI,110024,Jimmy ASMR,1030000,8か月前,656751,17
ASMR KOREAN SPICY NOODLES OCTOPUS KIELBASA SAUSAGE MUKBANG 라면 킬바사 소세지 낙지 먹방 NO TALKING EATING SOUNDS,/watch?v=mdd1EL25OMM,13628,Jimmy ASMR,1030000,8か月前,656751,2
ASMR RAW BEEF TARTARE ABALONE SASHIMI MUKBANG SEAFOOD CRUNCHY 육회 전복 회 먹방 NO TALKING EATING SOUNDS,/watch?v=GBH7isFcxBg,14578,Jimmy ASMR,1030000,8か月前,656751,2
ASMR  SPICY MARINATED RAW CRAB RICE SEAFOOD MUKBANG 양념게장 밥 김 먹방 NO TALKING EATING SOUNDS,/watch?v=Xn-xoHf73Xc,9471,Jimmy ASMR,1030000,8か月前,656751,1
ASMR HONEYCOMB HASH BROWN NUCLEAR FIRE CORN DOG PIZZA MUKBANG 벌집꿀 핫도그 피자 먹방 NO TALKING EATING SOUNDS,/watch?v=Icz8lYus0dk,48223,Jimmy ASMR,1030000,8か月前,656751,7
ASMR GUMMY JELLY STRAWBERRY CANDIED FRUITS TANGHULU 지구젤리 딸기 탕후루 먹방 NO TALKING COOKING EATING SOUNDS,/watch?v=pZWzUvtZNjc,14742,Jimmy ASMR,1030000,8か月前,656751,2
"ASMR FRESH RAW OYSTER, SEAFOOD MUKBANG 석화, 굴 먹방 NO TALKING EATING SOUNDS",/watch?v=ZbQEXEyw6m4,17666,Jimmy ASMR,1030000,8か月前,656751,3
ASMR CHOCOLATE NUTELLA ICE CREAM MACARON CAKE CHOCOLATE BARS MUKBANG 초콜릿 먹방 NO TALKING EATING SOUNDS,/watch?v=mEBkS8Ti33I,400123,Jimmy ASMR,1030000,8か月前,656751,61
ASMR SPICY ENOKI MUSHROOMS MUKBANG 핵불닭 팽이버섯 먹방 NUCLEAR FIRE SAUCE NO TALKING COOKING  EATING SOUNDS,/watch?v=vcjLkXvfqqg,56562,Jimmy ASMR,1030000,9か月前,656751,9
ASMR NUCLEAR FIRE STRETCHY CHEESE CHICKEN WINGS MUKBANG 핵불닭치즈퐁듀 치킨윙 NO TALKING COOKING EATING SOUNDS,/watch?v=apiHCIvkk3k,14856,Jimmy ASMR,1030000,9か月前,656751,2
ASMR BLACK BEAN FIRE NOODLES + CHEESY SPAM MUKBANG 짜장불닭볶음면 + 통스팸 먹방 NO TALKING COOKING EATING SOUNDS,/watch?v=PNyFXQb_BrQ,22085,Jimmy ASMR,1030000,9か月前,656751,3
ASMR MOZZARELLA CHEESE STICKS HASH BROWNS FRIED CHICKEN MUKBANG 해쉬브라운 치킨 먹방 NO TALKING EATING SOUNDS,/watch?v=euSWNJDsWI4,12518,Jimmy ASMR,1030000,9か月前,656751,2
ASMR SALMON SASHIMI & NUCLEAR FIRE SAUCE MUKBANG RAW SEAFOOD 연어 & 핵불닭소스 먹방 NO TALKING EATING SOUNDS,/watch?v=m1tVjz17UcE,28403,Jimmy ASMR,1030000,9か月前,656751,4
"ASMR BLACK BEAN NOODLES, FRIED CHICKEN MUKBANG 짜파게티 BBQ 황금올리브 닭다리 치킨 먹방 NO TALKING EATING SOUNDS",/watch?v=7m2XbJ0WGqw,13186,Jimmy ASMR,1030000,9か月前,656751,2
ASMR SALMON NOODLES MUKBANG RAW SEAFOOD 연어국수 먹방 NO TALKING COOKING + EATING SOUNDS REAL SOUND,/watch?v=0HyOsd1FWWM,10381,Jimmy ASMR,1030000,9か月前,656751,2
ASMR CHICKEN BREAST + MOZZARELLA CHEESE MUKBANG 닭가슴살 + 모짜렐라 치즈 먹방 NO TALKING COOKING + EATING SOUNDS,/watch?v=nItJsOmzrY0,10454,Jimmy ASMR,1030000,9か月前,656751,2
ASMR SHRIMP COCKTAIL MUKBANG 칵테일 새우 먹방 NO TALKING REAL SOUND EATING SOUNDS,/watch?v=Wzao_Ou5Pxo,20938,Jimmy ASMR,1030000,9か月前,656751,3
ASMR ROASTED CHEESE MUKBANG 구워먹는 치즈 먹방 NO TALKING COOKING EATING SOUNDS,/watch?v=Ee4qGcRP6Dc,51481,Jimmy ASMR,1030000,9か月前,656751,8
ASMR NUCLEAR FIRE NOODLES CHALLENGE MUKBANG 핵불닭볶음면 먹방 챌린지 NO TALKING COOKING EATING SOUNDS,/watch?v=D1D9bdN_UKU,143301,Jimmy ASMR,1030000,9か月前,656751,22
ASMR WHOLE ROTISSERIE CHICKEN MUKBANG 옛날통닭 전기구이 통닭 로티세리 치킨 먹방 NO TALKING EATING SOUNDS REAL SOUND,/watch?v=yiRM9rAPQIE,11376,Jimmy ASMR,1030000,9か月前,656751,2
ASMR KIELBASA SAUSAGE CHEESY MUKBANG COOKING 킬바사 소세지 먹방 치즈소스 NO TALKING EATING SOUNDS REAL SOUND,/watch?v=e2Q8XdQNSYE,898569,Jimmy ASMR,1030000,9か月前,656751,137
ASMR CHEESY HASH BROWNS MUKBANG CRUNCHY 해쉬브라운 먹방 치즈소스 NO TALKING COOKING & EATING SOUNDS REAL SOUND,/watch?v=IOInle7EQ4U,105801,Jimmy ASMR,1030000,9か月前,656751,16
ASMR CHEESY FRIED CHICKEN BBQ MUKBANG 황금올리브 닭다리 치킨 먹방 치즈소스 NO TALKING EATING SOUNDS,/watch?v=NdjA7jYjhOI,20673,Jimmy ASMR,1030000,9か月前,656751,3
"ASMR MCDONALDS vs BURGER KING, BIG MAC vs MONSTER WHOPPER MUKBANG 먹방 NO TALKING EATING SOUNDS",/watch?v=3RKpYKetyGI,18866,Jimmy ASMR,1030000,10か月前,656751,3
ASMR RAW SALMON + SAUCE RAW SHRIMP MUKBANG 연어회 간장 새우장 먹방 NO TALKING EATING SOUNDS,/watch?v=I-NjBCGVENU,171447,Jimmy ASMR,1030000,10か月前,656751,26
"ASMR CHEESE BALLS, CHEESE FRIES REAL SOUND MUKBANG 뿌링치즈볼 먹방 NO TALKING (EATING SOUNDS)",/watch?v=f2TOpTok18Y,27454,Jimmy ASMR,1030000,10か月前,656751,4
"ASMR MOZZARELLA CORN DOGS + SPICY FIRE SAUCE MUKBANG, 명랑핫도그 + 불닭소스 먹방 NO TALKING (EATING SOUNDS)",/watch?v=PuL6psdOiLU,27075,Jimmy ASMR,1030000,10か月前,656751,4
"ASMR BLACK BEEN NOODLES + KIMCHI, JJAPAGHETTI MUKBANG 짜파게티 + 파김치 먹방 NO TALKING (EATING SOUNDS)",/watch?v=Ut7Qfjy_V9Y,26892,Jimmy ASMR,1030000,10か月前,656751,4
