title,url,view,channel_name,channel_subscriber,create_stamp,mean_view,mean_comparison
モザンビークがめっちゃ強いという誤情報をコメントで総ツッコミされてしまうころさん【APEX】,/watch?v=3Vx6ThtYCcY,6077,Vtuber L,,,23465,26
アカペラでもめっっっちゃうまくてずっと聴いていたくなるトワ様の歌声,/watch?v=CCrJrc65Wl8,2623,Vtuber L,,,23465,11
家の中では裸エプロンで過ごしているアルス・アルマル,/watch?v=89nDhQNYwks,2549,Vtuber L,,,23465,11
恋愛において関わらない方がいい人達を的確に切り捨てていく郡道先生,/watch?v=MKGF4GY2tBQ,914,Vtuber L,,,23465,4
ホロライブハウスで寝ちゃったかなたんを写真に収める桐生ココ,/watch?v=lQhIvHSv62U,3124,Vtuber L,,,23465,13
オフで会った時の行動が可愛いあくあ先輩,/watch?v=EMy6PbZ077Y,181732,Vtuber L,,,23465,774
お風呂の温度は43℃が普通だと思っていた百鬼あやめ,/watch?v=26sFz9BGIiI,73008,Vtuber L,,,23465,311
まつり先輩とノエル団長の胸を揉むマリン船長,/watch?v=npjh6ItdeSA,2743,Vtuber L,,,23465,12
欲望に任せていけない部分を連打しているのがバレてしまうアッキーナ,/watch?v=04UH2xoZ2w8,1734,Vtuber L,,,23465,7
同居時のお風呂事情について,/watch?v=dYyADR8EdyI,2889,Vtuber L,,,23465,12
除霊のことに関しては口出しを許さない椎名唯華,/watch?v=TJcZM49jh5A,6472,Vtuber L,,,23465,28
お散歩中に自粛警察からイタズラをされちゃう野良猫,/watch?v=khlL68K6pQI,2729,Vtuber L,,,23465,12
時をかけるさくらみこ。GoogleMapでホロメンと出会う【in 秋葉原】,/watch?v=luY1stZXwxY,1862,Vtuber L,,,23465,8
自信満々でバレバレの嘘をつくルーナ姫,/watch?v=2r4Up_NIN60,42958,Vtuber L,,,23465,183
『夢の中で走っても前に進まないやつ』を解明してしまった月ノ美兎,/watch?v=Uz6QIG7q-4g,2693,Vtuber L,,,23465,11
ホロライブのオーディションを受けたきっかけを語る,/watch?v=bzsYPt2JMyQ,77218,Vtuber L,,,23465,329
アイドルとは・・・？,/watch?v=0KbXi7x0-98,307,Vtuber L,,,23465,1
【嘔吐注意】自分のゲロをメルカリで売ろうとするアイドル,/watch?v=vcyVX8HX2Kc,59698,Vtuber L,,,23465,254
【APEX】こ　こ　は　激　戦　区,/watch?v=L_F3JdfLavU,846,Vtuber L,,,23465,4
【不破湊】メンヘラに刺されたホスト,/watch?v=Umxt8EfEliw,19858,Vtuber L,,,23465,85
リスナーの温かい言葉に思わず涙する会長,/watch?v=BClC7D9lIuo,31640,Vtuber L,,,23465,135
個人勢時代にホロライブのオーディションを受けたすいちゃん,/watch?v=YNy4ZnF1RVw,66019,Vtuber L,,,23465,281
【神回】芸人魂で完璧なオチを披露する天音かなた,/watch?v=lmly5lq4CpE,2520,Vtuber L,,,23465,11
"【あさココ】ころねの裏社会講座まとめ【3月,4月分】",/watch?v=I-B_Cq-d4gI,31971,Vtuber L,,,23465,136
【ホラゲ】絶叫するしぃしぃを見て爆笑する夜見れな,/watch?v=xRN3M0ZLTN8,1939,Vtuber L,,,23465,8
会長「一級はマジ意味わかんない」「一生使わない単語がいっぱい」,/watch?v=m_Sun2_6cZY,173815,Vtuber L,,,23465,741
多忙によりエゴサができなくなってしまった船長とぺこら,/watch?v=PhfIYKuOkEw,1244,Vtuber L,,,23465,5
リスナーに圧をかけて統率をとるシオンちゃん,/watch?v=OdoA52x6Qqs,791,Vtuber L,,,23465,3
設定画面でフォントを晒されてしまう本間ひまわり,/watch?v=KmsAQk-PpOQ,1515,Vtuber L,,,23465,6
早瀬とシェリンからのサプライズプレゼントが超クオリティ＆エモの塊すぎる,/watch?v=GVvrGpuJCt0,4269,Vtuber L,,,23465,18
オオカミの物まねでピンチを切り抜ける大神,/watch?v=gCvRZGwLNuE,955,Vtuber L,,,23465,4
アニメ『プリコネR』の主人公が気に食わないみこち,/watch?v=pG8xRCep4Yw,2720,Vtuber L,,,23465,12
【ASMR】突然マイクを食べだして口の中の音まで聞かせてくれるノエル団長,/watch?v=JRXpp7P-o9Q,269448,Vtuber L,,,23465,1148
かなるしのもじぴったん好きなシーン,/watch?v=RMmV31NhdKU,2277,Vtuber L,,,23465,10
戌亥のにじ3Dを心配するアンジュ / Twitterのトレンドでイニエスタと張り合うリゼ皇女,/watch?v=K9BOT9CPfnM,1990,Vtuber L,,,23465,8
美容系YouTuberを目指すココ会長をコメントで煽る天音かなた,/watch?v=2nxCxuNR59I,31383,Vtuber L,,,23465,134
過去に『G』の襲撃に遭っていたことを告白する百鬼あやめ,/watch?v=Gf1d_Ua_AGU,3380,Vtuber L,,,23465,14
フレアのことが好き過ぎなのがバレバレなのに認めようとしないフブキちゃん,/watch?v=UfvohcAMwXY,101288,Vtuber L,,,23465,432
【ロア虐】みんなに見捨てられて幽霊と一緒に締め出されるロアちゃん,/watch?v=ywpKlW4fJxA,1380,Vtuber L,,,23465,6
新衣装を考えていたらアーマーを着させられそうになるシスター・クレア,/watch?v=0bICvtHv0Pc,2125,Vtuber L,,,23465,9
幸運ウサギの『はぐれメタル』3連戦！,/watch?v=VA0BO2s3EjU,1865,Vtuber L,,,23465,8
ミオちゃんと見るAmazonの超高額商品のネタレビューが面白い,/watch?v=apsfI8UGhPQ,84372,Vtuber L,,,23465,360
フレアからの手紙に隠されたメッセージに気づかず大興奮のノエル団長,/watch?v=wL4fObMo7YI,1228,Vtuber L,,,23465,5
リリ先輩の隠し事を聞き出そうとするも、某ハッカーのタレコミにより逆に秘密をばらされてしまう雪城眞尋,/watch?v=kxD5z3ykN9s,92342,Vtuber L,,,23465,394
【PUBG】野良で出会った愉快な仲間と共にドン勝するゴーミーズ,/watch?v=1nAJP7RdA6c,170,Vtuber L,,,23465,1
買おうか迷っていたエロゲの会社が解散しショックを隠せないでび様,/watch?v=Gr9fjbBY4-Q,1650,Vtuber L,,,23465,7
推しのベッドにマーキングする限界化キツネ【白上フブキ】,/watch?v=a1Aaq9wq-Q0,6924,Vtuber L,,,23465,30
とてもアイドルとは思えない回答を披露してしまう夏色まつりちゃん,/watch?v=Ru_Xqit0KAM,2754,Vtuber L,,,23465,12
【LOL】モラハラ彼氏（叶）に監禁されるうちにドンドン依存していくでびでび・でびる,/watch?v=h8cpK8I2Mjc,3057,Vtuber L,,,23465,13
浮気を心配するノエル団長を一撃で鎮めるイケメンフレア,/watch?v=T1uBmt0vjik,4339,Vtuber L,,,23465,18
陽キャ集団に「イカ臭い」と言われてしまった陰キャ団長が取った行動とは・・・。,/watch?v=GHvwK6JucjE,2357,Vtuber L,,,23465,10
『るしあさんとネコちゃん』のおもしろ可愛いエピソード3本立て！,/watch?v=ypU6u40lZTk,805,Vtuber L,,,23465,3
フブキちゃんの『雑ココASMR』がこれはこれでアリ,/watch?v=cNjXiyqdd0w,732,Vtuber L,,,23465,3
【APEX】ヘムロック厄介おじさんと最強の仲間たちでプラチナ帯を無双する,/watch?v=Tr1crTSZod0,220689,Vtuber L,,,23465,941
ロリコンガチ勢の夏色まつりちゃん,/watch?v=0-X35-nyguw,136450,Vtuber L,,,23465,582
本人の知らない所で深い名言を生み出していた社築,/watch?v=IRxmbmJvpyA,459,Vtuber L,,,23465,2
【てぇてぇ】グイグイ来る積極的なすいちゃんにたじたじになるルシファア,/watch?v=fU7qxaLjnWg,2835,Vtuber L,,,23465,12
ライン越えしたお兄ちゃんリスナーにブチギレる家長むぎ,/watch?v=UDG8jvSNr-U,2991,Vtuber L,,,23465,13
心を無にするもタヌキに分からせられて連続台パンするエクス・アルビオ,/watch?v=VKJDp-RyFCI,212,Vtuber L,,,23465,1
【スプラトゥーン2】段々と噛み合っていくしぃしぃとイブラヒム,/watch?v=1TaipEumGrA,547,Vtuber L,,,23465,2
ラストでお目当ての子を引き当てて大興奮のアンジュ・カトリーナ,/watch?v=S3a6NTvqbqo,425,Vtuber L,,,23465,2
みんなにずっと言いたかったこと,/watch?v=VXM8Bymhv9w,214,Vtuber L,,,23465,1
お互いの台本にう〇ちを書き合う【月ノ美兎/白上フブキ】,/watch?v=64cj-pyO-es,472,Vtuber L,,,23465,2
【スプラトゥーン2】女性陣に裏切られがちなエクス・アルビオ,/watch?v=j7GLxmrEXpc,5161,Vtuber L,,,23465,22
脳死しててもかわいいルーナ姫,/watch?v=0r1xnEvQzbE,1574,Vtuber L,,,23465,7
にじレジ㈱でスルーされがちな花畑チャイカ,/watch?v=01xQa8PgNNs,1222,Vtuber L,,,23465,5
萌え声姫プで囲われたいマリン船長,/watch?v=td36t5nDV8g,1868,Vtuber L,,,23465,8
ほんひまちゃんとメンヘラちゃん似すぎ問題,/watch?v=xTabspL52DA,405,Vtuber L,,,23465,2
神岡家の二人を凸待ちに誘った結果・・・,/watch?v=r_-pwRwlTwA,2036,Vtuber L,,,23465,9
天音かなた絵描き歌3連発！,/watch?v=YbJ_DzkT3Og,1035,Vtuber L,,,23465,4
ギリギリのところでプレミを許されるフレン,/watch?v=-OXb-fQ4a1E,544,Vtuber L,,,23465,2
溢れ出るサイコ感,/watch?v=XCPVlBUAxf4,199,Vtuber L,,,23465,1
世界大戦級の争いの中心で回り続けることしかできないみこち,/watch?v=R0Nc6Ah1T0U,2913,Vtuber L,,,23465,12
ライバーを始めてからめちゃくちゃ健康体になっていた鈴原るる,/watch?v=c5xmpP7SrLI,402,Vtuber L,,,23465,2
『VIO脱毛』で9万円無駄にしていたココ会長,/watch?v=PkWEeIJBfVs,33777,Vtuber L,,,23465,144
一年間ガマンしていた『にじさんじレジスタンス』に対する衝撃の思いを口にする椎名唯華,/watch?v=LlfwMKQXP6s,730,Vtuber L,,,23465,3
50万人の節目にウクレレで『Moon!!』を披露する月ノ美兎がエモい,/watch?v=0LU5WGHhxhQ,1667,Vtuber L,,,23465,7
謎の男女の声が放送に乗ってしまいメンヘラ化するコメント欄,/watch?v=9HrirdyHXRg,2394,Vtuber L,,,23465,10
夜見にゴミカスと言われてしまう葉加瀬,/watch?v=4Jy8D6-yBtw,769,Vtuber L,,,23465,3
宝鐘マリン『高校の時に好きだった女』まとめ,/watch?v=YfSSzV9wTd8,4004,Vtuber L,,,23465,17
狐であることに疑問を持ち始めるフブキちゃん,/watch?v=vWVck5MGcQU,827,Vtuber L,,,23465,4
夜見とでびちゃんの「勝った！勝った！」可愛すぎる,/watch?v=1uFwffvttRI,1491,Vtuber L,,,23465,6
はあちゃま、ちょろかった,/watch?v=sA3A4yam96k,535,Vtuber L,,,23465,2
【PUBG】大会で『ドン勝』するサクラトナチームとその様子を観戦しながら応援するクロノワチーム,/watch?v=8GFiPuH46xs,1125,Vtuber L,,,23465,5
新衣装で見る本間ひまわりのお腹周り！！,/watch?v=zuwMjpze9Ic,476,Vtuber L,,,23465,2
フレアのめっちゃ似てる『ケロロ軍曹』の声真似！！,/watch?v=oY_33KUKXLY,171661,Vtuber L,,,23465,732
福井県でのエ〇漫画の人気検索タグが『サキュバス』だと知り、まんざらでもない【魔界ノりりむ】,/watch?v=enLe8QIvxag,409,Vtuber L,,,23465,2
ちゅ〜るハイになり大暴れするタイガ君,/watch?v=-goZaTXfsCM,76595,Vtuber L,,,23465,326
先輩の立ち絵を並べて学園生活を妄想するリゼ皇女,/watch?v=EdNV-83CIM4,205,Vtuber L,,,23465,1
あくあちゃんのARK配信について質問するココ会長,/watch?v=foMAEGxSeXw,5231,Vtuber L,,,23465,22
