title,url,view,channel_name,channel_subscriber,create_stamp,mean_view,mean_comparison
11連休になった干物女の外出自粛生活,/watch?v=-inByKzhy94,6193,あいかわまゆ,2300,3か月前,61835,10
おうちでぼっち焼肉【へたくそASMR】,/watch?v=0lgHuQGIqRw,2670,あいかわまゆ,2300,3か月前,61835,4
暇つぶしにダルゴナ作ったらえらいことになった,/watch?v=7FMhsfrh4Kk,6707,あいかわまゆ,2300,3か月前,61835,11
更生した(?)ズボラ女の夜勤ルーティン,/watch?v=4C2mcS4Mtng,16855,あいかわまゆ,2300,3か月前,61835,27
工場勤務女子の夜勤明けの休日の過ごし方,/watch?v=2S2Hc8K2Sl0,62501,あいかわまゆ,2300,4か月前,61835,101
工場勤務女子の愛車紹介とお給料公開,/watch?v=AfbeJTiqkRI,74607,あいかわまゆ,2300,4か月前,61835,121
有給なのでひとりでドライブしてきた in 静岡,/watch?v=78yGt4qfOtw,11825,あいかわまゆ,2300,4か月前,61835,19
工場勤務女子の平日ルーティン【昼勤編】,/watch?v=WnN3HwCVZBU,174354,あいかわまゆ,2300,4か月前,61835,282
ズボラ女の平日ルーティン【工場勤務夜勤編】,/watch?v=5p91ye_iMzY,200799,あいかわまゆ,2300,5か月前,61835,325
