title,url,view,channel_name,channel_subscriber,create_stamp,mean_view,mean_comparison
音フェチ メイクポーチ タッピング make pouch ASMR,/watch?v=WATauY9FD1g,87511,にんじん。音フェチ。,14900,2か月前,668564,13
音フェチ マスカラ make ASMR,/watch?v=Oz58-o0_r8Q,41201,にんじん。音フェチ。,14900,3か月前,668564,6
音フェチ メイク make up ASMR,/watch?v=zJ_0w5Xop-k,311545,にんじん。音フェチ。,14900,5か月前,668564,47
マスカラの音＆リップを塗る音(囁き),/watch?v=aFMIqAgc7Nk,311138,にんじん。音フェチ。,14900,2年前,668564,47
『音フェチ』コスメ収納紹介,/watch?v=cpqywkA7doE,119848,にんじん。音フェチ。,14900,2年前,668564,18
・音フェチ・メイク・,/watch?v=PihHvejXyLc,3140138,にんじん。音フェチ。,14900,2年前,668564,470
