title,url,view,channel_name,channel_subscriber,create_stamp,mean_view,mean_comparison
猫部屋の作り方,/watch?v=ms1lkGVkiUM,6394,茶とらーずカレッジ,12900,6日前,14956,43
猫が去勢手術、避妊手術するメリット・デメリット,/watch?v=RYHp4TZtW6E,6700,茶とらーずカレッジ,12900,1週間前,14956,45
猫が留守番中に何してるか心配で見守りカメラを設置します TP-Link Tapo C200,/watch?v=rAYYIeCRfi0,1883,茶とらーずカレッジ,12900,1週間前,14956,13
キャットフードの真実,/watch?v=SS_Podwi7Yo,6821,茶とらーずカレッジ,12900,2週間前,14956,46
猫クイズ何問正解出来たか教えてね,/watch?v=8UHCRA4ViYU,2840,茶とらーずカレッジ,12900,3週間前,14956,19
猫は運動音痴である,/watch?v=RzhaOCD9Hu8,3352,茶とらーずカレッジ,12900,1か月前,14956,22
猫を飼って寝る時間がなくなりました,/watch?v=h_JNs4qbvm8,10792,茶とらーずカレッジ,12900,1か月前,14956,72
猫をしつけてはいけません,/watch?v=Lof_Z8TBYMY,34023,茶とらーずカレッジ,12900,1か月前,14956,227
猫から「いいね」をもらう10個の方法👍🔟,/watch?v=LTDN9DwO9v4,9093,茶とらーずカレッジ,12900,1か月前,14956,61
デオトイレの特徴ともっと安く運用する方法【2020年版】,/watch?v=BukgPZfPxLs,8037,茶とらーずカレッジ,12900,2か月前,14956,54
猫を飼うのに向いてない人の特徴,/watch?v=cWb4PSqlTDU,123159,茶とらーずカレッジ,12900,2か月前,14956,823
猫を飼って後悔しています,/watch?v=jVu1a1QM5_s,22967,茶とらーずカレッジ,12900,2か月前,14956,154
最強の電動オモチャで猫も飼い主もどハマりする理由 [4K],/watch?v=japRe98c8fs,2426,茶とらーずカレッジ,12900,2か月前,14956,16
【猫の不思議な話】この行動にはこんな意味があったのか？猫には幽霊が見えるなど！納得の解説6選！,/watch?v=0Sj4UuIXYUU,11155,茶とらーずカレッジ,12900,2か月前,14956,75
【これが重要】猫を飼う方へ基本を徹底解説するので絶対に見てね 【後編】[4K],/watch?v=KNfMtD9DYWU,8851,茶とらーずカレッジ,12900,2か月前,14956,59
【初心者必見】猫の飼い方の基本を徹底解説 【前編】[4K],/watch?v=N7f-G1iuGfM,24079,茶とらーずカレッジ,12900,3か月前,14956,161
【危険】水をうまく飲めない猫に飲ませる工夫をするには3つの原因から対策し挑戦しよう！ [4K],/watch?v=zWHqJ9ot8CM,10067,茶とらーずカレッジ,12900,3か月前,14956,67
家庭で出来る猫の健康診断で病気を早期発見する方法 [4K],/watch?v=aHj5pK8iQ7U,7680,茶とらーずカレッジ,12900,3か月前,14956,51
圧倒的に安い猫砂！木質ペレットが凄すぎておすすめな理由と使い方を解説 [4K],/watch?v=eTzS4ePUQSk,54387,茶とらーずカレッジ,12900,3か月前,14956,364
猫のトイレのしつけ方や粗相の原因と対策を徹底解説 [4K],/watch?v=Nm7HWfOsbzE,12458,茶とらーずカレッジ,12900,3か月前,14956,83
猫が長生きするには安心できる環境づくりが必要！,/watch?v=ZDR7SBZV9Xs,8123,茶とらーずカレッジ,12900,3か月前,14956,54
猫を飼うのをオススメしない10個の理由 [4K],/watch?v=VMSJc1yjC58,388458,茶とらーずカレッジ,12900,3か月前,14956,2597
「大切なお知らせ」茶とらーずから告知 [4K],/watch?v=j6dWWuNOzfY,1463,茶とらーずカレッジ,12900,3か月前,14956,10
もう安心！新型コロナウイルス感染者の犬や猫などを無償で預かる「 #StayAnicom 」プロジェクトをアニコムが開始！[4K60fps],/watch?v=x2Hsujr-99E,1149,茶とらーずカレッジ,12900,3か月前,14956,8
【簡単】爪切りで暴れる猫におすすめの方法！どこまで切る必要があるか解説！[4K],/watch?v=y5zDqoEutHU,11535,茶とらーずカレッジ,12900,3か月前,14956,77
【しつけ】猫がテーブルの上に乗って物を落とす理由と対策 [4K],/watch?v=FJ297D3y3Hk,21603,茶とらーずカレッジ,12900,4か月前,14956,144
【要確認】新型コロナウイルスは犬や猫と人の間でうつるのか？東京都獣医師会の情報 [4K],/watch?v=W2ZfqxqDF8g,3186,茶とらーずカレッジ,12900,4か月前,14956,21
飼うなら守って！一人暮らしで猫の飼い方！正直おすすめしないけど、失敗や後悔しないように考えて下さい！[4K],/watch?v=NlaDX3kuWjk,78352,茶とらーずカレッジ,12900,4か月前,14956,524
猫の血便、原因と対策を解説します！痔ではなくアレが問題 [4K],/watch?v=XSXhncaypSw,2907,茶とらーずカレッジ,12900,4か月前,14956,19
新米飼い主は何をする？仔猫を迎えた日の過ごし方は●●させる事が大切 [4K],/watch?v=m1ld-QcjWqo,12004,茶とらーずカレッジ,12900,5か月前,14956,80
【徹底解説】そのサビ猫のイメージ間違ってます！性格や特徴、魅力を語ります！ [4K],/watch?v=RSYdJYJMSb8,9515,茶とらーずカレッジ,12900,5か月前,14956,64
春に夏バテ？実は猫は暖かくなってくる春が苦手でデリケートな季節 [4K],/watch?v=QBVl68BX26k,4903,茶とらーずカレッジ,12900,5か月前,14956,33
【解説】10日ぶりに会うのに腕にくっついて離れない子猫！[4K],/watch?v=phW3JiMEm38,4115,茶とらーずカレッジ,12900,5か月前,14956,28
【DIY】賃貸でも出来るキャットウォークの足場を手作りしました！作り方を解説します [4K],/watch?v=3oDl7YfKjro,10306,茶とらーずカレッジ,12900,5か月前,14956,69
1度使ったら辞められない自動給餌器のメリット・デメリットと災害対策にオススメの理由[4K],/watch?v=VbE2cdqN1J0,2830,茶とらーずカレッジ,12900,5か月前,14956,19
まだお店で買ってるの？猫の餌を最安値で手に入れるテクニックを紹介！,/watch?v=szMfKBnVl0w,6418,茶とらーずカレッジ,12900,6か月前,14956,43
猫にお風呂は不要な3つの理由と汚れた場合の入れ方を紹介 [4K],/watch?v=blfZx10wAro,12847,茶とらーずカレッジ,12900,6か月前,14956,86
【対策】ニオイ・運転操作・空調が重要！猫が車酔いをする原因！ご飯はどれくらい前に済ませると良いのか？ [4K],/watch?v=_-mbx0F0_ys,1587,茶とらーずカレッジ,12900,6か月前,14956,11
【勝間和代】猫を飼うと健康で癒やされ生きがいになる【徹底解説】 [4K],/watch?v=-WaUbMg6CqY,1852,茶とらーずカレッジ,12900,7か月前,14956,12
【解説】気持ち良い理由、効果、怒る、嫌がることもある！猫の尻尾の付け根やお尻をトントン叩くと良いヒミツとは！ [4K],/watch?v=OUp0b08MFPY,6965,茶とらーずカレッジ,12900,7か月前,14956,47
猫の目やにの取り方！お利口なマロン！アナタはどうやって取ってる？ [4K],/watch?v=AwX5S0dZLbQ,2562,茶とらーずカレッジ,12900,7か月前,14956,17
人は分け与えたい本能があるから犬や猫などのペットを飼いたいと思う。衝撃の理由に納得！[4K],/watch?v=XsFi5Rt_y0U,1654,茶とらーずカレッジ,12900,7か月前,14956,11
猫のトイレのお世話でやってはいけないこと！失敗すると粗相の原因に！,/watch?v=p53seyzpFrc,15226,茶とらーずカレッジ,12900,7か月前,14956,102
猫がストレスを感じている？飼い主のNGな行動で病気や体調を崩します！サインはある？解消する方法は？ [4K],/watch?v=Gprg9f6zxjA,6879,茶とらーずカレッジ,12900,8か月前,14956,46
ヒルズの下部尿路結石療法食の違いを解説！ s/dとc/dマルチケアとコンフォート、メタボリックス＋ユリナリーとは何なのか？ [4K],/watch?v=69L0Fmy1N0s,1265,茶とらーずカレッジ,12900,8か月前,14956,8
猫を飼うために必要なもの、飼い方を全て紹介！8項目の不安を取り除こう！[4K],/watch?v=WZt-F__x_Bk,122825,茶とらーずカレッジ,12900,8か月前,14956,821
猫は冬の寒さ対策が必要な理由と暖房などで注意すること [4K],/watch?v=csoUmvKD0IU,6984,茶とらーずカレッジ,12900,8か月前,14956,47
猫のブラッシングのやり方や効果、ブラシの選び方や特徴を紹介！,/watch?v=20iNXiHPAlM,10598,茶とらーずカレッジ,12900,8か月前,14956,71
【危険食品】猫が食べてはいけないものが多すぎて何も食べれない件 [4K],/watch?v=gTW5OzBvKN4,2822,茶とらーずカレッジ,12900,9か月前,14956,19
猫を飼うための環境づくりを7つ紹介します [4K],/watch?v=4VON1byfYMo,9956,茶とらーずカレッジ,12900,10か月前,14956,67
猫の選び方、これから飼う方へ後悔しない選択！性別・年齢・猫種・毛の柄による性格や特徴を紹介 [4K],/watch?v=dC5UmLaVd8s,140986,茶とらーずカレッジ,12900,10か月前,14956,943
快適ワイドのデオトイレ買ったらデカすぎてヤバイ！サイズなど本体セットのレビューします！,/watch?v=wu1jfT2G9m0,4091,茶とらーずカレッジ,12900,10か月前,14956,27
オヤツ食べ放題で一心不乱！いなばの猫用おやつ 焼かつお バラエティ 36本入を購入して来ました！茶トラ猫の茶々とマロンの食べっぷりは？ [4K],/watch?v=hIYIuHhos4w,1946,茶とらーずカレッジ,12900,10か月前,14956,13
猫のヒゲを切るとどうなる？幸運を招く1本のレア黒ひげ！髭の色が変化する理由や役割を紹介します！[4K],/watch?v=eOotkP6tXd0,1807,茶とらーずカレッジ,12900,10か月前,14956,12
もっと撫でて～からの豹変する茶トラ猫マロン [4K],/watch?v=3YmSQWb1rEg,1123,茶とらーずカレッジ,12900,10か月前,14956,8
猫を外飼いするメリット・デメリット！田舎あるあるですが病気以外にも沢山の問題があります [4K],/watch?v=zCcSVuwKG6k,2698,茶とらーずカレッジ,12900,11か月前,14956,18
猫が爪とぎを使う意味5つの理由と壁で研がないしつけを紹介します [4K],/watch?v=LRzdZK14uDM,7321,茶とらーずカレッジ,12900,11か月前,14956,49
猫がかわいい理由をマジメに分析してみた！それは猫の癒し効果があるから！ [4K],/watch?v=t5ZhGtMEPdg,1743,茶とらーずカレッジ,12900,11か月前,14956,12
ぴかおさんの茶トラ猫 茶々丸くんがマロンに似ていて親近感！先住白猫ユキちゃんとの相性が…,/watch?v=qUK6uIkRCsk,659,茶とらーずカレッジ,12900,11か月前,14956,4
猫のトイレ臭う？何個必要？猫砂散らばる？洗うと使わない？疑問や質問にお答えします！[4K],/watch?v=y5rn8PNpzD0,10358,茶とらーずカレッジ,12900,11か月前,14956,69
お返事する姿が可愛い！半野良生活の茶トラ猫おあんちゃんを紹介します！,/watch?v=Ni1GF1WkuPc,1037,茶とらーずカレッジ,12900,11か月前,14956,7
この猫の種類は何？マーブルとママさんの安全で快適な生活するための工夫などを紹介するチャンネル！,/watch?v=g7j67SL16XQ,672,茶とらーずカレッジ,12900,11か月前,14956,4
キャッチボールする猫が可愛い！yoko Cha-ta さんの茶トラ猫 茶太くんを紹介！チャンネル登録3000人記念企画 [4K],/watch?v=TXiRNDMlJzU,857,茶とらーずカレッジ,12900,1年前,14956,6
N国党の茶とらーずがカナガンを不買運動！？ニュートロに戻した理由を2つ話します [4K60fps],/watch?v=RYJOVy_KE-A,1417,茶とらーずカレッジ,12900,1年前,14956,9
【ASMR】猫草を食べる咀嚼音 The sound of a cat eating grass [4K],/watch?v=DsK05ia6usM,1865,茶とらーずカレッジ,12900,1年前,14956,12
猫草を食べる必要性はあるの？理由は吐くため？４つ諸説ありますが食べなくても問題ありません！ [4K60fps],/watch?v=WDgaxUMuYPQ,3898,茶とらーずカレッジ,12900,1年前,14956,26
猫の熱中症になると起こる症状と対策,/watch?v=mCAq7OsvTNg,1985,茶とらーずカレッジ,12900,1年前,14956,13
猫がふみふみする意味は母猫の乳を出しやすくするため！大きくなってもやる理由としなくなった訳 [4K60fps],/watch?v=UdrI7p4xXQA,1312,茶とらーずカレッジ,12900,1年前,14956,9
茶トラ猫の茶々がエリザベスカラー嫌がってストレスを感じているようなので外します [4K60fps],/watch?v=V5CcnWfnuBI,1341,茶とらーずカレッジ,12900,1年前,14956,9
猫の目が腫れていたので病院へ！原因は2つの可能性！目薬で切り分けし、エリザベスカラーで掻かないように対処！ [4K60fps],/watch?v=gilhe_0SKio,1761,茶とらーずカレッジ,12900,1年前,14956,12
猫が針金を誤飲したので病院に！便と一緒に出てきて元気ですが、その時の様子や詰まった場合の症状をお伝えします【ビニールタイ】[4K],/watch?v=mDUR-hflvOY,2523,茶とらーずカレッジ,12900,1年前,14956,17
【悪評】カナガンの噂は一部本当ですが試してみる価値のあるキャットフードです【臭い・下痢・ステマ・食いつき】[4K60fps],/watch?v=Con6eJoCWKQ,5304,茶とらーずカレッジ,12900,1年前,14956,35
【評価】カナガンはストルバイト結石に対応している表記はないですが配慮されているキャットフードです！ただし肝臓が弱った高齢猫には注意が必要！[4K60fps],/watch?v=H5F-Nh6SGBE,1814,茶とらーずカレッジ,12900,1年前,14956,12
猫を多頭飼い！相性が良い悪い組合せを6個紹介しますが、個々の性格にもよります！[4K60fps],/watch?v=rvMQ7ZRF0z8,11872,茶とらーずカレッジ,12900,1年前,14956,79
猫の多頭飼いをオススメします！なぜならメリットが3つあるからです！ [4K60fps],/watch?v=Oc9cV2MfnR8,8336,茶とらーずカレッジ,12900,1年前,14956,56
茶トラ猫の歴史や起源、３つの特徴を紹介します [4K],/watch?v=HFxG5NObIzI,14553,茶とらーずカレッジ,12900,1年前,14956,97
猫が長時間寝ている理由を知っていますか？（茶トラ猫マロンのゴロゴロ音がBGM♪） [4K60fps],/watch?v=W6N1EWbhPo0,1228,茶とらーずカレッジ,12900,1年前,14956,8
返しと脚付きで高さがあって水が飲みやすい器を開封レビュー！猫壱ウォーターボウルを茶トラ猫の茶々とマロンに誕生日プレゼント！ [4K],/watch?v=bllnEogp34I,1652,茶とらーずカレッジ,12900,1年前,14956,11
茶とらーずオススメの猫ブラシを紹介！各ブラシのメリット・デメリットとは？ [4K],/watch?v=SMhz8e_50Iw,3150,茶とらーずカレッジ,12900,1年前,14956,21
花粉やPM2.5などに効果があるHEPAフィルター付き小型の空気清浄機を開封レビュー！猫を飼ってる方にも！Dreamegg CF-8010 [4K],/watch?v=kcXlgTx09wk,1765,茶とらーずカレッジ,12900,1年前,14956,12
猫がなぜ毛繕いをするのか理由を知ってますか？茶トラ猫マロンに顔モフしてグルーミングさせてみた！ [4K],/watch?v=eh_nse-DQkg,2180,茶とらーずカレッジ,12900,1年前,14956,15
猫用ペットケージの組み立て方法を紹介 アイリスオーヤマ PEC-903 [4K],/watch?v=0_ZemXlgU6o,4678,茶とらーずカレッジ,12900,1年前,14956,31
【覚醒】猫の爪とぎソファー型を茶トラ猫の茶々とマロンに使わせたらトンデモナイことになった！ [4K],/watch?v=teElz2ckzU4,3793,茶とらーずカレッジ,12900,1年前,14956,25
シャンプータオルがお風呂代わり！茶トラ猫の茶々とマロンは嫌がる？抱っこする使い方で綺麗にしたけど、最後はやっぱり毛繕い！ [4K],/watch?v=nzDaiA8KD04,2938,茶とらーずカレッジ,12900,1年前,14956,20
【お知らせ】茶トラ猫の茶々♂とマロン♀の間に子供が出来ました！[4K],/watch?v=PY41qhtbC1c,3721,茶とらーずカレッジ,12900,1年前,14956,25
猫を飼う時ケージも購入する必要がありますか？茶とらーず家の考えを回答します！ [4K],/watch?v=y2d-SWO0zTw,39511,茶とらーずカレッジ,12900,1年前,14956,264
ペットゲージの下段にトイレと餌の皿を起きたいけどどうしたら良い？質問に回答します 【アイリスオーヤマ(PEC-903)】 [4K],/watch?v=HNs5GJJhIIw,9222,茶とらーずカレッジ,12900,1年前,14956,62
耳掃除のやり方はウェットティッシュで簡単！茶トラ猫の茶々とマロンに耳掻きしてみた！ [4K60fps],/watch?v=-41zY1XHUsI,1649,茶とらーずカレッジ,12900,1年前,14956,11
野良猫に近付く方法！逃げる猫の警戒心を解くための３つのポイント！,/watch?v=Wn0qepNY_kI,16301,茶とらーずカレッジ,12900,1年前,14956,109
茶トラ猫 茶々とマロンの1日を撮影してみた！茶とらーずの日常 [4K60fps],/watch?v=yNGhVxPNRxk,6885,茶とらーずカレッジ,12900,1年前,14956,46
猫が他の猫の首を噛む4つの理由と止めさせる方法 [4K60fps],/watch?v=bdOpywzOyy8,5408,茶とらーずカレッジ,12900,1年前,14956,36
アイリスオーヤマの猫用ペットケージのトレイやハンモックのサイズについて詳しく説明します！【PEC-903】 [4K60fps],/watch?v=z5ZcgUzWa3E,7031,茶とらーずカレッジ,12900,1年前,14956,47
モンプチのオヤツ！クリスピーキッス ターキー＆チキンセレクトを茶トラ猫の茶々とマロンに食べさせたら一瞬で無くなった！ [4K60fps],/watch?v=9jmWK9SyNGQ,1335,茶とらーずカレッジ,12900,1年前,14956,9
人から猫にインフルエンザはうつるのか？原因や症状は？媒介する可能性？ [4K],/watch?v=409Ze6ZIZ5s,1050,茶とらーずカレッジ,12900,1年前,14956,7
まるで小顔ローラーなマッサージでコロコロして茶トラ猫の茶々とマロンを全身癒そうとした結果 Cat Massage roller [4K60fps],/watch?v=GR8BgCcd7fA,1122,茶とらーずカレッジ,12900,1年前,14956,8
ねこじゃすりの使い方は簡単！毛繕いされているような癒し効果！嫌がる茶トラ猫の茶々とコツはマロンのように慣れること！ [4K60fps],/watch?v=VAKrl3OpkIU,1436,茶とらーずカレッジ,12900,1年前,14956,10
クシャミ連発！猫風邪の種類と病気か見極める７つのポイント！鼻血や鼻水には注意 [4K60fps],/watch?v=lvsR_yLPDgU,22816,茶とらーずカレッジ,12900,1年前,14956,153
ねこ用福袋で失敗したオモチャなど3つ紹介 茶トラ猫の茶々とマロンにはお気に召さなかったようです [4K60fps],/watch?v=OY3EOGTihSA,3648,茶とらーずカレッジ,12900,1年前,14956,24
冬にオススメのあったかヒーター猫鍋はホットカーペットよりも優しい温度で低温やけどにも配慮されてて最高でした CT-339 [4K],/watch?v=GZwYim10HhA,7823,茶とらーずカレッジ,12900,1年前,14956,52
猫ちゃんのかつお削り 鰹枯節 鰹節はタンパク質いっぱいでEPAやDHAもあるけど毎日あげるのは気をつけた方が良いかも？ PET EAT PREMIUM [4K60fps],/watch?v=1UypRgJ1h6U,1125,茶とらーずカレッジ,12900,1年前,14956,8
ペット専門店コジマの福袋（2019年）3000円の猫用を開封レビュー！中身は何が入ってるかな？ [4K],/watch?v=M5KwTNpezTo,19638,茶とらーずカレッジ,12900,1年前,14956,131
新年あけましておめでとうございます 茶とらーずの抱負は？ 2019年(平成31年) 元旦 [4K60fps],/watch?v=_52i9zGm1oc,1914,茶とらーずカレッジ,12900,1年前,14956,13
【評価】ニュートロ ナチュラルチョイス 穀物フリー サーモン  猫用の良いところ悪いところ生サーモンやビートパルプについて解説 [4K],/watch?v=2UvXrr1XlOo,2599,茶とらーずカレッジ,12900,1年前,14956,17
猫に毎月(1ヶ月)必要な費用！飼うといくらかかるか？ [4K],/watch?v=JKBZ6_cNnEU,25588,茶とらーずカレッジ,12900,1年前,14956,171
初めて猫を飼うのに必要な初期費用 ～お金はどれくらい必要？～ [4K],/watch?v=BRqoJ6eEnGo,22668,茶とらーずカレッジ,12900,1年前,14956,152
寒い冬はコタツ好きの茶トラ猫の茶々とマロン!でも危険なので電気カーペットを最弱で！ [4K],/watch?v=6IyFdYgB4Pc,1909,茶とらーずカレッジ,12900,1年前,14956,13
初めて猫を迎えたあとに必要なもの、あると良いグッズ8選 [4K],/watch?v=542pGkz1odg,16150,茶とらーずカレッジ,12900,1年前,14956,108
初めて猫を飼うための覚悟と心構え,/watch?v=Cv-chKsn_a4,8349,茶とらーずカレッジ,12900,1年前,14956,56
初めて猫を飼う時、迎え入れるための準備に必要な猫用品 (家に来る当日までに必要なグッズ) [4K],/watch?v=Rl3x-Dk2wXE,96726,茶とらーずカレッジ,12900,1年前,14956,647
寒い冬はこれで寛ぐ！猫や小型犬用の屋根付きハウスベッド PetBed Sサイズ 茶トラ猫の茶々とマロンは入ってくれるかな？アイリスオーヤマ PHJ460  [4K60fps],/watch?v=k94ddmuXy0U,8445,茶とらーずカレッジ,12900,1年前,14956,56
自動ボール遊び！猫のオモチャを開封レビュー！LEEVAN LED Cat Ball USB charge [4K60fps],/watch?v=Du4lk1QKT5c,2584,茶とらーずカレッジ,12900,1年前,14956,17
DIY扉開放！茶トラ猫の茶々とマロンのキッチンへの出入りを解禁します！その理由とは？ [4K60fps],/watch?v=o5o-agQKwrk,1756,茶とらーずカレッジ,12900,1年前,14956,12
簡単操作で3.5Lの大容量の自動給餌器！犬、猫の餌やり機の使い方をレビュー【Wopet】,/watch?v=8H5GwxQcrsU,9864,茶とらーずカレッジ,12900,1年前,14956,66
茶トラ猫マロンが鳴き止まないのであるもので黙らせようとしたら大惨事になった！,/watch?v=uqFEq2pDsHg,2936,茶とらーずカレッジ,12900,1年前,14956,20
ママさん不在！パパ帰宅後の茶トラ猫茶々とマロン様子をまったり撮影しました [4K],/watch?v=dBHyG_cU5Tw,5596,茶とらーずカレッジ,12900,1年前,14956,37
歯ブラシで撫でると母猫に毛繕いされてる感触でマッサージされてるみたいに好きだと聞いたので、これは「ねこじゃすり」不要説だと思ってやってみた結果 [4K],/watch?v=k0WS1IvzzOo,1825,茶とらーずカレッジ,12900,1年前,14956,12
犬猫用ペット手袋ブラシで毛が沢山取れる！グローブ型なのでマッサージも可能な抜け毛取りをレビュー！簡単便利だニャン！[4K],/watch?v=kFDFaz-gPmg,3777,茶とらーずカレッジ,12900,1年前,14956,25
リュックやキャリーなど4通りの使い方が出来る犬と猫用のキャリーバッグ！ 【WOPET】[4K],/watch?v=KRyXWEBmNtI,6590,茶とらーずカレッジ,12900,2年前,14956,44
スマホで操作出来るカメラ付き自動給餌器 (犬・猫) の開封と初期設定レビュー！【WOpet】[4K],/watch?v=tlSsZoJ7f4M,31199,茶とらーずカレッジ,12900,2年前,14956,209
鍵しっぽ 茶トラ猫の茶々の尻尾が曲がった原因と幸運を引っ掛けて招く理由は？ 【Tips】 [4K],/watch?v=ajsjByGIZgA,1807,茶とらーずカレッジ,12900,2年前,14956,12
