title,url,view,channel_name,channel_subscriber,create_stamp,mean_view,mean_comparison
あなたは生のエビを食べることを挑戦しました生のタコ、カニ、エビを食べる,/watch?v=PEgetKs6Kwk,125463,Tôi Ở Đó Khi Bạn Cầ,1120,,70816,177
多くの様々な料理の目と耳で楽しむ！ 💋💋食べ物音コレクションASMR💕💕Themost satisfying eating sound ASMR compilation,/watch?v=SFj39qhwAtE,108469,Tôi Ở Đó Khi Bạn Cầ,1120,,70816,153
【大流行】韓国や中国で流行りの可愛いカラフル氷作ってみた＆男女の囁き声♡ 〜氷の咀嚼音 Crunchy ICE Eating Sound〜【ASMR/音フェチ】,/watch?v=XL2Y2N4hhmI,216104,Tôi Ở Đó Khi Bạn Cầ,1120,,70816,305
中国氷の咀嚼音撮影中に起きた何かが間違って面白い瞬間2018 P4,/watch?v=6BYzlPt6Lwo,29202,Tôi Ở Đó Khi Bạn Cầ,1120,,70816,41
中国氷の咀嚼音撮影中に起きた何かが間違って面白い瞬間2018 P1,/watch?v=n9_QrnNHeHc,24448,Tôi Ở Đó Khi Bạn Cầ,1120,,70816,35
中国で流行しているさまざまな氷の咀嚼音2018 【ASMR】,/watch?v=DqL2yaY0H6I,57180,Tôi Ở Đó Khi Bạn Cầ,1120,,70816,81
액체로 채워진 얼음 먹방 모음 #3,/watch?v=W8u0HRNRNiw,3132,Tôi Ở Đó Khi Bạn Cầ,1120,,70816,4
특이한 먹거리 ASMR. 세계에서 유행하는 다양한 모음 2018,/watch?v=f3h-9IG8SUo,2526,Tôi Ở Đó Khi Bạn Cầ,1120,,70816,4
